location,review,name,user_profile,userloc,rating
ladakh,"the tents were very good, but one problem was they were not well fitted. a small gap between the floor and tents made a lot of cold breeze enter our tents.The staff was warm and very helpful. they provided us with 4 blankets and hot water bags as it was too cold that night. they had excellent service, wonderful food, ultimate tea and lipsmacking pakoras.",nishi_ruchir,/Profile/nishi_ruchir,"Ahmedabad, India",40
ladakh,"Placed meticulously at a distance, it offers panoramic view of the lake, which is better than being placed right next to the lake. The food was delicious and the staff very courteous. Hot water bottles were a much needed respite to escape the bone chilling cold.   Request for specific items for breakfast were duly accommodated. Only downside is lack of a charging point but then who needs to plug their mobile phones or laptops at such a picturesque retreat!",Sandeep L,/Profile/819sandeepl,"Thane, India",50
ladakh,"Wanted to book the property and called them up. out of 4 nos given on the site, 2 does not work and are out of order. When connected, The systems were not working as informed by Shivani. She asked me to send mail to the id given on wedsite which got bounced. I again called up at 2 pm, Someone informed that she is having lunch call later. I again called now, Person who picked up was trying to know why i want to speak to her.. How ridicules..Systems were still down and had very causal attitude. She was giving me one more id for which i refused. I guess they dont need business and are happy with what they get. She should have taken my details and should have called back instead of me calling again and again...POOR",saurabh_east,/Profile/saurabh_east,New Delhi,10
ladakh,"We stayed at Whispering Waves for a night while visiting Pangong Tso, on May 9, 2015. It is set in a very picturesque location. There are about a dozen tented accommodation with attached toilets. The place is very well maintained and the staff is very helpful and cordial. The temperature that night was less than zero and the staff ensured that the windows were sealed properly to block out the cold draft. We were provided with extra blankets, warmers for extra comfort. Early next morning the staff supplied hot water in buckets for use.  Excellent place with very service oriented staff!",Rajeev_bn,/Profile/Rajeev_bn,"Bengaluru, India",50
ladakh,"I visited Pangong lake in June 2014 along with my family. We stayed here for one day , this property is slightly up the hill and around 20 minutes walk from Pangong lake . The rooms were clean and have attached bathroom. Can't imagine a tent could have this kind of facility .The felling was awesome . The hotel staffs were very good and attentive. They provided hot water on our demand . Watching sunset and sipping hot tea was the perfect evening. Later they served dinner which had lots of good dishes . They also prepared non veg dish for us which was informed by our tour planner , Roads Less Travelled . There they arranged campfire at night for all , which we enjoyed a lot with other boarders ,who all were very nice . At morning we got a natural alarm by the voice of migratory",Sreyasi B,/Profile/sreyasib,,50
ladakh,"Visited the property as tour leader with a group of 12 people in the month of August 2014. Simply amazing property with all the basic amenities and semi luxury tents with small sit out area. The food they provide is really mind blowing and delicious. The sunrise views Wow !! Once can actually see the moon & sun at a time if the weather is clear enough. The person owning the property, a great person with simple & helpful nature. Everyone of us just enjoyed the property.   Thank You Camp Whispering Waves !!  Shubham Byond Journeys, Pune",Byond,/Profile/Byond,"Pune, India",50
ladakh,"We were a group of 6 - stayed in this camp for 1 night. To reach the camp you need to pass quite a distance adjacent pangong lake. Which is a good thing as you can enjoy the view that much longer :)!! The camp is about 1-1.5 kms from the lake. It is not very close compared to few other camps that we had seen - nevertheless not too far as well. We had walked up from the lake to the camp one way and did not seem that far. The view from the camp is just amazing! The entire lake and the mountain ranges right in front of the camp balcony! We loved our stay here because of the view! Another amazing point of the camp is the food. The food was simply awesome! The tents are clean, the bathrooms are well set.  There was a camp fire set as well. We definitely enjoyed our stay here!",gayathriiyer86,/Profile/gayathriiyer86,"Gurugram (Gurgaon), India",40
ladakh,"These camps are located in Spagmik at a some distance from the Pangong Lake. The lake, sunrise and moonrise are very well visible from the tents but if you wish to go dip a finger in the chilling water of the lake every now and then, its a 20 minutes walk to the lake. The tents are neat and tidy, the bathrooms are well set up and do not necessarily make you feel that you are in a tented accomodation. The food in the dining hall is good too and the service decent. The staff arranged a bonfire for us when we asked for it at a (not so small) price. There is not much to complain about other than the location which could have been better",ms14_delhi,/Profile/ms14_delhi,"Mumbai, India",40
ladakh,u shud better avoid if u wish to stay near water as it is very far...food was good though.staff was also good...tents were properly maintained.No electricity after 10 . Dinner closes at 8.30 !! non veg food is on request...,vab1582,/Profile/vab1582,"Mumbai, India",40
ladakh,"Went by the reviews on tripadvisor. The place is far from the lake in comparison to others in the vicinity. The bedsheets / table cloth were like, that thy have not been changed in weeks. The staff however did change them after we pointed out . Don't want to sound snobbish , but come on. The first impression took the charm away.",TimaAmrahs,/Profile/TimaAmrahs,"New Delhi, India",10
ladakh,"This was the best part in the whole of my trip . The tents are located slightly above the hill, very basic  room with  attached toilets.  No charging  points in the room so better keep your gadgets charged. No electricity after 10 . Dinner closes at 8.30 !!  This might sound like army rules ... but totally worth it . The tents give you full view of the lake ... sun rises  in front of the tents  its a perfect place to stay . The service is average , food is average , no non veg if not requested and intimated prior to arrival. Nights get supper chilly, the camp stuff serve hot water bags to keep you warm .. and you are going to bless them for that. Best looking tents :) would love to stay in thr forever.",lostdipika,/Profile/lostdipika,Wisconsin,50
ladakh,Camp is around 5-7 min walk from the lake ( there are others that are closer).. View of the lake is amazing from the camp. Overall tents were clean with electricity in the evening and attached bathrooms with hot water available in the morning.. Food was decent n staff was courteous..  Hot water bottles were provided at night and campfire organised on demand..  Overall good place to camp for a night!!,Shruti_lsr,/Profile/Shruti_lsr,"Mumbai, India",40
ladakh,Camp Whispering waves is ill equipped to provide even the basic minimum services a tourist would like to have on a trip to pangong. The tents are unable to provide much protection from the biting cold in the night. There is no bon-fire or any other entertainment and the food is pathetic. Absolutely useless.,Manish672014,/Profile/Manish672014,"Kanpur, India",10
ladakh,"There has been an explosion in tent camps since my earlier visit three years ago, and most are very shabby. This one is slightly better, but has scope for  improvements even within the limitations. The tents were OK. Paths and surroundings could be better maintained. Food is just edible.",Bishwaroop,/Profile/bishwaroopm,"Gurugram (Gurgaon), India",30
ladakh,"Very Nice tent property off the Pangong lake.... You may read the fact that this is a little far from the lake... However, with the kind of terrain and place Pangong is, you would better be a 5 minute hike away from the lake than stay in anything short of the security and convenience this place provides. Lets get to the pros and cons -  Pros 1. Solid tents, quite spacious, good bathrooms, Hot water in the mornings (you cant expect 24hrs hours really in Pangong!) 2. Friendly staff 3. A nice sit-out along with the tents to watch the lake from 4. Quite good food given the place you are in!   Cons 1. Just the 5 minute hike to the lake.... it tested the fitness out of us bed and couch potatoes! 2. This is more of a problem with tents... the whole night huge winds blew and though the",ranaditya,/Profile/ranaditya,"Mumbai, India",40
ladakh,"The first thing that came to our mind during our entry to the premise is...away from the lake. There was no other complain one can make. Of course the expectation should be that of a remote camp and not of some luxurious apartment hotel. Nevertheless, lake can be seen from premise and is just 6 - 7 minute walk / 2 – 3 minute drive. Whispering Waves has the most neat, clean and spacious tents amongst those present around Pangong Lake – the best available in the locality. Even the Jab Tak Hai Jaan crew including SRK and AS stayed in this premise supports my opinion. Food was good in context to the camping location. Tent staff is also friendly and helpful. Hot water, medicines, etc. were easily available. They even claim to have oxygen cylinders for emergency, but touch-wood we",kotharidhimant,/Profile/kotharidhimant,Mumbai,40
ladakh,"I was little bit disappointed when I arrived the camp because I had requested my agent travel (Caper & Hi-Life) for the camp located by the lake, however, people of Camp Whispering Waves are very nice also they cooked very yummy food for BF & dinner. unluckily, i got high altitude sickness during my stay at the camp but felt better in the morning, Hot water was available in the bucket which will be delivered when requested, the toilet was ok and clean, except the towel which all cover by the dust. At night it was very windy i thought the camp would blew away by the wind, but it was strongly set up, don't worry",NateeRLS,/Profile/NateeRLS,BKK,40
ladakh,The view from the tent is great. The facilities in the location are also good. The place inspite of being cold the staff did a good job of providing hot food. The camp is around 250m from the lake but not the ones closet to the lake.  A place recommended to stay in,snarayan83,/Profile/snarayan83,Mumbai,40
ladakh,"The first thing you will notice is these colorful tents in Spangmik, Pangong. A group of 12-15 tents situated side by side, with lake facing tents and the mountains behind makes a wonderful ambiance. The lake is just around 100 meters from the tents. However you can have a good view of the lake even from your tents.  After a long and tiring journey, the staff welcomed us with hot tea/coffee. Very well maintained tents. Rooms were clean and tidy with hot water in toilet. Food served was very tasty and the friendly nature of the staff made our stay more enjoyable. We stayed here for one night and would surely recommend this tents.",snigdhadeep,/Profile/snigdhadeep,"Kolkata, India",50
ladakh,We stayed here as part of Ladakh photography trip organized by Toehold. Great location and awesome views of lake from this camp. This is not on the lake but a 10 minute walk takes you to the shore. Tents are colorful and comfortable. Clean place. Food is very good. This place offers a great location for taking time lapse photography with views of both lakes and mountains. Electricity is switched off at 10:00 PM providing a great view of night sky.,RaviKanniganti,/Profile/RaviKanniganti,"Bengaluru, India",40
ladakh,"We visited this camp on 6th May. It was just the start of the season and the weather was very chilly and windy when we reached the camp after 5 hrs of long journey and a long wating time at Karu. Immediately after reaching they gave us hot Tea and Cofee withs lots of biscuits which warmed us up and we really felt charged up. The dinner and Breakfast, though limited in variety was tasty. The tents were clean and nice. Each tent has direct and clear view of the serene and beatiful Pangong Lake. The night stay and the long travel was worth the every bit of it.  Tips -  1. Many Tourist guides and Taxi drivers suggest to make a day trip to Pangong. But I would highly recommend to have atleast one night stay at Pangong  as that way you can enjoy the ever changing colors of Pangong",Bhavana A,/Profile/BhavanaMumbai,Mumbai,50
ladakh,"We stayed in tents at different locations in Ladakh, this one is the best in terms of location, quality of tents, service, beds, toilets and food. Manager was extremly helpful, specially called an experienced driver to guide us how to drive from Spangmik to Chushul.",amrchopra,/Profile/amrchopra,"Faridabad, India",50
ladakh,"Our 4 hour drive from leh stretched to 6hrs  courtesy two landslides enroute. By the time we reached it here it was past lunch time.But the entire effort is rewarded by the beautiful sight this lake has to offer. Camp whispering waves is situated about 100metres away from the late but it has a good view of the lake.The camp is well maintained, clean and a working toilet with flush.The manager Mr Amit and all the support staff were excellent. Special thanks to Mr Sunil for taking a lot of effort to keep us comfortable.They even provided extra blankets and hot water bottles at night to beat the chilling cold. Even when we arrived late they were courteous enough to make tasty hot pakodas and tea which was really appreciated. Keep up the good work.",jagsmumbai,/Profile/jagsmumbai,"Mumbai, India",50
ladakh,"Clean, nice tented Accomodation. Brightly coloured. Orange and Blue tents facing the serene blue waters of Pangong. Food is good. Not much of room service. Meals served in a central tent. Drive to the tent is very scenic. Love the place and the Accomodation.",Bhubonpothik,/Profile/Bhubonpothik,"Thane, India",50
ladakh,We had a great camping experience at Whispering Waves. The tents are well appointed and offer great views of Pangong Tso. Food was good and the service too was in line with expectations. They provide hot water bags if its cold in the night. It is worth staying in this camp on a visit to Pangong. The nearest good point on the lake is about 2 kms away but the distance is same from all other camps so its not a minus for Whispering Waves.,Amit,/Profile/AmitLahoti,"Mumbai, India",50
ladakh,"We (group of 3) stayed for a night at this Camp. Initially, we were a bit disappointed that the camp was some 7 km away from the place where lake starts. However, it was at a good location along the banks of the lake (within 100m) on the top of a hill. The view was great from the camps. We witnesses moon rise as well as sun rise. Staff was courteous and helpful. Food was awesome. Heard that Jab Tak Hai Jaan actors (SRK and Anushka) stayed at this place. Highly recommended. There are some camps right next to the lake also (within 10m), however am not sure of the experience there.",MunnaT,/Profile/MunnaT,"Mumbai, Maharashtra, India",50
ladakh,"We went to Spangmik on June 04 '13; were booked to stay at Camp Whispering Waves; the Camps are very good with double insulation, attached toilet and bath; hot water is available on call. The staff very couteous; we never had any problem with anything - right from the booking with Camps of Ladakh, Delhi, collecting our vouchers from Mr Abid Ali in Leh, having rooms in conjunction ( we had booked 3 rooms). You can se the mighty Pangong from all rooms The food was pretty good when you think that you are far removed from civilisation - the courtesy and hospitality of the staff was simply fantastic. Most of them have been in Pangong for over 3 years - they will give you friendly advice and also guide you on the best locations for photography. A steaming cup of tea at 05:00 hours at",Shibaji D,/Profile/Shibaji,"Kolkata, India",50
ladakh,"Excellent tented accomodation Pangong Lake can be viewed from the tent sit-out itself.  Extremely windy and chill too. Dinner/Lunch at the dining tent and Tea at the Tea Point Tent.  Hot Dinner and Lunch at specified and only veg. stuff.Cosidering the remote location,commendable effort. People friendly staff and do wake up past midnight to view the stary sky,and get your fill of the sky and identify as many stars ,constellations you can.  Sunrise over the lake is magical and do get up to experience it.  Stay Pangong lake over-noght to get the full feel of the place.",anant b,/Profile/anantbharadwaj,"Mumbai, India",40
ladakh,"Given the extreme temperatures, this campsite does the best it can and more to ensure guests are comfortable. The staff is cheerful and eager to please and are able to make guest feel cared for. They provide hot water bags to make your beds cozy, hot water for drinking and washing, and were kind enough to provide room service when my mom was feeling a bit ill after the drive. Location could be better, in terms if being closer to the lakeside, but this is a minor grouse and this is a fabulous place to stay.",tiamukherjee,/Profile/tiamukherjee,"Hyderabad, India",50
ladakh,The beauty of the Pangong Lake makes you stay out of the tents all the time. Tents are comfortable; hot water is provided by the staff (if required). Restaurant serves delicious meals. Safe during night and you can walk around the area for night photography of stars/moon.,MahipVyas,/Profile/MahipVyas,"San Francisco, California",50
ladakh,We reached here in the afternoon . The staff was extremely hospitable and offered to make some snacks as they saw we were hungry and tired from the journey . The view that you would get from your tent is heavenly. Just nature and you ... Would love to come back to this place again and again,RishabhDoshi,/Profile/RishabhDoshi,"Mumbai, Maharashtra, India",50
ladakh,"My wife and I stayed at Camp Whispering Waves for one night. While I had strong reservations about the nature of the facilities, I was pleasantly surprised. The tents are fairly well appointed and modern and provide reasonable protection from the winds and cold.  They certainly seemed more sturdy than some of the other camps in the region.  The staff at the camp is also very helpful and courteous; it is clear that they have been trained well to be responsive to customers. They were quite helpful when we asked for some rearrangements within the tent, and were also pleasant folk to talk to over a hot cup of tea.  The food was simple yet tasty, with sufficient variety in the course of the meals we had there.  There are some other camps closer to the water (Whispering Waves is not",Arvind C,/Profile/Wanderer_Kaka,"Gurugram (Gurgaon), India",40
ladakh,"Good - very good clean modern tents. The quality of the tents, comforters, camp, etc is very good - one of the best camps on this stretch for sure. The staff is very friendly and willing help. The food was also good. Bad - It is not on the lake, but a little higher up - the lake is a 10 minute walk (in the day it is ok but it is way too cold to do that in the night). In the morning for the sunset you could drive down to a spot they recommend right near the lake.",Nirbhay K,/Profile/NirbhayK_12,"Mumbai, Maharashtra, India",40
ladakh,The best place to stay in Pangong with the whole view of Pangong lake....these tends are brand new with all facilities and best quality tents and food. Even the staff is very friendly and courteous. These tents are at slight elevated position from the lake giving a perfect view compared to some other tents situated towards the bottom.,nippi86,/Profile/nippi86,"Gainesville, Florida",50
ladakh,We stayed inside these tents for a night. Can’t be any better experience staying in tents by Pangong Lake side. The tents are excellent quality and sparkling clean. Attached toilets arrangement is also decent. You can request for hot water in the morning. This is new property started from this year but from next year there will be running hot water from tap using solar energy system. Food will be only vegetarian but tastes good. Staffs were excellent and expert in providing personal touch. They sent hot tea and soup inside the tent as we were lazy to visit dining tent. They also provided hot water bag to keep inside the duvet at night. Only concern I have is the lake is 1 km walking distance from tent compared to their previous property Camp Water Mark was located very near the,Souvik,/Profile/imsouvik,"Kolkata, India",50
ladakh,"A trip to Ladakh is incomplete without a visit to the Pangong Lake and the best place to stay there is to stay in a tented accommodation on the banks of the lake. Camp Whispering Waves is a property of Camps of Ladakh who also have Camp Watermarks. This is a new camp and was in fact set up only a few days before we stayed there in June 2012. In Spangmik village, Whispering Waves is a splash of colour against the barren and overpowering mountains. The camp has attractive and bright orange and blue coloured tents which were visible from a distance. It is a few kilometers away from Shooting Point and the other camps, dhabas and restaurants.  There are 15 Swiss tents in the camp, a separate tent for dining and a small tent in the centre of the camp called Tea Point where they served",SharmeenKhan,/Profile/SharmeenKhan,"New Delhi, India",50
ladakh,Pangong Lake - The most famous 3 idiots movie location. The name of the camp itself represents the quality in its true sense. We can see the lake & its beauty from the camp site itself with mild whispers of the water from LAKE. Service is good & staff are very co-operative. Tents are spacious & clean. Food has a very limited option as all the supplies are dependent on LEH market & hence we have to eat what is available rather than of your choice.,AkkshayJain,/Profile/AkkshayJain,"Mumbai, India",30
ladakh,"Camp Whispering waves is undoubtedly best when it comes to staying in clean tents, with attached toilets, running water (hot on demand), hygeinic and very good food served in a dedicated dining area. It gives you a great view of lake from the tents. The only negative part is it takes a 10 minutes walk from the tents to reach the lake. There are other tents which are right on the bank of the lake. However I didn't find it negative looking at the condition of other tents ( hygiene and quality). During overnight stay in pangong, the wind blows fiercely during night and you would never want to stay in tents which are nearest to the lake but  no strong enough to take the blow of the wind. These tents were warm and we were given beds with thick mattreses and quilt and a blanket over",RoversByte,/Profile/roversbyte,"South Australia, Australia",50
ladakh,"The camp is located on higher ground a little away from the shores of the lake. This does provide a better panaromic view but is a 5 minute walk to lake. The tents are quite comfortable with well appointed toilets. There is a covered sitting area in the tents which is a good idea because of the wind conditions. The food was quite good. However, the staff is a little stiff with a bit of attitude and need better customer communication training. This camp has lights out at 9.30 pm although we noticed that the lights in the other camps was on till at least 10.30 pm. Therefore keep a torch handy.",Sundeep G,/Profile/Sundeep-travelbug,"Bengaluru, India",30
ladakh,"This is located in spangmik village. We stayed here overnight after our bike ride from Leh.   Positives: 1. Great tents with attached bathrooms/toilets 2. Good quality food 3. Very friendly staff 4. Hot water provided on request - for free :)  Negatives: 1. Located a little far from the lake - half to 1km  Overall, I definitely recommend this place for it's cleanliness and staff courtesy.  Cheers! Manju",manjuklr,/Profile/manjuklr,"Bengaluru, India",40
ladakh,"In the interest of disclosure, we were booked to stay here, but opted not to and the review is about reasons why. Since I did not stay there, I cannot state anything about the quality of tents/food etc.  In my opinion, one undertakes the 6-7 hour journey to visit Pangong Tso lake for experiencing the lake and the cool blue waters. This camp is the located farthest from the lake and the lake is not easily accessible for a leisurely evening walk. The camp itself looks colorful and pretty, but that's the least important reason for me. Choosing not to stay at Whispering waves, I was able to procure another camp with brand new tents and good food, but very close to the water (walking/photography/relaxation) without any obstacles to my view of the water (I do not want a view of 20+",Traveldudebug,/Profile/Traveldudebug,"Houston, Texas",30
ladakh,"This is located in spangmik village just near the Pangong Resort (the only constructed property @ pangong lake). this is the property of camps of ladakh team and the quality of tents is best. It is located on the banks of Pangong Lake. When we were approaching spangmik, one can identify these tenst in orange & blue. the colors might change every year.  Awesome property and recommended. :)",ashaym,/Profile/ashaym,"Mumbai, India",50
ladakh,"Great Place to stay at one of the best locations in india, awesome view and amazing service, will be back soon",Amit L,/Profile/AmitL760,"New Delhi, Delhi, India",50
