location,review,name,user_profile,userloc,rating
ladakh,I stayed in the same tent where Shahrukh stayed during #JabtakjainJaan shoot :)   This place has got best view of Pangong from tents..the staff is amazing and food is good. It is about 10 mins walk to the Pangong lake. The tents are comfortable and have a attached bathroom. Best part NO NETWORK in this area so its just you and Nature D We enjoyed our stay..,Anoop Shekhawat,/Profile/AnoopS637,"New Delhi, India",50
ladakh,We loved the view from our camp. Although it was very cold at night but the rooms are well equiped with blankets and clean beds.  The only reaaon i would reccomed the camp is for the mesmerizing view you get from it.  Location is very good.   Staff were very cooperative and always ready to help you.  We enjoyed a lot and will surely choose the camp again for our next stay .,monalisa d,/Profile/Seaside387947,,50
ladakh,This is one of the colorful camps located on Pangong lake bank ffering a clean and comfortable stay. The staffs are very helpful and the common dining tent offer homely good vegetarian food. The rooms have thick mattress and blankets to keep you warm. Toilets are clean but it is advisable not to try and take shower as hot water might not be available in abundance. All rooms offer good view of the lake. The rooms are not equipped with charging points so the phones and other gadgets needs to be taken care in the main dining hall for charging. There is no power supply from 11pm to 6 am in the morning and tents have battery operated lamps to help. Each tent is supplied with 2 hot water bags in the night after dinner to keep the beds warm through the night as this area the temp. can,Priyanka S,/Profile/Pri0103,"Bambolim, India",40
ladakh,We expected the camp site to be closer to the lake however its much on top.. about a 10 mins walk to the lake.. the tents are comfortable and have a attached bathroom.. there is no power during the day so make sure you have your phone/laptop charged in case you plan to use them.. there is only BSNL network available here and no data connectivity at all.. there is one STD PCO very close by in case of emergency.. you can view the lake and mountains.. the staff is very helpful and gave us hot water bags before going to bed in case you get cold at night or your feet hurt from all the walking.. we enjoyed our stay..,bhoomimehta,/Profile/bhoomimehta,"Noida, India",40
ladakh,Camps are amazing...they provide you with hot water bag during your stay which help you keep warm ...food is good...and the staff is very helpful...it is 10 mins away from the main 3idiots point so the stay there is calm and quite,Tanushree A,/Profile/679tanushreea,,50
ladakh,"Camp Whispering Waves was one of the best decisions in our Ladakh tour. The location of the camp facilitates Pangong view from all the tents. In-spite of infrastructural & geographical challenges in Spangmik, the team made us feel very homely & comfortable. Especially the hot-water bag post dinner, to stand the severe cold, was the cherry on the cake! The tents have basic amenities - clean washrooms and fresh linen are assured. The food was good. The staff was helpful. Overall, a great experience!",Makarand_Karve,/Profile/Makarand_Karve,,50
ladakh,"This camp is one of the oldest at Pangong Lake. It is wisely located at a distance from the lake, so as not to affect the immediate environment of the lake (unlike other camps), but with a splendid view of the lake from many of the rooms. The staff are always ready to serve hot water, tea, hot water bags, and even customized breakfast and dinner. Pangong Lake needs to be freed of tourists staying overnight, so that the pristine environment is protected. If tourists must stay, Whispering Waves is one of the better choices, rather than the camps dotting the lakeside.",Joyoti B,/Profile/1712JB12,"Kolkata, India",40
ladakh,"The camps are basic but the lake views are stunning from the camps...wake u and watch the sunrise and sip your cuppa while looking at the lake...where when the sunlight falls, the water shimmers and just gazing at it makes your morning worth every bit. The service is absolutely excellent. Considering how cold it is at Pangong, the staff doesn't fail to amaze you with their courtesy to never say no for anything. Not that I asked for any favours but whatever little like hot tea or hot water bags for the night, hot water buckets in the morning and everything else was taken care of. The food is as one of my friend said is soul food. made with love and served with love.  Would recommend and it's worth to stay at the Pangong lake for sure... so that you can experience the different",KTheTraveller,/Profile/GlobeTrotterrrrrrrr,"New Delhi, India",40
ladakh,Last week visited pangong lake from Leh. Had one night stay at Whispering waves camp. Location was really good. Tent are not so clean and equipped. Require some maintenance. Staff tries hard to serve even in that atmosphere. ,Divyakant Meva,/Profile/DivyakantMeva,"Rajkot, India",30
ladakh,One of the oldest camp site in Pangong. Our stay in said camp was good and memorable. Food was good. Place was also good. Stay only in middle tents - from no 9 to 13. Other new good options are also available so check before booking. Visit Pangong in mid July till Mid August.,Harshu,/Profile/harshhrz,"Ahmedabad, India",40
ladakh,"Good place though little bit further from lake Great hospitality good food excellent staff, Point to note, there is no power in tents after 10 PM To beat the the cold hot water bags are provided Mobile charging facility only in Dinning Tent  Most important , it is better to visit the lake before in the afternoon as it gets quite chilly late evening",Rajsek,/Profile/Rajsek,"Bengaluru, India",40
ladakh,Accomodation and amenities for stay in Pangong are very basic. So do not have high hopes when you read that Jab Tak Hai Jaan crew stayed in this camp.  The lake is 10min away from the camp and it gets really chilly in the evenings.  Be sure to carry lots of warm clothing as there are no options of heater etc while staying in camps.,tsk2011,/Profile/tsk2011,"Mumbai, India",50
ladakh,"The tents are quite well made, nice and cozy from inside. Even when its cold and windy outside, you are warm inside the tents. However the heavy winds makes the tent flutter a lot. They have an attached bathroom and if not asking for too much they do not have hot water in the tap, but they do provide it in a bucket separately. The food and the service is simplistic yet amazing, kudos for that.  The tents are slightly faraway from the lake, almost a 10 min walk but still gives a good lake view.  Actually its quite amazing how in such a faraway place they have managed to provide even this level of service. Living in these tents is an experience by itself.",SheetalSoni,/Profile/SheetalSoni,"Mumbai, India",40
ladakh,"I have visited this place last year, and it was an awesome stay in Camp Whispering Waves.  Probably the best camp in Pangong . Though it is located little bit far away from the lake, but the view is awesome. Tents are well maintained, comfortable and clean. There is attached bath with the provision of hot and cold water.  Foods are really good and served hot. Overall very nice experience.",somsen,/Profile/somsen,"Kolkata, India",50
ladakh,It was a good stay and perhaps the best tents in Pangong but its away from the lake. It takes about 10 mins to walk up to the water. This is not a bad think because you are outside the clutter and it doesn't get as cold as it gets inside the other tents nearer to the water. The place could have been maintained better for the price we paid but then again its hard to access and bring supplies to this place. Overall a good experience. ,aki076,/Profile/akshaygehi,"Mumbai, India",40
ladakh,The camp is equipped with all amenities and bathroom attached. The view from the camp are awesome. Its unforgettable moments while walking along the shores of Pangong Tso. Quite a good spot for watching birds of many kind,jkkartha,/Profile/jkkartha,"Kochi (Cochin), India",40
ladakh,The people in this camp are extremely warm and caring in their approach. I was amazed at the variety of food served in the buffet during dinner and finger licking food.  Stayed with another friend couple in tents 11 and 12 on 22nd June 2017.  The tents are cozy with attached toilets. The best part it is little away from the lake so the breeze is lesser.  The people go the distance to take care of everybody. There was a group that reached the camp at 12:30 am as they had got stuck and the camp people had kept hot food ready for them.  Wishing all the staff at Camp Whispering Waves all the best.,ARICHAK,/Profile/ARICHAK,"Bengaluru, India",50
ladakh,"We were 8 people and hence had bookings in 2 properties 4-4. I stayed in this one and soon other 4 came crying & horrified, disappointed by their property. The property as other in that region have tents ( camping) only but the make of tent and it's service totally separates it from the others . Nice put up tents with toilets attached and outside sit out partially covered which was very essential due to heavy winds always blowing . Also due to the location of the property situated little up hill from the lake , it makes your stay more comfortable, as the ones near the lake are always facing too much winds. A very little compromise on the view but nothing bothered when you're comfortable. Food provided at that level above sea in a remote area with limited electricity was awesome.",vicrathod_4,/Profile/vicrathod_4,"Mumbai, India",50
ladakh,It's one of the most toughest place to live. The weather is a challenge in itself added to it chilly winds that can pierce your bones. The tent is basic but that is the maximum possible at such places. Camp site is at a very good location and gives good view of the lake and the sorrounding mountains. The staff is very courteous and cooperative. They try their best to keep you comfortable. Serve nice warm food dot on time,Ramanand67,/Profile/Ramanand67,"Ahmedabad, Gujarat, India",40
ladakh,"Good camps, good food and courteous staff. A group member forgot cell phone at the camp, the owner drove back to Leh to return it. Amazing honest and dedication to customers. Highly recommended if staying overnight.",V2R2travel,/Profile/V2R2travel,"London, United Kingdom",50
ladakh,"The tents were very clean, had an attached washroom and their food and service was excellent too. They gave us hot water bags and extra blankets at night to keep ourselves warm. I would definitely recommend this place if you want to stay in Pangong .",kanan p,/Profile/626kananp,,40
ladakh,"We visited this place in may. Fortunately when we reached weather was Sunny and had delicious lunch.they provided​ proper extra bed for my son. Dinner was also good. Little far from lake ,so If u want proper view some tents r there just infront of lake.dining room showcases photos of Anushka and SRK during jab tak hai Jaan shooting. Otherwise it is like all other camps in this area",ARPITA N SHAH,/Profile/ARPITAnshah,"Ahmedabad, India",40
ladakh,I stayed here in last year visit booked package through Mountain trails Mr Nitin Laal for Leh  & Ladkah Trip ..i had an awesome experience through out 7 days firstly my ladkah Hotel which they provided got free upgrade and good food after 2 days we left for Pangong  and reached   to this beautiful camp we reached bit late but they had kept for us hot lunch ready ..food was really delicious and the team of the camp was very helpful ..my wife was sick due to long hrs travel but they camp team had all Local remedies .. over all me and my family loved the entire stay in leh & ladkah and recommend all,vinita,/Profile/vinita201,"Mumbai, India",50
ladakh,"We stayed for one night at the camp. It offers excellent panoramic view of the lake. The tents are really strong, has comfy beds and also has a good bathroom. The food is quite good. The nights are really cold, but inside the tent, you would not feel it that much. You can sit outside the tent and stare at the milky way at midnight when lights go off. Its a short walking distance from the lake shore. In fact that is great in a way that you can have a wide panoramic view of the lake. SRK, Anushka Sharma and co stayed during their shooting schedule of Jab Tak Hai Jaan. However they have highly increased their rates recently due to all this hype. This is probably one of the costliest tents in Pangong. Since it was just for a night, we took the experience.",debankar,/Profile/debankar,"Kolkata, India",40
ladakh,On reaching the Camp we were initially disappointed as the lake view is partially blocked by another row of camps in front of same.However the tents were Excellent and service was excellent and the food was excellent considering the limitations of Pangong. The dining tent displays SRK's  during his stay at the camp. Overall a good experience.,ShreyasMalkan,/Profile/ShreyasMalkan,"Mumbai, India",40
ladakh,Went with friends in Sept 16. Awesome tents. Nice food and great service. Some of the things to remember - they serve only veg food and it's the same with other tents in that area. But the food was good. - nights are too cold...around 3 degree during my stay. - electricity is available only for limited hours. - no phones work here. There is a satellite pay phone available just opposite this resort. - carry your own booze.  ,Varun Wadhwa,,Delhi,50
ladakh,"There are alot of camps on the bank of the lake but this is not one of them.  They are about 500 feet away from the lake which is actually an excellent thing.  There have been incidents where the tents on the bank due to the extremely crazy strong winds at night have blown people's tents of.  We faced the similar winds but our tents stood extremely strong.  Very spacious, excellent washrooms,  great service and amazing food.  No complaints at all.  Not very difficult to spot this place and a beautiful view to the lake.  They brought hot water in buckets for us in the morning which was very kind despite the difficult water situations there.  Very Happy with the stay and would highly recommend it ",pabal,,"Toronto, Canada",50
ladakh,"Since this was towards the end of our trip, we had already been in a lot of camps by then. This was average for the price we had paid. There were a lot of other camps with much better proximity to the lake. We had got deals through goibibo. This is the camp where sharukh khan and anushka supposedly stayed during jab tak he jaan shooting but the camp facilities did not live up to the hype.  The breakfast was good. So I would suggest look out for other options if available.",Aparna R,,"Bengaluru, India",30
ladakh,"Welcomed by tea and biscuits and later by a delicious dinner, this group of tents served as my base for the recent Pangong Tso exploration. A dozen staff members oversee these tents with utmost attention to detail.  Electricity is available only between 7 and 10 p.m., but this works rather well. A hot water bag is provided after dinner. The tents withstood the merciless winds with ease. The bucket of hot water provided in the morning was adequate for a quick shower. Considering the remoteness of the area, this is as luxurious as it can get for the price tag.  A ten minute walk down the slope will take you to the edge of the lake. There's no point in staying by the edge as it does get very windy and noisy at night.",Morningsider,,"Brisbane, Australia",50
ladakh,It was the most memorable stay in Pangong with the beautiful view of Pangong Lake one side & back side were mountains with melting ice. And what a moment it was full moon day and I had shoot the time-lapse video of the full moon from the camp. Day were warm and nights were chilly cold an excellent weather.  Let me tell you this are the remote location hence please don't expect much over here. Just stay and relax and be out of the world for a while.,Jay_Priya,,"Mumbai, Maharashtra, India",50
ladakh,"We had booked this place though mr Karunidhi Singh of Mountain trails. it was a breathtaking experience, the camp is located 250 mts from the shore of the pangong lake and the view from there is Breathtaking, the scenes left us baffeled,was like we werent in our senses anymore. it left us wanting for more each time. thanks for memories.",VLS H,/Profile/VLSH1,,40
ladakh,"This is one of those places where just enough facilities are provided and they seem to be luxurious given the location of the property. The place overlooks the majestic pangong tso lake. They have around 10 tents which are quite luxurious.   The staff is over courteous and will go out of their way to fulfil your needs, the food they serve is mind blowing and they also provide hot water bags to beat the cold.  The only negative or positive I do not know was the property is quite far from the actual lake shore, which given the temperatures we had to bear in the night times was actually a boon rather a bane :)",SundeepClive,/Profile/SundeepClive,"Bengaluru, India",50
ladakh,"Location - walking distance from the Pangong Lake Tents - clean, and weather resistant tents. All tents are lake facing. They provide hot water bag in nights to prevent from cold. Its covered completely and is warm inside the tent even at night. All required amenities are available. Bathrooms - Attached bathrooms are clean and decent. They provide hot waters in buckets. Food - Tasty food. For being in a remote area and the food availability being less, the buffet spread was very good.    Staff - very cooperative, friendly and helpful  Their is no mobile signal. They have a one satellite phone. There is no power supply, power is being generated for the village through solar plant and so after 11 pm their is no power.  The location is freezing by evening and the temperature drops",Niks1203,/Profile/Niks1203,"Mumbai, India",50
ladakh,"Did Ladakh trip in aug 2014 in a group of 8 friends. Specially chose Whispering waves Camp, as they are right on the bank of Pangong lake giving spectacular views of Mountain ranges, snow cap mountains and stunning pangong lake. all the tents are facing the lake & wall to wall carpeted. Good air resistant & proofing. As the temperature drops drastically, still you will feel warm and cozy inside. Cleanliness is also maintained.. food was served in a big dining tent and was really good.. its a perfect campsite to stay on Pangong lake when you want uninterrupted view of  the  spectacular Pangong lake.... !!!",sweetneena,/Profile/sweetneena,"Mumbai, India",50
ladakh,"I felt camp is good because pangong is remote area at that area we were getting good services from the camp staff ,The food was really good and the best thing about the camp i.e we were watching the best view of lake from our camp site Me and my friends enjoyed a lot...",artidwivedi196,/Profile/artidwivedi196,"Noida, India",40
ladakh,"it was really a good experience. the camp was very good, and the main thing is service was very good and fast.my camp was near to the lake, and we could see the whole lake from camp.and this was the same camp where sharuk khan was stay at the time of jab tak hai jaan shooting.",vishistbajaj,/Profile/vishistbajaj,"New Delhi, India",50
ladakh,"You have several options to stay in Spangmik and there are several tented accommodation which is bang on the lake, However this one is quite away from the lake and does not makes any intellect to stay away from the lake when in Pangong. Whispering Waves is recommended by all the Tour Operators because Crew of ""3 Idiots"" and ""Jab Tak Hai Jaan""  had stayed in these camp, reason for them to stay at Whispering Waves was not that they were the best, It was because the location of these tents was close to the kitchen setup done by the crew team.",781ankurd,/Profile/781ankurd,"Gurugram (Gurgaon), India",20
ladakh,"If you want to stay in Pangong in Night, then prepare for Cold and Sleepless Night :D. This property doesnt have Hot Water Pipe, but they provide only at morning time. It is not nearby Lake, you have to go some 1 to 2 km. They are other property which is nearby lake. Food Provided by them is decent and good.",KUPPUMANIKANDAN,/Profile/KUPPUMANIKANDAN,,30
ladakh,The camp staff was very courteous.  The best thing of the camp is that they offered  hot tea with snacks after each visit from pangong  lake. They served tasty Gujarati jain food. Camp rooms are well appointed.  Enough bath space and have sufficient  toiletries in this very remote  area. They provide  hot water bag in nights  to prevent from cold. After all it was good experience. ,Dhaval Shah,/Profile/Dhaval78,"Ahmedabad, India",50
ladakh,"What can you expect.. 1 Near a isolated place like pangong lake which is cold and windy. 2 In Spangmik village with population around 200. 3 Where there is no power supply, power is being generated for the village through solar plant of 20kva. 4 Where there is No mobile signal and only one landline.  Then too there is a camp which is providing weather resistent clean tents with attached bathroom n toilet. 24hr water supply. On demand hotwater. Helpful 24hr Service. Emergency night lamps. Tasty food buffet with 3course options. Ala carte food. 2 mins walk to only telephone point.  There should be no doubt that Shahrukh Khan and Anushka Sharma have stayed there and found this camp to be better than others.  Only con I found that its little far from pangong lake and few camps were",Yash,/Profile/4yash,"Colombo, Sri Lanka",50
ladakh,"The camp is located at a higher level than the picturesque Pangong Lakes. All the tents are in one straight line and face the lake. The tents are comfortable, neat and clean.The view of the lake is breath taking.The lake itself is awesome. The crystal clear water which has various shades of blue and green is surprising very clean unlike other lakes in the country. The lake is one of the most beautiful lakes that I have seen across the world.  The facilities at the camp and tents are basic but comfortable. Electricity is available for 3 hours at night but not during the day. Hot water is provided during the morning in buckets.  The food is vegetarian. The taste is good and the dinning area is neat and clean.  The staff is very attentive and always willing to provide all necessary",subir1994,/Profile/subir1994,"New Delhi, India",40
ladakh,- We visited in second week of June and it was super windy and cold - Inside of the tent was not cozy and even the blankets did not help much as a result we were unable to get any sleep throughout the night  - The food (dinner and breakfast) was very good and also the pakoda's in the evening were mouth watering - Tea in morning at 6 was quite refreshing and the staff was very co-operative - I would recommend this place to be visited on not so cold days.,Hardik Thakker,/Profile/HThakkerTA,"Pune, India",40
ladakh,"Many camps have spriung up during last couple of years on the pangong lake. This was my first stay at the pangong out of the three trips i have done to pangong. Tents are nice and clean, spacious, lake is a 5 minutes walk from the camps. Food was also very good. Serivce was also good. though i have not tried other options but i would recommend whipering waves.",ParamAnand,/Profile/ParamAnand,"New Delhi, Delhi, India",40
ladakh,I with my wife daughter and with my friends family was in this camp on 4th june. We have reached at 4pm. They greeted with cup of hot teas. These camp having 15 tents  all having awasome view of the majestic pangong lake. All staffs of these camp is very helpful. The dinner was fabulous.  At the height above 14000ft they have server soup  rice chappati two veg dish egg curry and at last even desert. It's fantastic.  Foods are also very much tasty.  They provide hot water bag at night   in the morning bucket full of hot water . Awasome view  unparalleled hospitality make this camp unique.  If I will get another chance to visit pangong I must stay there but not a single day but will try to stay a couple of days. I suggest those who want to go to pangong please stay there otherwise,Krishnendu R,/Profile/198krishnendur,,50
ladakh,"The view is amazing and we just loved our stay. We were 10 people and one of our friend influenced us to stay at Camp Whispering waves. First we all the girls in the group were not so happy by this decision obviously but when we visited the camp, we were impressed by the quality and facilities provided by them. Service was good and the staff was very helpful to us. This was the best experience in tents i've ever had, it was comfortable, had clean toilets and beddings. Also the food was yummy which we didn't expected at this heights, but the food had different flavour and was delicious. I would say if u want to explore nature and have a different experience then you must visit this place.",Anuradha13,/Profile/Anuradha13,,50
ladakh,I visited leh last summer and my experience was made more blissful by RLTGO team who arranged my trip by booking a camp for me and family. It was an amazing experience which i will cherish whole my life. The camps were super and the whole set up was just amazing. Best for the people who want to get away from the usual hotels. The cuisine served was brilliant. I would highly recommend it.,Sahil0086,/Profile/Sahil0086,"Mohali, India",50
ladakh,"What a warm welcome at Camp Whispering Waves, amazing tents with a amazing view n super service with Hot Served food.. Have stayed in couple of more campsites but this one is the Best campsite in that region - Highly recommend.. Feel like going again and again @beautiful Pangong lake ",bhaveshsh26,/Profile/bhaveshsh26,,50
