location,review,name,user_profile,userloc,rating
ladakh,"Rooms in this hotel are fine, though overpriced. Dinner and breakfast were ok too, without being amazing. The hotel is indeed on the bank of the Indus River, unfortunately it's not really possible to enjoy a walk from the hotel without having to walk on the highway to Srinagar (many vehicles including dangerous trucks).",kiki,/Profile/71kiki,,30
ladakh,"A modern hotel overlooking the Indus river, we had an lovely upstairs room with balcony on the river side. Rooms were well appointed although the lack of kettle meant you had to keep asking for tea. Food was ok, buffet style and wifi (along with elsewhere in Ladakh) was patchy. A great base to explore this part of the Indus valley",Richard D,/Profile/Richard54,"Wiltshire, UK",50
ladakh,"I've been traveling to Ladakh since 1989 for work. I've stayed at a lot of hotels there—from high end, luxury places to the straightforward, rustic homestays. Recently I learned from a friend who works in Leh about the Apricot Tree in Nurla. While the location is about an hour from the airport, it is absolutely worth the drive to stay there. Nurla is gorgeous and convenient for day trips to visit Alchi, Saspol, and Lamayuru. It also is at a lower altitude than Leh so you can unwind and acclimatize in an absolutely gorgeous spot, overlooking the Indus River. Owner Wangchuk Tsering Fargo is a terrific host. He artfully balances to caring and attending to his guests while giving them space to take in the quiet beauty of his gorgeous property. Such graciousness is hard to come by",LauraKtraveling,/Profile/LauraKtraveling,,50
ladakh,"I stayed in the Apricot Tree Hotel with one of my sons for two nights and we loved every moment there. After you drive through the eerie and barren Ladakh landscape, you will find this boutique hotel in an oasis of greenery. The location overlooking the Hindus River is exceptional and you can easily go on short or long walks in the area. The decoration is elegant. The rooms are modern and very clean, and the beds are particularly comfortable. The food is excellent too, and we especially liked the lamb momos that the Chef prepared at our request. What made our stay so special was the outstanding hospitality extended by the owner and all his staff. They made us feel like special guests and family all at once. And if you are lucky enough, you will be able to have a drink and enjoy",ericf722,/Profile/ericf722,"Paris, France",50
ladakh,I stayed at Apricot Tree based on great reviews from TripAdvisor. I was not disappointed.  The hotel was nicely located next to the river. The courtyard was beautiful. The service was great and the food was very good.  Each room has private balcony looking into the beautiful river.,trang2010,/Profile/trang2010,"Hillsborough, California",50
ladakh,"Our stay at The Apricot Hotel was booked through a travel agent, and so I didn't really know what to expect when I went there.   A bit of a drive from Leh, but once you get there, you're spellbound. The property is pretty isolated, with an unmatched location, right on the banks of the river Indus, with rooms looking right on top the ever-flowing river, backed by the majestic rocky Himalayas, that change colour at all times of the day with the rising and setting sun.   The place is quaint, clean, spacious, surrounded by tall apricot trees, and the food surpassed my expectations. The staff was uncommonly friendly, and we even met the owner (Wangchuk) who showed us their own patch of organic vegetables!   Make sure to climb up to the terrace in the night, to see a star spangled sky",Chantelle M,/Profile/ChantelleM346,"Mumbai, India",50
ladakh,"We found  heaven in the mountains directly on the Indus River at the Apricot Hotel. In the morning you wake to Leh beautiful sound of the  flowing river. We were happy to see a gleaming black Yak being herded to higher elevation to spend the summer. This place  is filled with exotic birds, dragon flies, designed for relaxation.  a perfect retreat to enjoy lunch on your own balcony in your room.  The food is good the rooms super clean, beds with quality linen and  real boutique soaps and shampoos. The owner Mr Wangchuk Fargo is a great host with a very good staff. This is a place of peaceful communion with nature with all the creature comforts a perfect base outside the bustle of the main city Leh.",drbluebird,/Profile/drbluebird,"San Diego, California",50
ladakh,"We stayed at The Apricot Tree, after visiting Alchi Monastery. A lovely boutique hotel situated on the banks of river Indus. True to its name, it is surrounded by Apricot trees and a beautiful Ladaki architecture is strongly visible in the balconies and dining room of the property. View from the balcony is pretty as a picture post card. And they have a beautiful central courtyard with Apricot trees where you can strike a casual conversation with other fellow travelers . It was a delight to talk to Mr.Fargo, who owns this property and runs an adventure company too. They had a campfire in the night with food and drinks. We were happy to meet and share our experiences with few residents of the Hotel.  Rooms are simple and clean. They do not have heaters, but do provide hot water",Rati05,/Profile/Rathi05,"Hyderabad, India",50
ladakh,"We stayed at the Apricot Tree during our recent holiday in Ladakh. This hotel was an unexpected surprise and we were thrilled to stay there for 3 nights. The guest rooms surrounded a peaceful, central courtyard which was decorated with panoramic photos of Ladakh. Cleverly cut marble floors lined each of the walkways. Our well appointed room led out onto a verandah, decorated in traditional Ladakhi style overlooking an amazing view of the Indus River and across to a lush, vegetated bank below a picturesque, steep rocky mountainside.  Each of our meals was served in the restaurant, once again featuring captivating views across the Indus. The meals were all delicious and very generous, served by attentive, friendly staff. We spent quite a bit of time talking to the owner of the",WendyEW181058,/Profile/WendyEW181058,"Brisbane, Australia",50
ladakh,"There is little competition in this part of Ladakh but that has not impacted the standards. Clean rooms with large terrace offering a great view over the Indus River.   Restaurant is a bit bland.  Unfortunately, you cannot easily walk towards the river from the hotel but have to walk down a large road a couple of hundred meters up to a nice hanging bridge...",pojke-fredde,/Profile/pojke-fredde,"Brussels, Belgium",30
ladakh,What a memorable experience this turned out to be! We booked at Apricot Tree on a friend's recommendation and he obviously wanted to surprise us because he did not reveal too much about it. So we did not expect much but were simply delighted with everything about the hotel - the charming courtyard with the Apricot Trees and the absolutely stunning view of the Indus river from every room. Mr Wangchuk's impeccable taste is evident in the decor as everything has just the right touch of traditional design without being overdone or too kitschy. And the food - delicious! I can still taste the perfect  paneer pakodas we had at tea time and crepes served at breakfast. The ladakhi meal they put together for us was really the best meal we had in the entire Ladakh trip. The location is,parohr,/Profile/parohr,"New Delhi, India",50
ladakh,"I loved my stay at this hotel. The location is absolutely stunning, and the staff is excellent. Right from the front desk, Mr. Tundup, to the proprietor, Mr. Fargo, to all their restaurant staff - they all made us feel like a valued customer, and made our stay so comfortable and relaxing.  We ate dinner at their restaurant. The food and the service was 5 star. They have a really good chef. I wish I could have stayed longer here!",Rc1,/Profile/Lv2Teach,"Sacramento, California",50
ladakh,"One of the most beautiful places I have ever stayed on a holiday. On the banks of river Indus, surrounded by beautiful apricot trees, mulberry and rose bushes and majestic poplars, this is a slice of heaven. The rooms are surprisingly luxurious and comfortable. You can see that every minute detail had been personally addressed. Mr. Wangchuk is a delightful host and I still miss our conversations over the fabulous ginger tea. Another thing to marvel and enjoy is the food. The chef is par excellence and we loved every single meal we had there from Indian to laddakhi to Chinese, everything was delicious. I cant wait to get back to The Apricot Tree Hotel with a pile of books and enjoy the fabulous views, good food and even better hospitality. A must experience on your next trip to",Engee,/Profile/n1120,"Bengaluru, India",50
ladakh,"Great location and hospitality. Excellent staff and chef! Overall a wonderful experience. Mr. Wangchuk has done a fabulous job with the place. Attention to detail, preserving and showcasing Ladakh culture, and focused clientele. He is great company too.   Scenic trekking trails next to the resort. Must visit!   Easy to access. One hour flight from Delhi to Leh and then 90 mins drive from Leh to Nurla. ",VIPNEH,/Profile/VIPNEH,Europe,50
ladakh,"Situated on banks of Indus river is this quite little well-manicured boutique hotel. The well-appointed rooms with exclusive balcony overlooking the Indus river is a visual treat. Minimalist design interweaving the Ladhaki motives gives a sophisticated outlook and adds to the serenity. All ratings for the location. Efficient service. Responsive front desk. No TV in the rooms. Food is ok, nothing special. We ordered for lunch which was a set menu but each dish was separately charged. We were offered dishes which we would never order.  This made entire lunch far from value for money preposition. Tea Coffee machine not available, nor did they have a flask so that give us hot water. Nevertheless, given in kettles. Wi-fi connectivity not functional. Outdated toiletries. Adequate",Avidtraveller68,/Profile/Avidtraveller68,"Pune, India",40
ladakh,"Situated at in the river bank, this hotel gives a beautiful view from the rooms at the back. Its a very beautiful and a quite location. Had a very comfortable stay. Food is good and is an amazing guy.",ChauhanRuchi,/Profile/ChauhanRuchi,"Ghaziabad, India",50
ladakh,We stayed at the Apricot Tree one night en route from Kargil to Leh. We received a very warm welcome from the staff and the view from my room at the back of the hotel was awesome. The food was excellent and my room was very comfortable. My one regret is that I could not stay longer.,gef124,/Profile/gef124,"Dorchester, United Kingdom",50
ladakh,"We stayed for three nights at The Apricot Tree, on the banks of the Indus River in Nurla, about a 90 minute drive from the Leh Airport.  Rooms are spacious and comfortable, with good showers and plenty of hot water.  Staff are very helpful and friendly, and will gladly arrange for visits to monasteries and other attractions in the area.  A great way to start a visit to ALadakh!",JulesLandsman,/Profile/JulesLandsman,"Gypsum, Colorado",50
ladakh,"The best hotel I have found in Ladakh, very spacious and comfortable room with beautiful river view. Great hospitality, food and comfort. I was very happy to have met the owner, he is a really nice person.",plutone23,/Profile/plutone23,"Parma, Italy",50
ladakh,Stay here for one night during my road trip and find it very good place. Room was great and the staff were very polite. Dinner was good and breakfast was awesome there was so many option. Wi-fi was only available near the reception area but this is not a big issue because the place was so awesome and with view like that who need internet. one more thing you can eat apple and apricot fresh from tree,Bablu N,/Profile/bablun,"Amritsar, India",50
ladakh,"Excellent stay , excellent food , very hospitable and very friendly staff .Thank  you for such a lovely stay .excellent location too . Had the best ever mushroom soup , Thupka and Momos .The location next to the indus river adds to scenic beauty and the stay too . Mr wangchok( the owner) made the stay very comfortable and enjoyable too . Best place to acclimatize.",14kavitam,/Profile/14kavitam,,50
ladakh,"6 th Aug morning was disappointing ... got the news will not be able to travel to Pangyong due to Road Closure ... Was suggested to visit Alchi , Lamayuru and with difficulty room was arranged at The Apricot ... went with no expectations .... The place is just WOW ... built simply well maintained .... delicious food friendly staff what else can one ask on a holiday .. will surely be back another day ... THANK you",Sanjay L,/Profile/SanjayL174,,50
ladakh,"Peace, serene Property with tasty Apricots  We did a one night stay at Nurla and enjoyed every bit of it. All the rooms with huge balconies were facing the scenic mountain and the flowing Indus river. No TV in the room supplemented the calm and compose atmosphere.  The rooms and bathrooms were well designed and spacious. In the evening and late night, we sat on the balcony and admired the beautiful mountain under the full moon with the rustling sound of the Indus river flow.  Service was excellent and staff too very courteous. Food too was excellent  As the property was surrounded with sweet and juicy Apricot trees, we all had a stomach full of them.   We had a good evening time with Mr. Wangchuk where he explained the Ladaki culture, his immense knowledge of world travel. A",vmtrek_travel,/Profile/vmtrek_travel,"Igatpuri, India",50
ladakh,Right on the banks of the Indus is this beautiful property  Luxury in the most serene location of Nurla   The balcony offers uninterpreted view of the Indus River among poplar trees and prayer flags with mountains in the background.  its so quite that you can hear the sound of the following Indus river at night.  The restaurant is a gr8 place to have your meals while enjoying the sounds and sights of the indus. Excellent food and service  its a great addition to your itinerary if you look to cover lamayuru from leh or  do a night stay coming from kargil towards leh.,Mithun Vora,/Profile/mithunvora,"South Goa District, India",50
ladakh,This is another lovely decent comfortable hotel  in Nurla I stayed during my Ladakh trip. This boutique hotel is amidst apricot and apple trees with beautiful ladakhi  architectural design. The rooms are large with big balcony overlooking Indus river.,Rashmi B,/Profile/RashmiB32,"Bengaluru, India",50
ladakh,"Beautiful elegant Boutique hotel... Spellbound by the view, The interiors were so well thought and elegant.. at the outset simple calm and bright European style with touches of Ladakh in the rooms. I actually would like to congratuate the architect or interior decorator for having looked into all details including colour schemes.. You actually feel at peace in the environment. The entry area with its open to air ..no ceiling concept helps you feel the fresh crisp air. The decor is so minimalistic yet so capturing... the lovely pictures of Ladakh help you connect to the place while you acclimatise well here. The view from the rooms is outstanding, again the color scheme superb...white to give you relaxation and colourful Ladakhi style wardrobe hidden from sight,, and vibrant hues",meheck,/Profile/meheck,"Mumbai, India",50
ladakh,"The location is gorgeous - it sits alongside Indus River across from a dark mountain. Rooms are rather big, Every balcony has a chairs to sit and unwind. We spent many hours out on our balcony soaking up the surrounds. Mr. Wangchuk and his staff went out of their way to make sure we felt welcome and comforting. Mr. Wangchuk has a incredible level of knowledge about the surrounding area and its history. We went for a walk around the Village on day 2 Morning.",sudipta g,/Profile/Babu366,"Kolkata, India",50
ladakh,"After a hectic journey from Sonmarg, if you do not wish to stay in Kargil, this is an ideal place to be. A 2 nights stay is recommended in this hotel. Its just before Alchi.  Superb location, very quiet place, spacious rooms with a good balcony overlooking the river. Every balcony has a chairs to sit and unwind. The sound of the river flowing is so serene.  I recommend this as the best ever stay in that area.",Raj P,/Profile/drrajparikh,mumbai,50
ladakh,"My partner and I arrived a little too early for the season in Ladakh. Though the area is undeniably beautiful the main supply road was still closed when we arrived, which meant a lack of variety of food and drink, as well as 75% of the cafes, restaurants and hotels being closed during our stay.  Our discovery of The Apricot Tree, then, was provided much needed respite. The location is gorgeous - it sits alongside a glacial, icy blue Indus River across from a dark mountain. We spent many hours out on our balcony soaking up the surrounds.  Wangchuk and his staff went out of their way to make sure we felt welcome and comforting. Wangchuk has a incredible level of knowledge about the surrounding area and its history. When he sensed my interest he loaned me a couple of photography",lachlanrdale,/Profile/lachlanrdale,"Sydney, Australia",50
ladakh,"Ladakhi style hotel with a wonderful position overlooking the Indus river. Rooms are rather big with a great view, there is a beautiful patio and the property is surrounded, needless to say, by apricot trees.The owner gave us a lot of helpful tips and suggestions. Good food and friendly staff,  The place to stay to relax and visit the area.",Albe,/Profile/Albe839,"Milan, Italy",50
ladakh,"Beautiful Ladakhi style hotel with rooms around a patio central. Beautiful well  maintained grounds with flowers  and vegetables growing . The rooms are large, very clean ,well decorated, everything works ,great bathrooms , all with balcony facing  the River Indus. Staff efficient and courteous. Food was excellent. This place is peaceful , easy to find and a great stop on the way to  Lamayuru. Wifi on/off as in all Ladakh.",nicole j,/Profile/203nicolej,"San Francisco, California",50
ladakh,"Great great hotel  ...  It's on the way to Lamayuru, facing the Indus River. About an hour and a half from the airport , at an altitude of 2600 m ( a tad lower than leh ) Would serve as an excellent place to acclimatise.  We found this amazing gem on the way to Lamarayu and if i had to start elaborating on all the goodness of this place, i would probably need to write a book !  So here we go , quick short summary.  1. Beautiful hotel, aesthetically done, very well appointed rooms with balcony overlooking the indus river and the lovely glass windows that offer a spectacular view from the bed . Great washrooms with hot water and lovely toiletries ( i normally carry my own, but i tried theirs and they were awesome ! )  2. Very courteous and helpful staff. Food can blow your mind ,",Vasundhara_Awasthi,/Profile/Vasundhara_Awasthi,"Singapore, Singapore",50
ladakh,"The Apricot tree is on the NH1 highway between Leh and Kargil, more importantly it is perched on the Indus river a little outside Nurla village. It's the sort of place I would stay at regardless of the hotel, just because of how scenic it is and how easily you can find trails to walk around it. That said The Apricot tree exceeds expectations. The staff is helpful, the rooms are tastefully done and the beds are surprisingly comfortable. The apricot tree is a very pretty hotel, well maintained and done up.",Ishaan P,/Profile/889ishaanp,,50
ladakh,"A really strategically placed property about 100 clicks off Leh for an offbeat relaxed luxury stay. All the rooms are  nicely done up with an attached balcony that opens right in front of the mighty Indus.   What I really liked about this place was its serene location, quiet surroundings and no TV, that made us spend more time with our family and friends.   The staff is great and helpful with as much they can do for their guests with limited resources.  It seems that this place follows European style meal timings with no flexibility as such. Though this works great for hotels with sightseeing opportunities around where people leave early and come back to sleep after dinner. This property has been beautifully built mainly for relaxation so buffet timings should also be flexible.",Abhey Thareja,/Profile/abheythareja,"Noida, India",40
ladakh,"We visited Apricot tree in July beginning with a big group. The property quite well constructed and maintained. The corridors, restaurant, common area are all big and spacious. Though the best marks go tor the rooms which come with a private balcony offering uninterrupted view of the Indus and the surrounding mountains. We stayed here 2 nights and it was absolute recuperation for the entire group. The staff is very friendly but didn't  seem to be very happy to see Indian guests. Customized to suit the European taste, it did get a bit inconvenient when we were told that the buffet breakfast is available only till 8.30 am. Difficult to convince a group which is on vacation. But do visit this place for a quiet and luxurious experience.",high_fever,/Profile/high_fever,"New Delhi, India",50
ladakh,"The perfect place for some peace and quite time, and to just get away from it all.  Beautiful location overlooking the river Indus and surrounded by mountains. A small property and so not bustling with people. The rooms are large and spacious and have their own private balconies with a view of the river.  The hotel is built in traditional Ladakhi style with modern amenities.   The Apricot Tree hotel is located of the Srinagar- Leh highway, the location is ideal to explore lower Ladakh without going back and forth from Leh.",Monisha A,/Profile/Monisha1964,"Mumbai, India",50
ladakh,"Amazing place! Beautiful property with magnificent scenic beauty. If in Ule, worth staying in Apricot tree. Has stayed for one night along with friends and family everyone like the place. However since being new hotel they need to be more customer centric which I feel the entire team lacks very badly. I had a detail discussion with the resort owner that it's an excellent property just ensure your staff from receptionist to Chef focus more on hospitality rather than standard approach ""No"".Food spread was very limited and so do the overall service.  I hope with experience service level will improve and it will become  the best property to stay in Ule.",Shiten,/Profile/Shiten,"Mumbai, India",40
ladakh,"If you need some peace and quiet with  killer view of the Indus then this is the place to be. Located in the middle of nowhere (Srinagar - Leh Highway) almost 1km from Nurla Apricot tress is recently built right on the banks of river Indus. The hotel has a beautiful property and even the area nearby is very picturesque. The rooms are very spacious with lot of natural light. Almost every room has a balcony which open to the banks of Indus river. No TV. YAY. The bathrooms are also very clean and spacious. However, there is no exhaust. The food was really good. We had Indian food and some noodles and they were quite sumptuous. The hotel is recently (some 4-5 years) done by Mr. Wanchuk who is very helpful and speaks Ladakhi, Hindi, English and German comfortably. He was very helpful",Neeti G,/Profile/whimsicaly,"Oslo, Norway",40
ladakh,"Located on Srinagar Leh Highway this is a new place.  The property is beautiful and tastefully done in terms of surroundings , architecture , well staffed also . All this considering that one is in the middle of no where ( 100 km ) from Leh in Nurla. Nurla is near Ule and Alchi  and has one of the best roads connecting it .  Excellent rooms with a view of Indus river from all rooms. Each room has private sit out balcony. Rooms are tastefully done ,bathrooms have all amenities with running hot and cold water. Nice towels and toiletries.   The food is excellent ,we had lunch and dinner here. Dinner was yummy Chinese affair . There are no TVs in the room's ( who needs them here) but the reception has a TV and Wifi also .",akshattyagi,/Profile/akshattyagi,"Meerut, India",50
ladakh,"Stayed at The Apricot Tree  for 3 nights and I must say this hotel is at a amazing location  by the most hospitable people I have ever been with.  Bedroom was cozy and comfortable with a spectacular view of the Indus & colourfull landscape of Ladakh. The most important aspect of any room in a hotel is the bathroom, and full marks to the hotel on that front.  The best part about The Apricot Tree was the hospitality, right from the moment we drove in to the to the bell boy who helped us while checking out were amazing. We even went for a day tour to some old and new monasteries near by, Mr Wanchuk Fargo   (owner ) was very courteous to  arrange the trip.    Definitely going to recommend it to anyone traveling to Ladakh, and getting the best advise to travel around from the best",ALMUSTRAVEL,/Profile/ALMUSTRAVEL,"Srinagar, India",50
