location,review,name,user_profile,userloc,rating
shimla,"This is an unassuming hotel, tucked away just off the Mall Road.  Pros 1. The staff are extremely helpful. They go out of their way to make you feel cared for. I would like to particularly mention two staff members, Girdhari and Jagadish, who were very accommodating right through our stay.  2. The food served at the hotel is very good, but the cost of their dinner buffet does not justify the limited items on the menu. 3. Location of the hotel is excellent. The Mall Road and Lakkar Bazaar are all within walkable distance.  Cons  1. The access to the hotel is through a very steep and narrow road. Only the most experienced of drivers would find it comfortable to negotiate. 2. Watch out for nosey monkeys. You need to keep the room windows closed. 3. Though there is wi-fi, the signal",Raj K,/Profile/Tripyzforlife,"Bengaluru, India",40
shimla,We stayed here as part of a group tour. The staff were very welcoming and happy to accommodate any requests we had. The rooms are charmingly decorated and we were able to have a restful sleep. Great outlook from window.   Proximity to main center was excellent.  Altogether I would recommend this hotel.  Definitely a pleasant surprise for mid range accommodation. ,DesireeNZ,/Profile/DesireeNZ,"Manukau, New Zealand",50
shimla,"I was in the hotel for Two days felt happy to see the very co-operative staff, good location near mall road within the city centre, never had issues with the food,which we may have the other hotels, good food, every one here greets with great smile which creates healty atmosphere, booked CAB through the hotel for sight seeing, provided Toyota Etios vehicle nice one and driver Mr Gaurav Singh was very co-operative and well behaved person ,had a fantastic ride with him in shimla, Anyone visiting shimla can choose this hotel for a great stay",Gangadhar R,/Profile/789gangadharr,,50
shimla,Best part of this hotel is its excellent vegetarian food.   Rooms are very average and toilets not very clean. It is close to Mall road but going out of hotel is very steep climb for 50 meters. Staff here was very friendly and always tried to help,Samir_Ranjan,/Profile/Samir_Ranjan,"Kuwait City, Kuwait",30
shimla,"Booked a summer holiday through Yatra.com and stayed at this place for two nights. And I feel pained to say that we were taken for a ride both by Yatra and the hotel. We were being offered a hotel in Mashobra, but we were looking for a premium resort/hotel, with all basic amenities like decently furnished large rooms, games room for kids etc, so yatra executive recommended this place, and we were taken in by his nice words. We were promised a 3 star ""luxury"" hotel within close proximity to mall road, and were charged a premium for that! Cutting the story short, this is a dingy, cheap hotel... like those ""hotel paradise"" in front of bus stands in c class cities... buffet food is for name sake with spicy oily dhaba type food a limited fixed menu. No fruits or juices in breakfast",rmaniktala,/Profile/rmaniktala,"Haridwar, India",10
shimla,Very good staffs...Spacious and clean rooms...toilets are clean...good food...hotel in a good area but entry is difficult due to a slope road...hourly chargeable indoor activities and most of them are damaged,Andres R,/Profile/andresrD5089TG,,40
shimla,It is located near High Court and near to Mall road. But the road from high court to hotel is quite steep and may be very tiring with luggage. Hotel facilities are good and wash rooms are really good and well maintained.,rishav b,/Profile/253rishavb,"Patiala, India",40
shimla,Indeed a good hotel to stay nearer to Mall Road. Good staff and good location. Need to improve on ambience and provide room freshness on regular basis. Service items like towels need to replace ASAP. Rest is super.,sknahamad,/Profile/sknahamad,"Guntur, India",30
shimla,"Hotel is located near highcourt.overall the hoel is good The hotel staff was very friendly and the services provided were excellent. It's a great place for tourists as it is at a fantastic location and has lovely surroundings.Rooms are well kept, neat and clean. Sanitisation is well maintained.  The restaurant of the hotel serves fine food",Fathimath R,/Profile/639fathimathr,,40
shimla,"It was my second visit. The ambience is very warm. The hotel staff was very friendly and the services provided were excellent. It's an apt place for tourists as it is at a fantastic location and has lovely surroundings.  Rooms are well kept, neat and clean. Sanitisation is well maintained.  The restaurant of the hotel serves fine food.",aanchalsharma010,/Profile/aanchalsharma010,,50
shimla,"Had been to Shimla in summers... To beat Goan heat😉☺️ stayed at this place for 2nights with my bestie must say the hotel is very clean...👍🏼 good food n mooost of all Excellent service😊 the staff serves you with a genuine smile... Not that its a service industry tho lets smile for the heck of it... No! The staff was very nice to us... From front office/ service guys to bell boys... The room we stayed didn't have much of a view but the restaurant did so we were happy anyway, cuz mornings we were out for activities n by the time we came back it would b dark so view didn't really matter. For travellers who wish to visit this plc I advice you to talk to with them b4 booking just to make sure of the view... Do not worry about cleanliness (7/10)or food (7.5/10) bout are good 👍🏼 ",aishwarya R,/Profile/aishwaryaR136,,40
shimla,I travelled to Shimla in 20th Aug'16.  We stayed there for 1 night. The ambience of the Hotel is very good.  Staff was very helpful specially Mr. Sunil. Veg. food is ok and non. veg is good.  We all were very happy.,Anju K,/Profile/AnjuK196,,40
shimla,"I travelled to Shimla in Aug 2016. Because of long weekend, we couldn't get reservations in any other hotel and booked Silverine through MakeMyTrip. Though it was bit overbudget for us.   The hotel is located near the hight court at Mall Road, the food was good and the staff was very courteous. We hired a local cab driver to drop us to ISBT but he ditched us at the last moment. I asked hotel staff and Mr Gulab arranged a taxi for us at the last moment.   All in all, I would rate it 4/5. Not 5 because it was bit overpriced on that weekend.",Shubham Pandey,/Profile/429shubhamp,,40
shimla,"We stayed in this hotel for 1 night on second weekend of August 2016. We booked Luxury type room from MMT site.  Location: The hotel is at walking distance from the mall road and yet in the very peaceful locality. This is the best part of the hotel.  However, my driver did complain that it was quite a challenge for him to drive back from the hotel to the main road as the road is very steep and narrow. Also, if you are travelling with elderly family members or small kids, this short distance from the hotel to mall road is definitely not going to be a cakewalk.   Room: An average size room with comfortable bed, two chairs and a table to enjoy view from the window. The room had musty odour and pillow cover was not clean. I complained about it to the manager and he immediately took",Ghumante_Jodi,/Profile/Ghumante_Jodi,"Chandigarh, India",30
shimla,"Booked the hotel thru makemytrip as I could not get reservations in other hotels. While this hotel had mixed reviews we took the chance and booked this hotel.   The hotel is situated very close to Shimla High Court and is midst of VIP area. The Mall road is also walkable distance; rather it's on one corner of the Mall road which is a plus point.  We booked luxury rooms. Room was okay size, clean and neat. Towels need to be more clean and fresh. Bed lenin can be cleaner and was smelling of dampness. May be it was due to the weather. Bathroom was clean and neat. Food and service was good. Front office people are very helpful.  Makemytrip charged me only for the room and didn't include anything; the room was not worth the price that I was charged which the hotel may want to review.",Sharad K,/Profile/pr_sharad,Chennai,30
shimla,"The hotel has a good location with private parking available. I was booked in a luxury room for 3 nights. The hotel was undergoing minor renovations due to the offseason about which i was informed at the time of check in. I got a free upgrade to the best room of the hotel after the 1st night. It was their executive suite. This room had an awesome view and was well furnished. The staff at the hotel are very friendly and helpful starting with Mr. Varun and Mr. Sunil. The food at the hotel is delicious including their sumptuous buffet breakfast. I tried snacks, Indian dishes and chinese from their menu and nothing disappointed. Overall it was a memorable stay and would love to go back on my next trip.",Harjeevs2016,/Profile/Harjeevs2016,"Surrey, Canada",40
shimla,The location of the hotel is excellent as Mall Road is at a walkable distance. Difficult to get hotels near Mall Road with parking. Food quality is really good. Didn't find major difference between Deluxe & Luxury rooms. A little turned off by the absence of balconies with any room. Good stay overall.,KarSharma,/Profile/KarSharma,"Gurugram (Gurgaon), India",40
shimla,"It was Excellence right from the moment I spoke with Mr Varun, to Check In So Swiftly Handled by Mr Sunil, and care that was taken by Mr Gulab, Sangeeta Madame what a lovely lady always concerned and Chef Pankaj what Food... never been to a hotel where you check in as a guest and leave as a Family member can't wait to come back and stay with you guys again.",Trekker0323,/Profile/Trekker0323,"Shimla, India",50
shimla,"Good location with spacious rooms and fine views! Staff was very polite and helpful! The Manager Mr. Gulab was helpful in arranging a taxi for travel to Kinnaur at short notice. Food at the restaurant was also good. Overall, I enjoyed my stay in the hotel",kuppuswamyravi,/Profile/kuppuswamyravi,"Manama, Bahrain",40
shimla,"I left the hotel after 2 days of stay ,with family ,satisfied.Mr Varun/Mr.Sunil had been kind enough to give us upgraded rooms which had significant effect on my level of satisfaction. The food was good. The staff were very nice and pleasing.The only drawbacks I faced is the location. It is in an area where Taxi drivers refuse bluntly what ever you offer because of the steepness and narrowness of the approach road.This is a problem related to the terrain of the place at large.We had limitation in opening the windows due to repeated visits of monkeys.On the whole I am quite satisfied and would recommend it to anyone visiting Simla especially if you are young and healthy and old parents are not with you.",Philip A,/Profile/698philipa,,40
shimla,"very close to Mall road, a very good hotel with parking & spacious rooms. plus point - a good hospitality with smiling staff. food is also good.. Mr Sunil, Manager is cordial and nice. overall our experience is good.",anilsharma2015,/Profile/anilsharma2015,"Karnal, India",40
shimla,Nice hotel with spacious rooms. Good hospitality by the hotel staff. Food is also good. Near to the mall road. Manager Mr Gulab is very cordial and nice. The way to the hotel is little steepy. Overall our experience in Hotel Silverine is very good,Priya,/Profile/KanthiP10,,40
shimla,This is a budget property but value for money. we took a 3 nights 4 days package on new year when we were not getting anything in Shimla. They offered an all inclusive package on a great deal.  Food was Ok and the activities were as promised.,Saumya S,/Profile/952saumyas,,30
shimla,"We stayed in this hotel from 7th july to 9th july. Reached here late in night about 11:30. Our driver being a new one was unaware of the location and on contacting the hotel late in night, the hotel staff guided us to reach safely. On reaching we were served hot delicious dinner, really great. Rooms are very well maintained and kept in good taste. Buffet breakfast and dinner were simply great and hygienic. Staff is courteous and service is flawless. Thanks to Team Silverine for making our family trip unforgettable.",MK S,/Profile/MKS194,,50
shimla,"We had been to the hotel 10 years back after our wedding & stayed there again in the month of June with 2 kids. I must say nothing has changed in the hotel. Hotel staff is awesome, polite & very well polished for a small town. Special mention for Mr Suneel Darhel who managed our entire stay in Shimla including our Kufri Trip. Mr Suneel can be compared to any 3 star or 5 star hotel staff of Delhi/NCR etc the way he talks to the customers & his behaviour. Also a big praise for the food the hotel prepares. Our package included Breakfast & Dinner in the Hotel Restaurant via Buffet Food is amazing & homely. Good non veg food as well & preperation of food is amazing too. Overall we were very much happy with our stay in Hotel Silvetrine like we were 10 years back. Even next time we",Gaurav V,/Profile/gavincsc23,"New Delhi, India",40
shimla,"First let me say the good thing about the hotel  (1) its staff they are really good and would try to help you as much as they can .the kitchen food is great .the kitchen manager is awesome  Now let me say what is wrong ..... (1) this hotel not even close to 1 star  (2) the location of hotel is neither in upper mall ,neither in lower mall ... (3)due to the above it is a nightmare to reach the hotel by walk ..the small street leading to the hotel is frightening .. (4) the lights , exhaust fan did not work .. (5) we were given lower grade room than promised 204 which was really filthy .  (6) wifi never works ...        It has been really unpleasant experience to stay in this hotel ...I would never stay and would never recommend ....seems others 5 star reciews are reviews ",Arvind S,/Profile/arvinds459,"North Chicago, Illinois",10
shimla,"In the past 20 years, we have resided in numerous hotels in Himachal, but our experience in Hotel Silverine was thus far the best. We had booked the hotel thru Mr Varun Shukla and he suggested  various  packages to suit our needs. We visited this hotel for the first time and were happy to find the hotel excellent in all the fields such as hospitality, customer service,room service and food. The package was unmatchable and we enjoyed free trips to Kufri and Naldehra. The customer service at reception by Mr. Sunil and his colleague was excellent. In the future, Hotel Silverine would be our first preference for a comfortable stay away from home. I would recommend everyone to visit this hotel.",jeetsimarbedi,/Profile/jeetsimarbedi,"Chandigarh, India",50
shimla,"they charged me 500 for early checkin, even when they had a room empty. the room also smelled. the lighting in the room was also not proper. the beds are uncomfortable too, it seems one is sleeping on a wooden cot.",Sankalp G,/Profile/SankalpG24,,20
shimla,"Stayed 2 nights with family.   The location was both a plus and minus - police stopped us near the High Court refusing to let the taxi through without a pass. So had to manoevre the last 300mts which includes a pretty steep incline, with porter carrying our bags .  Though the hotel insists cars can come down and park nearby, i found most drivers refused to take the risk . So elderly guests be forewarned .   The rooms are decent, quite clean, wifi was not working, the buffet breakfast and dinner  was standard fare tho the soup was excellant each night . Reception desk is also helpful . The view from terrace and rooms lovely ..a value for money stay, walking distance to Mall Road quite convenient but a  definitely a no-frills stay !",A Suresh,/Profile/Indianhotelier4865,India,30
shimla,"Exquisite Hotel and excellent room service ,specially cooperation of Mr Dasta helped us  a lott. Room Service was applaudable and food was food and in your budgets . People will enjoy staying in Silverine and with the staff handled under Mr Dasta will help tourists......",Shashank T,/Profile/ShashankT135,,50
shimla,"I visited there  with my family some days back.  We had booked the hotel online and had done 100 percent payment in advance.  We were a little unsure if we have made the right choice,  but it turned out to be a beautiful stay.  The hotel is very comfortable,  near to the mall road and  very clean.  The staff is very friendly and Mr. Gulab dasta,  the man at the reception made sure that we get all that we want to make our trip beautiful.  He also arranged a one day sight seeing to kufri which was amazing.  If you wish to go to a calm and soothing place , silverine is a good bet.  :) ",Dharvi M,/Profile/dharvim,,40
shimla,If u r going to shimla thn this should be ur hotel... Great hospitality.. Especially manager mr sunil.. He wl whatever is best for u.. Sorry sunil ji for writing it late.. U r the best.. Shimla is a great place to visit. Make sure u hve the best stay.. Hotel silverinn makes the trip worth... ,Mouin K,/Profile/m0uink,,50
shimla,"Visited shimla stayed at silverine, and I must say it's good hotel room are good neat clean,especially toilets. Staff is good very corporative and quick service. Overall it was nice trip with good and comfortable hotel. Recommend for staying. ",Nikhil Gladwin C,/Profile/nikhilgladwinc,,50
shimla,We enjoy out stay at Silverine..food was very tasty. Friendly staff always smiley face..good location. Would like to visit again. Ambience of hotel was really classic. I like the lobby. Kids enjoyed the stay. Thanks,sharad4178,/Profile/sharad4178,"New Delhi, India",50
shimla,"Stayed here for a night on short visit to Shimla.  Best part of the hotel is its Location which is around a few dozen steps away from Mall Road.  IMPORTANT - Families note that the Hotel comes in Vehicle restricted Zone so you have to walk around 5 min from vehicle drop off to the Hotel.  Sometimes porters are available and even the Hotel offers support to carry your luggage.  SO families with small kids or excess luggage should be prepared accordingly.   Having said this, I found the Hotel GREAT because of the proximity to Mall Road - I could walk down easily and enjoy the evening stroll.  The Valley facing rooms are AWESOME and Service and food was very Good at the hotel.   Only suggestion to Management - I got small towels for use in the bathroom and tea was served only after",AshishtripAdv,/Profile/AshishtripAdv,Nasik,40
shimla,"I stayed at hotel from 10-12 June 2016, Luxury Room Package, This was my second visit to this hotel. Room Quality was good, food was delicious. The most important thing I like is the location of this property(near to famous Mall Road) and personal parking.   Mr Sunil and his staff is very polite and friendly. I seek no other option in shimla provided the rooms are available.. :).",Mayank G,/Profile/MayankG449,,40
shimla,"All of a sudden we have our plans for Shimla and has made our bookings with ""Hotel Silverine"" next to High Court and very near to d famous The Mall road... Our booking was from 9th June 16 to 11th June 16 for 2 night stay at their Luxury category Room. Since we had planned our journey through Volvo service from Delhi to Shimla, we arrived at Shimla at a very odd timing as compared to the Check-In timings of the Hotels at Shimla i.e at 6.30 am. As we have our Hotel Bookings we approached towards our hotel with a mindset that we have to wait in d lobby for a longer time for our proper check-in to the hotel. On our arrival to the hotel we met with Mr. Gulab the Manager available at the reception and to our surprises we were greeted well on our pre booking arrival. Also Mr. Gulab",ayerick,/Profile/ayerick,"New Delhi, India",40
shimla,We stayed in this property from 7/6/16-9/6/16. Very near the mall. But the road is narrow and steep. But the rooms are clean and well maintained. Food is very good. Staff are very good and welbehabed.  Very much recommend for families.  ,Dr Prabhat Ranjan Ghosh,/Profile/drprghosh50,India,40
shimla,"I had traveled to Shimla on 4th June 2016. Though the hotel is situated within the walking vicinity of the mall road and provides its own car parking, the road from the hotel to the mall road is a fairly steep one. The rooms provided to us were spacious and provided a brilliant view of the hills. The windows were frequented by monkeys, so one had to be careful not to leave them open when going out. The food was delicious and satisfying. The service provided by the hotel staff led by Mr. Sunil was great. Overall it was a good experience though some improvement is required in the fixtures and general cleanliness of the bathrooms.",Nirmit A,/Profile/507nirmita,"New Delhi, India",40
shimla,"This is one of best Hotels I stayed in Simla with Family. The manager 'Mr.Sunil "" was so humble n polite that he is jam of person there. The overall stay was enjoyable and the Staff was so cool and ready to help for anything. I recommend this site best because once you are out - and you get such nice pleasant hospitality - your entire trip is more than Value for Money .",Atul G,/Profile/atulg793,,50
shimla,"We visited Shimla  on 1st June 2016 with family.   clean, spacious rooms with very good valley view and ample sunlight. All facilities in the room were in very good condition. Food: Food was delicious with good number of options in breakfast and dinner buffet. Staff: Staff is friendly, attentive. courteous and prompt in service. Walkable distance to mall road.  Thanks to Mr Sunil , Mr Gulab and all the Housekeeping staff  for a memorable stay  One of the very best hotel during my entire Himachal tour. In all I can say Silverine is value for money.",preetijagushte,/Profile/preetijagushte,"Mumbai, India",40
shimla,It was good to find Good service certification by trip advisor displayed to the reception and glad to say they lived upto it. Mr Sunil offered warm welcome and guided us for our tour for the day. The services in room was prompt and room was spacious( equally good bathroom) . The view to the valley below was picturesque and clear. The only problem being the climb to the main road in very steep and our taxi  was skidding and could make it in third attempt. Breakfast had good choices and was well prepared.,ShivendraJadon,/Profile/ShivendraJadon,"Udaipur, India",40
shimla,"Warm welcome and excellent services.   Hotel staff are very agile and hospitable.   Good Hotel with good rooms. Food is excellent.  Well maintained infrastructure and surroundings. Managerial Staff Sunil and Gulab are helpful, kind and approachable.",yoshravi,/Profile/yoshravi,"Bengaluru, India",50
shimla,"A decent place, rooms have a good view, but advised to keep windows closed for the fear of monkeys.  Also, if you are travelling by a big vehicle, i.e. anything bigger that Toyota Innova, you cannot take it till the hotel. You will have to walk up an down to the hotel from the main road from the High court. The road is very very narrow and the hotel is down the slope, at least half a km. We were not informed by our travel agent about this and senior citizens travelling with us had a hard time walking to the hotel. We had to hire porters on the first day to carry the luggage and had to spend money on taxi everyday to go up to the main road.   The staff is courteous and friendly, rooms are well maintained, the food is good.",ketakikarandikar,/Profile/ketakikarandikar,"Pune, India",30
shimla,"Really worst experience ever. WE had b/f and dinner included in package. The food wasn't good at all.  The hotel was stinking. It has leakage all over. I would never believe make my trip henceforth.  They had huge water shortage. for a complete day they did not have water even in the flush, They were serving dirty drinking water claiming it is filtered through aqua guard. when we asked to see the aqua guard, they declined. Real worst service and rude staff.",MyTA-Review,/Profile/MyTA-Review,"Mountain View, California",10
shimla,"I had been to Shimla last month with my family and stayed at Hotel Silverine, very nice hotel, good hospitality by all staff members especially the gentalman at reception (Mr.Sunil ?), we really enjoyed delicious food, the quality was awesome. Our over all experience was quite satisfied, will recommend everyone to pls visit to Silverine.",ashwin_meridian,/Profile/ashwin_meridian,"Mumbai, India",40
shimla,"Excellent service and  good hospitality, well maintained infrastructure and surroundings.Very polite and ready to help at anytime. It would be better if the coustemers are provided with some handouts explaining the facilities.",Jince J,/Profile/156jincej,"London, United Kingdom",40
shimla,"My friend and I stayed here for a night enroute to Manali, we were exploring Himachal Pradesh on a 350classic. And we happened to reach silverine in a bad shape after a long ride, Mr. Sunil Darhel at the front desk helped us a lot and upgraded our room type and guided us with the nearest attractions and stuff. Coming to the hotel review it's a comfy & well maintained place  to stay. The rooms are bigger, toilets are cleaner and location is greater. It's at a walkable from mall road, which is the main and one of tourist attractions in shimla. The front desk staffs  are their toes when it comes to helping the hotel guests, especially Mr. Sunil Darhel thanx a ton mate and sorry for the late review.",vin-d89,/Profile/vin-d89,"Bengaluru, India",40
shimla,I have visited shimla along with my family in April Ist week and stayed in Hotel Silverine and rooms was very neat and clean and whole hotel staff was very supporting. ENJOYED a lot and we are very happy.,Rakesh V,/Profile/735rakeshv,"New Delhi, India",50
