location,review,name,user_profile,userloc,rating
shimla,"Stayed in this hotel with Family.Location of Hotel is very near to Mall road.The rooms are good and well maintained.The staff is very friendly, they arrange helpers to help us with our luggage till taxi stand. Food quality they serve was very good. we delighted  with South Indian brake-fast after having lot of Parathtas for  brake-fast in entire Himachal trip. I advice to stay in this Hotel especially if you are coming with Family.",Milind M,/Profile/MilindM_12,"Pune, India",40
shimla,I stayed from 20 to 22 sept 2013.Hotel is near to Mall road( 100m ).good staff.very helpful.On price of deluxe room they upgraded my room to luxury room.nice view of hills from window of room.hotel arranged taxi for site seeing.overall nice experience.,Ilyas M,/Profile/87ilyasm,bhopal,40
shimla,"After seeing a few hotels on the mall road i came across Hotel Silverine which is located not exactly at the mall road but is just 5 mins away from it considering the steep walk from hotel to the mall road.  As i checked in the hotel saw the view from the window which was spectacular just makes u want to sit at the window and relax and watch the view. The room was very clean i was quite impressed seeing this, as all the hotels that i saw before were not as great as this. I loved how they had defusers inside their rooms which smells really nice. Its a complete 10 on 10 for hygiene.  The food at the hotel was very good specially the buffet they keep for dinner (Everyone should have the buffet when they are at this hotel) The hotel as other facilities like gym & they have a snooker",JiveshDal,/Profile/JiveshDal,"Mumbai, India",50
shimla,"I stayed in this hotel with my family in July 2013. Hotel was good. The staff were friendly and the food was also good.   This hotel is situated around 100 meters from the starting of Mall road & you will need to walk more than a kilometer to reach the main tourist attraction - Ridge. So if you have small children, carrying them and reaching the main point can be a challenge keeping in mind that vehicles are not allowed on mall road",VVSSS_Sarma,/Profile/VVSSS_Sarma,"Gurugram (Gurgaon), India",30
shimla,"I stayed in silverine in sept 2013. Stayed with my family in room # 302, it is a good hotel near to mall road, staff was very friendly & helpful, thank to avdesh (guide for bus stand to hotel), sunil (help to arrange a taxi for side seen), chhotu (bell boy), gulab also, food was excellent thanks to hotel's chef, and special thanks to Vickey (driver) for just to show shimla & when i getting late for our bus he drop timely. he was very special for us,  It was some minor issue also but i would like to avoid them i.e. after having dinner I call to reception to remove our plate and arrange a jug of water but nobody was come till morning, & next morning before check out I booked a taxi for bus stand but I got taxi very late (it was not acceptable) (I have both guy's name but its time",dharam_pal30,/Profile/dharam_pal30,"New Delhi, India",50
shimla,"We had a great time at Hotel Silverine. On arrival, a prompt pickup was arranged from the rly stn and we were privileged to have taken the train route which was fun and exciting. It was hard to believe that a location such as this could exist in the most crowded area of Mall Road where it is otherwise impossible to reach on a vehicle (entry is banned for vehicles on mall road). The room given to us had a fantastic view of the valley and the mall road. The room was very clean and extremely well maintained. The food and housekeeping facilities are excellent at the hotel.",Shammi2013,/Profile/Shammi2013,"Chandigarh, India",50
shimla,I would say the hotel is good as per the price the plus point of this hotel is the staff they are very helpful The food is very good A simple piece of advice for the management is to change the handle of main door it seriously needs a change,Jaaved5,/Profile/Jaaved5,,30
shimla,"Just stayed in Silverine for one night in Shimla. Its an average hotel, nothing great about it except the view from room. Rooms definitely require renovation and one can find better options in the price you pay at Silverline. Its not bad but nothing great about it to share.",SameerRathi,/Profile/SameerRathi,"Jaipur, Rajasthan, India",30
shimla,I stayed in silverine in august 2013. Stayed with my family and two other families. Had booked luxury rooms at about Rs 4000 per day. My bad experience started when I landed in shimla. Hotel claims to be on mall road but it is a steep climb at the fag end of mall road and it is tough getting in and out for a family with small children. Hotel gave us free upgrade to their best room I.e. Executive room but even that had a badly done up washroom that had leaking taps and unclean washtub.  Not expected from the best room in hotel. The breakfast only had egg bhurji and bread worth eating. It also had stale poha and badly made upma. Also rooms on ground floor were getting renovated and there was dust all around.We had to call housekeeping teice to clean the floor of our room due to,SamarGupta,/Profile/SamarGupta,"New Delhi, India",20
shimla,"Hotel Silverline fulfills most of the parameters of good hospitality- comfortable and clean rooms, good food, and good service. The location very much in proximity to mall road makes it fun to just stroll around and come back at leisure. So next time you need a good accomadation in Shimla, hop-skip-jump mall road. Hotel silverine it is!:)",karishmaj3,/Profile/karishmaj3,"Mumbai, India",40
shimla,"I visited silverine hotel with family and needless to say that the first view of the property was way above my expectations. To top it up hotel offered me incomparable hospitality, excellent and courteous room service with excellent food. Rooms were neatly done and cleanliness was given priority. I recommend this hotel to everyone visiting Shimla for a memorable experience.",gaurav s,/Profile/Gaurav0982,"New Delhi, India",50
shimla,"The Hotel Silverine has a amazing location at Mall Shimla. The employees at the reception seem particularly cautious about the service which i liked the most, the food was awesome. Distance to the mall road was 100 mtrs from the hotel with the parking which is quite rare in shimla. Value For Money.",Vaibhavkapani,/Profile/Vaibhavkapani,"New Delhi, India",40
shimla,"I checked the good ratings on Tripadvisor but found the hotel really below average. The TV wasn't working for the two days we stayed, the team tried to help but could not fix it which was fixed up later by us. No power back up, toilets with no facility but towels, sheets were not clean, TV screen size of 14 inch was too small for a big room, location very difficult find although close to Mall.  The Hotel interiors looks too old and foul smelling. One should avoid it.",Ankit J,/Profile/Ankitzen,"New Delhi, India",10
shimla,"We had our honeymoon trip to Shimla and we stayed at Silverine at Shimla from 16 to 18h feb 2013. The hospitality at the hotel was very good. The rooms were explicitly spacious and the restrooms were maintained clean. It was a safe place to stay which could be cherished forever.... good service and tasty food made it all.The rooms were clean and spacious. The excellent view from the rooms and roof top was an add on. Overall it was perfect and would like to visit again,",Jatin V,/Profile/jatinvora4u,"Ahmedabad, Gujarat, India",30
shimla,Great value for price. The facilities are clean and well maintained. The location is right by Mall road and walking distance to everything. Overall great place to stay by American standards at Indian price.,Sbetz9,/Profile/Sbetz9,,50
shimla,The location of the hotel is very close to the mall road and takes care of the greatest problem in Shimla-Parking. The hotel has ample parking space and is a small climb to the Mall. The staff is awesome and take care of all your needs. They go out of their way to ensure your comfort. We had a great stay and would highly recommend the hotel to everyone,Ayushi G,/Profile/ayushig_13,"Gurgaon, Haryana, India",50
shimla,"Hotel Silverine has gone beyond expectations and made my trip to Shimla an amazing one this time. There actually is a sense of hospitality here unlike the other hotels in Shimla, Thank you guys for the excellent service you provided. Cheers!!",jgfkjdwf,/Profile/jgfkjdwf,"Mumbai, India",50
shimla,"We had our honeymoon trip to Shimla and we stayed at Silverine at Shimla from 18 to 20th feb 2013. It was our first trip to other state and also it was very soon after the scary Delhi incident. We were very afraid at first as we dont know hindi,but the time we checked in Silverine and till the time we check out from the hotel we had full support from the man at Reception/manager(not sure) and also each and every employee from the hotel. It was a very good and wonderful experience. The hospitality at the hotel was very good. The rooms were explicitly spacious and the restrooms were maintained clean. It was a safe place to stay which could be cherished forever....",sudarsangayathri,/Profile/sudarsangayathri,"Chennai, Tamil Nadu, India",40
shimla,"I have been to Shimla a couple times and have stayed at different hotels, this was my first time to Silverine and it was a fabulous experience. The hotel staff didn't miss out on a single thing to make my stay comfortable, the room was good, the bed was very cosy there was provision for hot water as well you know being shimla. Excellent place, If you guys want a good place to stay at  this is the one. Thank you Hotel Silverine.",prateekd186254,/Profile/prateekd186254,"Exeter, United Kingdom",40
shimla,"My trip to Shimla in February this year with my friends and and our stay at Silverine was an excellent experience. Very good service and tasty food made it all. The minute we entered the hotel, we were provided excellent service and each and every requirement was handled maturely by the staff. The rooms were clean and spacious. The excellent view from the rooms and roof top was an add on. Overall it was perfect and would like to visit again,",chadhagurmit,/Profile/chadhagurmit,"Chandigarh, Chandigarh, India",50
shimla,"We stayed there for 2 days, 29-30 june 2013. Hotel staff was good and facilities provided were average. In fact, it shall be harsh if I call anything wrong in the Hotel. Overall experience was good. Rooms were neat and clean, bathrooms were OK. valley view from window was worth praising. Although, Food served was not upto standrads. We ordered french fries first morning, and after eating first piece we decided to not to order anything else during our stay. I must say Hotel staff is very co-operative and smiling every time. In fact this hotel is a one stop shop for all your travel needs. they fulfill your every requirement, although you have to spend some extra pennies towards the service. Getting out from Hotel is also very difficult, having a steep rise to get onto road. If",ankit3000,/Profile/ankit3000,"Fatehpur, India",30
shimla,"My first time to shimla, Hotel Silverine made sure that i got the best experience of the entire place and the best of hospitality in Shimla. The entire staff was very hospitable, their service right from the minute i entered the hotel to the mintue i stepped out was flawless. If there is anyone who is visiting shimla for the first time and is unsure of what hotel to stay in my recommendation is to pick Hotel Silverine. Great work guys, keep the hospitality the way it is or even better for my next visit.",AmeyaDc,/Profile/AmeyaDc,Mumbai,50
shimla,"Our dissatisfaction started the moment we were taken up to the room. it had a terrible smell, dirty bathroom, stained carpets and curtains and evidence of litter in the cupboards. Although, after complaining an ""upgrade"" was provided, with very little difference. sometimes one as has little choice when you arrive late at a hotel but to settle. Would not recommend this hotel. The only consolation was its location to Mall Road and the view.",tillie1001,/Profile/tillie1001,"Durban, South Africa",10
shimla,"The dissatisfaction started right from our time of entry. We came from Delhi at around 8:00 AM but the staff said there will be no check-in before the actual check-in time of 12:00 PM. Its anyway understood that the there is a standard check-in time of the hotel but does that mean to make the customers wait for 4 hours even when there are rooms available after previous customers checking-out?! Afterwards I came to know that there is a separate charge for early check-in and that is around 20-25% of the per day charge. My question is why dont the hotel refund the money when the customer is checking-out EARLY?? The staff couldnt do anything better than just smiling! Be it Food or Tea or Just water, everything was served after at least half an hour of ordering.The location of the",Abhishek K,/Profile/rash_abhi,"New Delhi, India",20
shimla,Went to Sangla nd Kalpa in first week of June and in order to break the long journey stayed for a night at Hotel Silverine. It is a warm place to stay at. Plus point is that Mall road is quiet approachable from here . Apart from the hotel approach road which quiet steep every thing else is quiet good. We were there just for a night. Hotel staff was quiet helpful. Food was good but since Mall road is walkable there are a lot of eating options apart from eating at the hotel.All in all a good experience.,Ashima_nan,/Profile/Ashima_nan,Gurgaon,40
shimla,"We stayed at Hotel Silverine on a reccomendation from a friend. Being urban travellers from Bombay, we didn't know what to expect from the Summer Capital. We were more than pleasantly surprised at the hospitality and impeccable service from Silverine, which provides a breathtaking view of heavenly Shimla from every room. OK, agreed the slope to and from the hotel is steep, but that 3 minutes of excersice along with a bout of fresh air is a great jumpstart to your day and an even better wind down from a long one!! so no complaints here. Being a bunch of music afficionados, the Hotel Management was fabulous enough to arrange for a bon fire on the terrace where we played our guitars and sound docks under the star lit sky. There's alot of offbeat stuff to do in Shimla, and again,",AdventureAvenger,/Profile/AdventureAvenger,"Mumbai, India",50
shimla,"I visited Shimla in June and atayed at Silverine Hotel. Silverine is a very good hotel with the most courteous and well behaved staff. The rooms  and the bathrooms are neat and clean. The hotel is very well situated - away from the maddening crowd but startegically located near the mall road. I just wish that the taxis/cabs could go uptill the hotel entrance. The hotel is value for money, though the restaraunt is slightly expensive than other similar choices available in the proximity like Tripti restaurant. The valley facing rooms have a very good view.The recreation faclities should be free for all the guests. Since they charge sepeartely for it, it should be mentioned at the time of room booking. Overall the stay was pleasant and comfortable.",jagsjassal,/Profile/jagsjassal,Delhi,40
shimla,"It is said that sharing happiness alway increases  the girth of joy.So i would like to share my joyfull experiance of Shimla,specifically our stay in  hotel silverine.The entire  hotel staff was very cordial, warm and humble.I would like to mention specially eversmiling  Mr. Sunil , the Manager and Mr. Gulab, the supervisor.Those are the people who make every single guest feel special.We the people of plain always amazed to see the smiling hotel guys who fly through stairs and ramps just to make their guests comfortable and happy.Thank you guys. Moeover the Food provided by silverine was worthy in term of taste and cost both.One thing i would like to suggest kindly do something about  the steeeeeeeeeeeeeeeeeeeeeeeeep entry which was nothing less than the roller coaster. It might",Rekha K,/Profile/rekhak628,"New Delhi, Delhi, India",40
shimla,We stayed for 3 days at Silverine  in the 1 st week of June and were quite impressed with Silverine..Special thanks to Munish for upgrading the room and the Apple Jam.Shimla is a hilly region so right from the railway station exit to everything is steppy so that's not surprising.Silverine is ideally situated near the mall road and offers good variety of food although children missed some baked dishes and elders starters but still it was a relishing menu.Breakfast was sumptous with good variety and so was dinner.Quantity and Quality of french fries served were amazing.Soups were very good in taste too. A couple of things to look into Bath tub plastic cover needed a wash and 1 electrical tubelight  wasn't working but that's the only blip in our stay but the view from the room was,shashinm_13,/Profile/shashinm_13,"Ahmedabad, India",40
shimla,"Stayed at Hotel Silverine last year & had the most marvellous time. Great hospitality, rooms, location & well maintained property. The hosts were really polite & assisted with our requests. Surrounded by breathtaking valleys & views, delicious food, and overall a really enjoyable & memorable trip. Rooms are comfortable & spacious, with all amenities that you'd need.  Definitely will visit again sometime. Beautiful Simla experience, even better with Silverine!",AnusuyaT,/Profile/AnusuyaT,"Mumbai, Maharashtra, India",40
shimla,"i visited shimla last november with my family we were suggested to go to silverine by a friend the stay in silvering was really nice , with big spacious rooms , offering us an unobstructed view of the hills. the rooms were clean and neat and providing all the features to make you comfortable the food was excellent and nice , we got try himachali food for the first time  the service provided to us was excellent , the staff was nice and helpful The hotel is located on the mall road which was very comfortable.  all in all a beautiful place with great rooms , great service and great location",vijaychauhan2001,/Profile/vijaychauhan2001,"Nashik, India",50
shimla,We were at Silverine during 5-7 June; i would recommend it surely. Neat & Adequately Spacious rooms.....Excellent Valley view...........Friendly and Cheerful staff ............Delicious Food with good variety...............close to Mall road. Will definatly stay the next time in Shimla; and may be for a longer duration. Only suggestion to the management; WIFI setup in the room can be a benefit; Rest rooms need / can to be maintained with a little more care.,Chetan C,/Profile/chetanc427,"Mumbai, Maharashtra, India",50
shimla,"I must say its perhaps the best hotel in Shimla...i had a enjoyble tym here with family if u want to spent a quality tym wid famliy or frnds its a must place to visit...the ambience is serene and calm away from hullaballo of city chores...the infrastrctre of hotel is spellbound.The staff members are energetic and v helpful,they calmly listen to ur needs and solve them.The quality of food is superb and is affordable. I am pretty sure in coming years this hotel wud a landmark in shimla... I wud surely lyk 2 visit dis place again...  Stayed May 2012, traveled with family",Stuti86,/Profile/Stuti86,"New Delhi, Delhi, India",50
shimla,The food is nice with smiling hospitality. The staff give special attention to small details and make you feel like home. The location of this hotel is very near to the mall road which makes it easy for me and my family to enjoy the best touring spot in shimla.,punitagv,/Profile/punitagv,"New Delhi, India",50
shimla,"I stayed here with a few of my friends. Booking was last minute but the Hotel was more than willing to accommodate us. We really liked the location. A steep road to get to, but the location is great. On the mall and yet away from the commercial hussle and bussle of the town. Rooms are spacious, clean, neat & a good view. Food on the other hand was great. Loved the buffets, simple and delicious. I recommend this hotel. Keep it up guys!",ashokdal,/Profile/ashokdal,"Mumbai, India",50
shimla,"Our stay at the hotel between 7th June to 12th June was awesome .The entire hotel staff was very cordial and humble.I would like to name specially Mr. Sunil, the manager and Mr. Gulab,the supervisor who were great help. The warm welcome at Silverine, the smiling faces, the energy of the staff was unbelievable .We,the people of plains  really wonder  how the hotel guys keep on running through slops and stairs just to make their guests happy and comfortable.Hats off to their energy and hospitality. The Food provided by hotel  was one of best available in Shimla in term of taste and cost both.One more thing ,the exit of silverine is tough ,very tough due to its steeeeeeeeeeeeeeeeeeeeep slope but it help you keeps your lungs,legs knees and metabolism fit. Naresh Kumar STC",271265,/Profile/271265,"New Delhi, India",50
shimla,"our stay at the hotel was awesome . hotel staff was very cordial, warm and humble.. Food was very authentic&well prepared.The warm welcome at Silverine, the smiling faces, the energy of the staff has left a niche in our minds…a very high benchmark for the rest to match up to. The staff at Silverine is ever polite, courteous and always ready to help",vyas147,/Profile/vyas147,"New Delhi, Delhi, India",40
shimla,the service provided here was exceptional...the rooms were spacious...the quality of the food amazin....The best hotel in shimla without a doubt..the staff is also well trained ...and the view from the hotel is just brilliant...the game room makes sure of the entert,abhishekbajaj123,/Profile/abhishekbajaj123,"Mumbai, India",50
shimla,"As it is rightly said, 1st impressions are last impressions! The warm welcome at Silverine, the smiling faces, the energy of the staff has left a niche in our minds…a very high benchmark for the rest to match up to. The staff at Silverine is ever polite, courteous and always ready to help. To give a short gist…we were on our honeymoon and Silverine being our 1st stop…we continued our trip all through Himachal…thanks to the itenary- well planned by the guys at Silverine. Due to an unforeseen incident we had to return back to Bombay in 2 days. We planned to continue on our honeymoon soon…and were worried about losing out on bookings…but Silverine staff made it look like a cake walk. Our entire trip was rescheduled with just one click! The staff well connected and fabulous at",Tabriz C,/Profile/TabrizC,"Mumbai, Maharashtra, India",50
shimla,This Hotel is located at The Mall. Excellent service. Housekeeping was good. The staff was always willing to help. Wish I had more days to stay. Mr. Dubey is thorough gentleman and was always concerned if guests were comfortable. Will surely come back to Silverine. Cheers to the management and staff of Silverine. You guys rock....,MrTravelaholic,/Profile/MrTravelaholic,"New Delhi, India",50
shimla,"A very good experience by me and my family  the moment we checked in the Hotel. I have been to many hotels in Shimla but the kind of hospitality and other things we came across in the hotel makes it different and the best in the Queen of Hills, Shimla. The luggage was automatically xferred to the rooms and the most delicious food in the restaurant of the hotel. The view from the rooms is so beautiful. The staff is nice. There's sports parlour where you can enjoy snooker and pool etc. Not to forget Mr. Munish who was always available for 24/7 and a phone call away. I just loved my stay in Hotel Silverine and would recommend this hotel whenever you are in Shimla. Cheers. Arvind.",supertramp1048,/Profile/supertramp1048,"Udhampur, India",50
shimla,Rooms have sofa with nails coming out.food spread is limited and you are chased for balance payment in less than 12 hours of checkin.credit card not accepted and they don't consider that you are travelling with kids.overall not worth and would never recommend as there are millions of options of hotels.travelled so many places but never experienced such poor hospitality,Vinesh M,/Profile/Travellervin,India,10
shimla,"I stayed with my family recently at the Silverine since we couldn't find rooms anywhere in Shimla (everything was sold out). We were on a road trip across Kinnaur and Spiti and staying in Shimla was a last minute decision on our way back. I am very thankful to the hotel for having accommodated us on such short notice at midnight. But I wish we had more information about the hotel before checking in. Many flaws...  1. The hotel is extremely filthy right from the lobby to the rooms to the bathrooms. The room floor has a layer of black soot and grime which will stick to your legs if you walk bare feet. The bathroom is extremely badly maintained and dirt everywhere, very unhygienic. We noticed this the next morning and informed the reception who promised to have it scrubbed and",Gayatri M,/Profile/wandering-thots,"Mumbai, India",20
shimla,"I stayed for couple of nights in this property. Very good property and the view from the rooms were fantastic. The staff nice. The location good. The approach is a bit difficult, if you have lot of luggage, but the hotel staff were always at hand to help. Special mention of mr Munish , who was available always, either in person or a phone call away. I loved the place, and would recommend this hotel ....",Narendra2208,/Profile/Narendra2208,"Bengaluru, India",40
shimla,Otherwise good but approaching there is really a herculean job. They should do something for approach road if they really want  good ciiental. One has to be a good experienced driver to go back from hotel. This hotel is for young guys and old people should not venture. Photos on web site are misleading,281Icj,/Profile/281Icj,"Gurugram (Gurgaon), India",30
