location,review,name,user_profile,userloc,rating
tehri-gharwal,"great experience with Cradle of life rafting and camping at shivpuri Rishikesh. best place for rafting and other nature activity, the last moment with the urge of taking a break from Delhi and the busy lives.We had taken four tent for our family and it was a package which includes the tent, food, river rafting and water rappelling activities. The package came at a very reasonable cost, the quality and services cannot compare and expect by anyone that a camp can give such courtesy, hospitality and services. The buffet spread was very good and the restaurant being awesome. The camp base is so lovely and situated opposite to each other. A part of river Ganga is flowing in front of camp was simply superb for me, and on it camp has made a river pool which is a unique from others",siddhant123,/Profile/siddhant123,"Haridwar, India",50
tehri-gharwal,"Stayed here in May 2015. Overall - a good camp, great service and hospitality by Deepak and his staff. Made us very comfortable and attended to our needs. The food was great, prepared fresh for every meal.  Arranged for river rafting even though we were the only two for rafting that evening. Their guide and team were excellent, well qualified and gave a memorable experience! River rafting in the Ganga is a must do! The water is so pure and cold - it's just amazing! The view from the camp is amazing, it is located right next to a small stream and you can spend most of your time just sitting by it. Getting here is a little tricky, make sure to call the hotel once you get into Shivpuri so they can guide you. You can drive right upto the camp - with a good car!  Since this is a",avinashsmenon,/Profile/avinashsmenon,"Gurugram (Gurgaon), India",40
tehri-gharwal,We had a lovely experience with Cradle of Life rafting and camping at Shivpuri just 14 ms from Rishikesh,Shalu1419,/Profile/Shalu1419,"New Delhi, India",50
tehri-gharwal,"We went for a short extended weekend break to Shivpuri very close to Rishikesh, best place for rafting and other nature activity, the last moment with the urge of taking a break from Delhi and the busy lives.We had taken four tent for our family and it was a package which includes the tent, food, river rafting and water rappelling activities. The package came at a very reasonable cost, the quality and services cannot compare and expect by anyone that a camp can give such courtesy, hospitality and services. The buffet spread was very good and the restaurant being awesome. The camp base is so lovely and situated opposite to each other. A part of river Ganga is flowing in front of camp was simply superb for me, and on it camp has made a river pool which is a unique from others",Shalu1419,/Profile/Shalu1419,"New Delhi, India",50
tehri-gharwal,"We decided to stay here after a bad experience at another camp in the area, and we certainly weren't disappointed with this venue! The tents are large and luxurious, and tidy and well maintained with clean toilets attached to them. The beds were comfortable too. There are also a few pieces of sports equipment (badminton, volleyball) that can be borrowed and used.  The food served is tasty and well prepared, but I felt that the variation in dishes was lacking somewhat. Cups of tea and snacks are served at certain times, and water is available throughout the day. Unfortunately the evening meals are served at approximately 9pm which I feel is a little late - especially if you have youngish children with you. The alternatives are to either head off into Rishikesh, or bring some",Nick B,/Profile/NickB97,"London, United Kingdom",40
tehri-gharwal,Ideal place for Semi Adventure fun. Attached Washroom in camp makes the Experience more comfortable. Family with kids who wanna have camp experience must experience it once. Food not lavish but good in taste. Carry your own food stuff if wanna eat in between the meals. Cleanliness is an asset. Enjoyed....,manishjain,/Profile/manishjainlive,"New Delhi, India",40
tehri-gharwal,"Cradle of Life Swiss Cottage camp  is best experienced through the myriad adventure activities it has to offer.  A night in luxury tents in the pristine and ethereal Shipuri Valley is a picture perfect memory take away. We make you experience Uttrakhand through the dazzling heights of adventures at Cradle of Life Camp and its lush green escapes   Not before visiting Cradle of Life Camp did I realise the sky can look so beautiful. The wind, the River Pool and the sound of the river can be so therapeutic. A smiling face can be so full of hope and genuine good wishes. I saw the nature from as close as possible and tried to measure its strength. I donâ€™t stand a chance... â€œBut why do you want you fight it? You are not different from it. You are just an extension of this wild nature.",AnujSharma2015,/Profile/AnujSharma2015,"Noida, India",40
tehri-gharwal,"The adventure begins as soon as you get off the spiraling highway onto the rocky river bed, adorned by small streams of water. Step of your vehicle and cross the shallow stream to enter an absolutely marvelous vacation spot. I have stayed in camps before but nothing matches the luxurious amenities of  Cradle of Life.  We began our stay in the evening and the resort looked clean and calm. We were greeted by the staff and escorted to our tents after smooth check-in process. Visting in a big group made the evening even more exciting as we sat next to the camp fire and enjoyed mouth watering appetizers. Keeping the adventure theme in mind, there was â€˜Mashal Trekâ€™ planned for the late evening, walking in the dark with the noise of the river flowing next to you was thrilling. The food",redmocho,/Profile/redmocho,"Wheeling, Illinois",50
tehri-gharwal,"this actually proved to be an enduring trip for me and my family. It served us with many brilliant experiences full of elation, glee and satisfaction. Also, the breath-taking adventures played a major role in making this incredible trip more fascinating. Not only this but the feast was extraordinary. I'll have to say that ""cradle of life"" was totally prodigious and everybody must arrive here at least once in their life time and i can assure that they will try their best to come here again specially to experience a life in such a peaceful and heartily experience.",Monikasachdeva,/Profile/Monikasachdeva,"Haridwar, India",50
