location,review,name,user_profile,userloc,rating
lahul_spiti,"Best property in kaza Spiti , amazing food , even WiFi works there in dinning area which is really rare in rest of kaza , staff is really helpful . Rooms are clean bathroom are good . It's near monastery and perfect parking area .",Ali mehdi,/Profile/Musafirdiary1088,,50
lahul_spiti,"I will be in debt to the owner and team of Sakya Abode all my life. I by mistake left my wedding ring at Sakya Abode, careless of me. But The Tsering Both made sure that I get my ring at all cost. Making sure my ring reaches out to me, he brought the ring all the way from Kaza to Delhi with all grace.  Mr. Both, thank you so much. Thats how you win hearts.",Manish Singh Rathore,/Profile/07ManishSR,"Mumbai, India",50
lahul_spiti,"Its the best place to stay in Kaza. It nearby Kaza Monastery and scenic view is tremendous. Staff is very helpful, especially the owner, Tsering. Food served was brilliant and rooms are adequately comfortable and cosy. It also has outdoor open area, where you can enjoy bonfire.",Pratik Sharma,/Profile/sharmapratik,"New Delhi, India",50
lahul_spiti,This is a good property in Kaza for a relax stay at a very seasonable rates. Near by Monestry and market place. It is like walkable distance. Food is amazing. They provide complete assistance for near by places. Staff is very friendly and ready to serve you at any point of time.,vidhi j,/Profile/vidhij51,,40
lahul_spiti,"We are two women who went on an almost impromptu trip to Spiti. If not for Tsering sir (owner of Sakya Abode), Lamaji (arranged cabs for us) and Varun (a regular traveler to Spiti who introduced us to all these wonderful people), our trip would not have been memorable. Tsering sir is a perfect gentleman.  The driver we hired through some other contact in Shimla turned out to be unprofessional and he was flouting basic driving rules. We had couple of instances where our driver drove after having bhaang. But things turned really worse when he actually got drunk when in Kaza. The wonderful folks at Sakya Abode immensely helped us at handling the situation. Tsering sir reprimanded the driver. They also ensured that our trip plan was not at all affected and arranged alternate cab for",Fernweh,/Profile/IntrospectingFernweh,"Hyderabad, India",50
lahul_spiti,"We had to turn back from Kunzum La on our way to Gramphoo and the Rohtang and drive back to Kaza because the roads were snowed up . The Sakya was just what we need after that . Friendly knowledgeable staff , a lovely lounge with tea and coffee all day,  a great selection of good books and wonderful local food. I would love to spend a week here rather than the one day we did . ",doitwhileyoucan71,/Profile/doitwhileyoucan71,"Mumbai, India",50
lahul_spiti,"We stayed in this hotel for 2 nights..oldest hotel in kaza:rooms are very tiny but you will get all the facilities in the room..like bed heater, toiletaries, hair dryer..food was basic..staff was very courteous n helplfull..it was very comfortable stay..",Minal,/Profile/Minalpawar15,,50
lahul_spiti,i stayed in this hotel for 3 days.. one of the best hotels in kaza with approx all the facilities to make your comfortable with very cordial and humble staff. walking distance from market and kaza monastery...,Vivek21504,/Profile/Vivek21504,"New Delhi, India",50
lahul_spiti,Sakya Abode is an excellent property.  The staff was very warm and welcoming. I had a wonderful stay during my  visit to Spiti as we travelled in group with WanderOn The accommodation was very comfortable and the rooms were clean and tidy.,vineet_mehrotra21,/Profile/vineet_mehrotra21,"Kanpur, India",50
lahul_spiti,Sakya Lodge is an excellent property. The staff was very warm and welcoming. I had a wonderful stay during my last visit to Spiti. The accommodation was very comfortable and the rooms were clean and tidy.,Countryside Adventure Holidays,/Profile/CSAdventuresIN,"Mumbai, India",50
lahul_spiti,"It is an absolute delight. Rooms are small but very cozy. Superb hospitality. The staffs are more than eager to serve and make your visit comfortable.  Food is awesome. The choice of breakfast is staggering - from regular toast-bread-omlette-cornflakes to nutella pan cakes, spanish omelette, puri-bhaji-paratha even Tibetan breakfast. Dinner has a lovely buffet. On order, they make Tibetan buffet as well.  Location is just beside the monastery. For going to the market place, you need to walk for 5-10 min walk across the river.",Atanu D,/Profile/AtanuD61,"Gurgaon District, India",50
lahul_spiti,Sakya Abode is definitely the place to stay on your trip to Spiti. The owner Mr. Tsering is very helpful and a good guide to ask about local things. Food was finger licking good and extremely delicious and tasty.,Sweety Samaiya,/Profile/sweetysamaiya,,50
lahul_spiti,"After gallivanting in the wilds of Spiti, there was something very special about coming back here every night, to their lemon tea, hot food, cozy rooms, open spaces, brilliant books, heartwarming music and so much warmth in general. Such a tiny place, but with so much heart! And so much intelligence too, because despite the size of the rooms, there is absolutely nothing you are going to miss here. They have done an incredible job of thinking on behalf of first timers as well as Spiti regulars.  This one’s a gem, especially if you are a 30-something unbackpacker :)",TamannaMishra,/Profile/TamannaMishra,"Bengaluru, India",50
lahul_spiti,"Stayed 4 nights.. The rooms are a bit small by modern standard, but the building is the first ever hotel in Kaza, hence the oldstyle... The owner Tsering stays on the campus and his team looks after the guests.. food excellent... They have prefixed rotating menu for each day!",bhalyakulkarni,/Profile/bhalyakulkarni,"Nashik, India",40
lahul_spiti,"The hotel is situated near the Kaza monastery. It has comfortable rooms and common balcony. The dinning hall is specious and well decorated. One corner occupies library, the collection of books of which is awesome. The hotel has lawn amidst it. All modern amenities are available in hotel. The bathroom fittings are of high quality. An anteroom is also provided.",HemantNavare,/Profile/HemantNavare,"Pune, Maharashtra, India",50
lahul_spiti,"Without a doubt THE BEST hotel we stayed at during the entire trip. The ambience, people, food and surroundings made it the hotel we enjoyed staying at the most. I should also mention that this was the only hotel that provided wi-fi in the entirety of our trip. Tsering, Poonam and Parmar went out of their way to make us feel comfortable. In fact, when they got to know that our group wanted to try the local food, though it wasn’t in the menu, they specially got it prepared for us and it was absolutely delicious. Location is very convenient as it is a ten minute walk to the nearby market which has a whole load of interesting things to shop for and two minutes from the monastery. The rooms are clean and modernized with a very nice bathroom and sit-out area. Will positively",Samritha A,/Profile/SamrithaA,,50
lahul_spiti,"We had visited Kaza at the end of Aug and had an amazing 2days stay at Sakya Abode. Their rooms are small n cozy with 4 star amenities. A beautiful lawn to sit and read or relax in the  hammocks. They have a huge lobby cum dining area with one of the most exclusive collection of coffee table books. Food was excellent, specially the Chinese dishes. Commendable efforts to take good care of the guests by the care taker Parner and Pooja.",Dipanwita A,/Profile/dipanwitaa,"Kolkata, India",50
lahul_spiti,"I visited kaza in march which was the winter season so it was quite and cold. My intention was to stay at sakya abode but due to the winter season were all accommodations are closed, I stayed at the Sakya homestay.  Kaza is a small town so you are pretty much in the center of it. Tsering and his family were super friendly and nice. Although Kaza was cold, the place was always warm.  If you are looking for a comfortable place and a home away from home then I will definitely recommend sakya homestay.",moe_hmd,/Profile/moe_hmd,"Kuwait City, Kuwait",40
lahul_spiti,"A really friendly, welcoming place to stay. The rooms are clean, functional and well kept and everything works, but what is especially nice is the restaurant/seating area (with a large collection of books on the Spiti valley) and the great staff. Everyone is friendly and helpful and it really feels homely and welcoming. The manager is a great person, goes out of her way to make your stay a pleasant one and to see what it is that suits you.  Location is good, only a short walk from the main shopping street/restaurants and can also highly recommend the hotel restaurant as they prepare really well cooked, fresh, meals.",pinkdisguise,/Profile/pinkdisguise,"Amsterdam, The Netherlands",50
lahul_spiti,"I stayed at Sakya Abode twice: in 2014 and 2018. The place is well maintained and clean. The staff is courteous and ready to help the guests. The food is good and the ambience of dinging cum common room is great. It has a tv and good selection of books. Mr Tsering, the owner, is a remarkable person and takes personal interest to ensure comfortable stay for the guests. During my last visit Mr Parmar was managing the affairs. He is good guy with accommodating nature. They are torch bearers of Himachali Hospitality.    Never felt out of place here.",manchandap,/Profile/manchandap,"New Delhi, India",50
lahul_spiti,The stay was the best in spiti with very humble and sweet staff. The food was excellent. The rooms were very comfortable and luxurious for Spiti with a beautiful garden view. The manager is very kind and always helpful. If i ever visit Kaza again Sakya Abode would be my choice.,Michelle F,/Profile/361michellef,,50
lahul_spiti,This is the best hotel to stay in Kaza. The rooms are really good and comfortable. The manager Parmer was running the show single handedly and very efficiently. Wifi is available only in the lobby/ dining area. The hotel is well located and quite close to the main market. ,Az100_11,/Profile/Az100_11,"Colaba, India",50
lahul_spiti,"Probably our best stay at Kaza and all of spiti valley,  sharing an old experience but, better late than never, our stay was in Sept 2013.. specially after days of ride from Chandigarh via the taxing malling nala, sakhya abode was heaven. The owner Mr Tsering was most amazing host and it's staff very Co operative, not to mention their amazing cooking skills.. amazing!! We were to on only take a transit halt but landed up staying there for almost 4 days.  My extended gratitude and wishes to Mr Tsering for hosting us and sharing his immense knowledge.  Thank U Sakhya Abode!  Cheers..",vivek,/Profile/vivisvivid,India,50
lahul_spiti,Mr Shiring (Kaza) and Rutika+Vishesh (Manali) are so friendly - never felt we are not in home. If I'm visiting Kaza/Manali  again - Shkya Abode for sure place to stay. We took a package and it was amazing. The road was blocked due to landslide and another car was arranged to take us to the destination.  We came back with a great pleasing memories. Thank a lot.,Prasun G,/Profile/PrasunG22,,50
lahul_spiti,this is the brand in kaza for stay.....no tv in room but rooms are very cozy and warm in food you will get limited choice but decent ones...staff is very friendly and helpful location is also surrounded by mountains,harshchief,/Profile/harshchief,"Ahmedabad, India",50
lahul_spiti,"I never expected a hotel to be in such a distant place to have so many amenities as in modern hotels. The rooms are a bit small but very cozy so we do not feel the cold outside. We required 5 rooms. In spite of booking 3 months in advance, the rooms allotted were not next to each other. But this was resolved the next day. The staff was polite and helpful. The food was amazing. It has a nice garden with hammock and swings.",Hemal S,/Profile/HemalS95,,50
lahul_spiti,"Hotel services are good. Lack of WiFi, Room heater and TV in Hotel. Bed heater is available. Food quality is good, Specially in authentic food. Bathroom quality and geyser are best. Only BSNL voice network is available.",Nirmal D,/Profile/825nirmald,,30
lahul_spiti,Had a wonderful experience at Sakya abode. It's a cozy place with cozy and nest rooms. Very courteous and helpful staff. Tsering is one of the most hospitable hosts. One can enjoy dining with other guests. They have some great books in the main lobby!,Abhimanue G,/Profile/AbhimanueG1,,50
lahul_spiti,Tsering is a great person to host your stay. The rooms are cosy and everything including a perfect mattress for a good night sleep is taken care of. Food is great and they serve you even at 5AM. Perfect ambiance and real warm people.,Nidhi_Hasija,/Profile/Nidhi_Hasija,"Sonipat, India",50
lahul_spiti,"Mr Tsering & Team Saksya are fantastic hosts. And highly knowledgeable about Spiti and the region. Highly appreciate the hospitality. Mr Tsering, Mr. Poonam and the Cowboy Dude. We loved the food at the restaurant. You need to try the Tsampa Pancake & Butter Tea. They have a decent English Breakfast too. I surely miss the Seabuckthorn Juice.",DjangoIndiano,/Profile/DjangoIndiano,,50
lahul_spiti,"Mr.Tsering is an amazing host. Parmar's helpful attitude is remarkable. Their knowledge and guidance to all the customers is exceptional. Room and Bathroom was very neat and clean, running hot water and very cozy.Overall atmosphere of the hotel is quite welcoming. If you decide to have food at the hotel, Authentic Tibetan and Spitian cuisine is a must Try ! Overall, Sakya Abode will always be my first choice whenever I am in Spiti !",Akanksha D,/Profile/771akankshad,"Mumbai, India",50
lahul_spiti,"The Sakya Abode has a hostel-like atmosphere. Corridors of rooms enclose a central courtyard with a lawn. Washing was strung out on lines, people were sprawled on wrought-iron chairs, sunning themselves and reading. A large room doubles as the reception and restaurant, and acts as a common room for the guests. It has sofas covered with Tibetan rugs arranged around a large table stacked with coffee-table books. The place seems to be very popular with bikers and backpackers. In fact, we met someone who had been staying there for a month.   Their local dishes are delicious! Most guests eat lunch outside so you might have to do the same.  This place is a great base to explore Kaza, Hikkim, Komic, Langza, Key monastery and Kibber village.",tanuka_dutta,/Profile/tanuka_dutta,"Bengaluru, India",40
lahul_spiti,"we stayed for three days.  the service was always fine.  the people who work there are very friendly.  the owner was kind and helpful.  the food was very good. it was a good place to come back to at the end of the day.  the common area with books, etc., was a good place to drink tea and talk with others.",judyth101,/Profile/judyth101,"Kyoto, Japan",50
lahul_spiti,During my 5 days long stay in this hotel. Owner Mr. Tsering looked after us very well. He is very helpful in every way possible. Staff is very helpful. Food is great. They provide valuable guidance to get the best of your stay. Highly recommended. ,ipilot320,/Profile/ipilot320,"Gurugram (Gurgaon), India",50
lahul_spiti,This is the most upscale and popular hotel in Kaza. It is popular due to publicity made by groups who trek in Spiti region and by some bloggers. However our experience was not so nice. We had to wait for more than a hour for check-in as they are under-staffed. Again they pay less attention to the comfort factor. Let me clarify the point. During our stay we were told that they serve dinner from 7-9 pm. But as a big group checked in they changed dinner time to 9pm without any intimation to other boarders. Moreover that group started smoking and drinking in common area and neither the Manager nor the Owner of the property restricted them. The scenario suddenly became intimidating for us. I would not recommend the place for a family trip. ,gkpi,/Profile/gkpi,KOLKATA,20
lahul_spiti,"The Sakya Abode is really special.  As we understand it, it is the oldest hotel in Kaza and located right next to the monastery.  It is built in a traditional Tibetan style and not very large.  The rooms are small, but very cozy with a well-equipped bathroom and shower.  There is a very nice garden in the middle of the hotel and places outside of each room for sitting.  The staff was great - helpful and professional.  The food was excellent. The nicest part of the hotel is the lobby-dining room-common area.  There are comfortable couches arranged around a large square coffee table covered with wonderful books about the region, Buddhism, Tibet,etc.  It's great spending an evening sitting there, reading, and talking with other guests. One caution: because the hotel is built in a",Victor F,/Profile/RBJoel,"Zichron Yaakov, Israel",50
lahul_spiti,After a tiring journey from tabo we arrived at kaza and were looking a really nice wifi equipped hotel. Our driver suggested this place owned by 'bhaiyaji' and we checked in. The reception area consists of hundreds of books varying from spirituality & all about Himalayan life and culture. The rooms and toilet were very clean and up to urban standards. The hotel overall is amazing if you want to spend a couple of peaceful days amid traveling to and fro on the world's most treacherous roads. ,IndiaNKoPiTe,/Profile/IndiaNKoPiTe,"Lisbon, Portugal",50
lahul_spiti,lovely old property ..with a brilliant mountain view. nice extended verandas to pull up chairs and chat..!!  the team in the kitchen where proactive and served a lovely mean with a smile ..thanks.  hot water and comfortable bed ..the need of the day ..was there!!,anil paul..,/Profile/anilp81,,40
lahul_spiti,"Stayed here for a night with friends in September.   Property is extremely beautiful, specially the reading lobby area. Made some interesting freinds while going over the fantastic books they have on display here.   Rooms are very comfortable and the toilets are clean. Hot water is easily available. Wifi is weak, of it works. Bit that's true all over Kaza.   Dining area and breakfast is very good. Service and staff was extremely helpful and courteous.   Parmar stood out for his attentiveness.   Good place to stay in Kaza, walking distance from the market. ",AshishtripAdv,/Profile/AshishtripAdv,Nasik,40
lahul_spiti,Sakya Abode is the oldest and one of the better properties in kaza. It is usually all booked so booking in advance is recommended. The rooms are nice and cozy. They renovated the bathrooms just last year so they are in a good condition and hot water is available. The food is nice but make sure you ask them what is the last order time. Parking is also available. ,AhRusty,/Profile/AhRusty,"New Delhi, India",40
lahul_spiti,"A compact, two-storeyed structure centred around a green courtyard - Sakya Abode combines this traditional Himachali architecture with modern amenties like an ensuite bathroom. The rooms are cozy and well appointed, the decor showcases the local culture and handicrafts.  The spacious dining room and lounge area are perfect for relaxation and conversation. The collection of books and fossil rocks is an interesting addition to the local handicrafts. The food is exceptional, every dish made with products sourced locally and cooked using traditional recipes. A four-course dinner is par for the course everyday.  And finally, the hospitality of the Sakya team is possibly the single most important reason for making this hotel one of the best in Kaza. Their warmth and care, their",Pathin,/Profile/Pathin,"Ranchi, India",40
lahul_spiti,I stayed in Sakya abode in October 2016 along with my 2 friends. They have very cozy and comfortable rooms with all basic room amenties. They have amazing restaurant in which u want to stay all day and read in house books while sipping your hot coffee. Owner is very friendly and will help you out in planning all the things to do in spiti. Location is perfect just beside the monastery and few meters away from the market. I had a great stay and looking forward to stay here again.,mahesh c,/Profile/maheshc421,,40
lahul_spiti,Sakya abode is the best hotel in kaza of a very hospitable and knowledgeable owner  Mr tsering . The hotel gives a warm and a homely feel. Staff and the food are the things to count on . Great experience . A must visit.,akshatchauhan,/Profile/akshatchauhan,"Shimla, India",50
lahul_spiti,"Dear all,  We have had an excellent stay at the hotel with good food, a prompt support staff and comfortable rooms.   The hotel is surrounded by beautiful mountains where you can enjoy the view of the sunset and sunrise. It's always near to the market and the Monastery (Walking Distance). Most importantly the owner and the support staff are very friendly.   I would highly recommend you to experience the stay at this hotel.",Manideep P,/Profile/ManideepP6,,50
lahul_spiti,"No doubt the best stay in Kaza. Rooms are so comfortable, restaurant is awesome, food was delicious and staff is courteous. Although we booked this hotel through meet my holiders but the hotel staff treated us like family. One of our friend was sick and had to go to hospital. One of the hotel staff named Sonam accompanied us and helped us throughout everything in the hospital. I'll personally recommend this hotel to anyone on my personal guarantee although I do not know the owner or any other staff. Our best stay during whole Spiti trip. Thanks guys. I am deputy manager in SBI. Do contact me in case of any assistance required from me.",Puneet Rajiv,/Profile/PuneetRajiv,"New Delhi, India",50
lahul_spiti,"Excellent experience, great customer service, clean and comfortable hotel, conveniently located near a beautiful monastery and market (there is a pedestrian short cut, if you are willing to walk). Staff is polite, courteous, helpful and strives to make your stay a memorable one. They helped me arrange a surprise birthday party for my daughter during our stay. It was amazing how helpful and accommodating they were especially Poonam and Parmar. Would definitely go back again.",Neha K,/Profile/nehak641,,50
lahul_spiti,"One of the best hotel in Kaza. The rooms are cozy, clean and comfortable. The staff is very nice and always ready to help. When I along with other few friends suffered from high altitude sickness, the staff personally took us to hospital and made sure we are comfortable.  The market and health center are at a walking distance. The food is nice, only thing you need to take care of is that the kitchen has fixed timings and you would not get room service if its too late in the night which is same for almost all hotels there.",ShubhraBrakh,/Profile/ShubhraBrakh,"Mumbai, India",50
lahul_spiti,"Always almost full and one of the best in Kaza! Warm cozy rooms, comfortable bedding and great staff! Stayed only a night but it was very pleasant! The food was great and I quite enjoy its location in New Kaza. Close to the monastery and a 10 min walk from the main market!",srishteee,/Profile/srishteee,"New Delhi, India",50
lahul_spiti,"A good, clean hotel option in Kaza with good service.  The only drawback is that its a like away from the main market where all the restaurants and cafes are. We stayed here for one night and it was great. ",Zahabia,/Profile/Zahabia,UAE,40
lahul_spiti,"We were a group of five people who stayed in two rooms at this hotel for three nights, 22-25 June 2017.  Rooms are very cosy, clean, colourful and beautifully furnished with Buddhist-inspired trimmings and multiple, thick rugs to keep out the cold. The toilet and bathroom are large and extremely clean; good toiletries, soap and towels are provided. We were informed that the hotel has recently been renovated and re-opened in June 2017 with the newer, more modern amenities.  Meals are reasonably good too, and served in the pretty dining-room cum reception, a portion of which also serves as a common room with books and magazines for guests to read.  Another plus point is that the hotel is a ten-minute, easy walk from Kaza market, interesting to stroll around for good food options",Khushnaz80,/Profile/Khushnaz80,"Mumbai, India",50
lahul_spiti,"Had stayed at sakya abode in june with my cousins for 3 nights. Lovely hotel. Extremely helpful staff , ever smiling and always ready to help out. They went out of there way to make sure every one who stayed there had a very comfortable and pleasant stay. The rooms are super clean with a sparkling bathroom.  Linen was also very clean. All rooms were very well lit . Food served was excellent .If I ever go back to kaza sakya abode is the only place where I will stay again. ",Mozanne  K,/Profile/m0zannek,"Mumbai, India",50
lahul_spiti,"We 3 adults were guests of Mr. Tsering Bodh in his very beautiful house in Kaza in june 2017. Mr. Bodh and his wife made all efforts to make our stay comfortable. the short conversation we had Mr. Bodh reflected his love for his homeland. the house is divided into two wings, the old and new.we were staying in the old wing which retains the old style of building material as in wood and mud. it makes the home very cozy and warm. the rooms are quite big with attached clean baths. hot water at all times. great home cooked food. also the dining area is very intetesting. one can consider this homestay if you are genuinely interested in seeing the lifestyle of people of spiti.",algaari,/Profile/algaari,"Mumbai, India",40
lahul_spiti,"A comfortable, homely stay. Most caring and courteous staff, the common room as we called it ; is the dinning area is a cosy corner where one can just unwind from the journey that tires you after travelling on one of the most difficult roads!  Indeed the best in area around!",Shalu S,/Profile/586shalus,,50
