location,review,name,user_profile,userloc,rating
lahul_spiti,"ON THE ROAD TO MONASTRY, this hotel offers peaceful rooms, great stay after long drive, stayed for two days to visit local places in kaza. one can view spiti valley and mountains from the rooms. wish to go one more time",TAMOJIT2014,/Profile/TAMOJIT2014,"Kolkata, India",50
lahul_spiti,"The best place to stay when you are in Kaza. Rooms were clean and hygienic.  There was only 02/03 people in the staff. So there is no question of good service. We prepared out own food , as they allowed us to use their kitchen, so I cant comment on the food.",Satchit,/Profile/iSatchit,,40
lahul_spiti,"This is not a backpackers hotel; rather a hotel where you can truly relax after a long drive. The hotel was equipped with all sort of basic facilities in an odd place like Kaza. The rooms have ample of sunlight and well ventilated. The beds and blankets were clan and warm. The restaurant serves good non veg food. The host is a young man who knows the Spiti valley too well, he advised us a lot about our forward journey which was really very helpful for us. We also used their phone to call back home.",Sayantani Chatterjee,/Profile/SayantaniC,"Hyderabad, India",50
lahul_spiti,"After more than 200+ kms of rugged terrain and non-existant roads, one reaches Kaza and the warm welcome at this place feels like you are abode. I saw a couple of reviews of this place saying average, which I would certainly agree if it had been a regular traveller place but given the harsh conditions of this place and acute availability of supplies I would give this place and 'Excellent' badge! The staff is super friendly and always ready to serve you great sumptuous food. Rooms are average with adequate amount of blankets for this cold place. Some of the rooms have short doors, beware if you are above 6ft tall. Has a nice campfire place and the owner is really cool to make available all the required raw material for it. Overall I was super content with my stay at Sakya Abode",Chirag M,/Profile/ChiragM420,"Mumbai, India",50
lahul_spiti,"The hospitality that the Sakya abode staff showed is still etched in my memory! Its one of the high points of my Spiti trip. After a tiring journey of more than 10 hours from Manali through the worst possible terrains all you need is ""home"". And Sakya Abode is that home. I had terrible headache from the harsh journey and the staff at the hotel were so considerate, concerned and helpful. The owner Mr. Tsering takes time out to meet and ask about the well-being of everyone who puts up in the hotel every day. The hotel has has a quaint and informative dining area/restaurant. Do not forget to spend some there. Views from the hotel garden in the mornings are surreal. A cup of tea and the morning sun is all needed to make one's day start bright. Food is awesome given the remoteness of",Puja C,/Profile/PoohPuja,"Hyderabad, India",50
lahul_spiti,"Sakya is built around a really nice courtyard, which is great for spending some quality time in the sun. The management was super helpful with suggestions for what to do in the area. The food was also pretty good, though the service can be very slow. My only real objection was that it was really cold in the hotel - in the common areas and in the rooms. Under the covers it was eventually ok, but surely something could be done about dining area?",Smallgoat,/Profile/Smallgoat,"New Delhi, India",30
lahul_spiti,"We were here for 2 days in September 2016 during our Spiti trip and it was a wonderful stay.  Rooms -  The rooms were comfortable, warm and clean. Bathrooms were large, clean and had a geyser for hot water. Overall the whole place is maintained well. If you are expecting too much luxury, you are in the wrong part of the world.  Restaurant - Restaurant serves good food. The regular Punjabi food was great ( not very easy to get around the area ). Its a nice break from Thupka and Rajma chawal. The restaurant is filled with books and the ambiance if perfect to spend the whole evening, as you read fascinating stories about Spiti.  Staff and Service -  This was the real highlight. The staff was very friendly in general, and the manager  helped us with everything from planning our next",Sapan83,/Profile/Sapan83,Pune,50
lahul_spiti,"Visited spiti, the land undiscovered, can't expect much in terms of facility though the beauty untouched are beyond words. Our stay in this hotel was v comfortable with varieties of delicious food. The owner Mr.Tsering is a gentleman ready to help and his staff are v nice as well. Thank you sakya abode team for the great hospitality!! We loved the stay n your books of course!! C u again sm day!!😄🤗",Spaldon,/Profile/Spaldon,"Neoules, France",50
lahul_spiti,"It's just another of those ordinary hotels you find in these parts of Himachal, which have basic stay facilities with no luxury of tidiness.    The rooms are ordinary, bathrooms are worse, but that's what one gets in most of these places. Still, staff is very good and food is very simple and delightful, sans spices.   Though, they have another heritage property which is seemingly more interesting if one can get a booking there. Sakya is very popular among the tourists here and it's better to book in advance specially for the heritage hotel. It is definitely an experience to look forward to as it's interiors have a special tibetan feel to it.",Rudra_Pan,/Profile/Rudra_Pan,"Mumbai, India",30
lahul_spiti,"- Kind and gracious people who will help you with anything you need. - Cozy, clean, and well-maintained rooms and bathrooms. - Amazing food - everything is super tasty and fresh. Be sure to try the fresh apple juice. - Fantastic restaurant area with a center table lined with great books. The book choices are carefully made and the literature on Spiti and Buddhism will be of great value to you. Be sure to check out the extended library and for-sale books in the shelves. - Excellent location, quiet neighborhood - 10-minute walk to the main market. - Laundry service available.  Mr. Tsering, the owner of the establishment, is one of the most hospitable and kind people you will meet - he is a well-reputed individual in Spiti. I am thankful for crossing paths with him and Mr. Vishesh,",Yurtopia,/Profile/Yurtopia,,50
lahul_spiti,"Had an excellent experience staying at the Sakya Abode. The owner, Mr. Tsering is truly a gentleman and knows how to take care of his guests. The support staff, Mr. Poonam and Mr. Parmar were of great help at all times. 100 on 10 for the food. Deliciousa and tasty. This place is a must stay if you are in Kaza.",Ashish Gupta,/Profile/ashishgupta0811,"New Delhi, India",50
lahul_spiti,We stayed here on our road trip around the Himalayas. Free Wifi near the restaurant when there is electricity. Car parking is on the roadside but is ample and monitored by cctv. The restaurant is nice and the food is homely. Value for money.,Kevin O,/Profile/HillBillyDelhi,"Coonoor, India",40
lahul_spiti,"Sakya Abode sits at one end of Kaza. With an imposing mountain dwarfing it on one side, it sits a few feet below the road level.   The rooms are modest at best, but comfortable and adequate, given the remoteness of the place you are in.  The rooms are placed around a small green lawn over two levels. The center of the hotel is the lounge - cum-dining area which is where evenings are spent chatting with other guests over drinks and travel - story swapping. The buffet spread is quite well prepared and served.  Wifi is a rarity, but no fault of the hotel there - Kaza itself is yet to receive an Internet link worth writing home about.   Overall it is a warm.and friendly place and I would stay there again if I was to   visit Kaza.  A special mention must be made of Pradeep who was",Byram D,/Profile/byramd,"Mumbai, India",40
lahul_spiti,"We had lunch here having chosen not to stay in crowded and overpriced Kaza (in terms of accommodation). They provide a limited choice (no nonveg was possible) but all the items they provided were good and very reasonably priced. We ordered chapatis, dal and mix veg all of which was very good and nicely prepared. This restaurant is honest and again a lesson to the people at Moonlake Nako. If a place like this (clearly higher end compared to Moonlake) can be so reasonable, there is no reason why others should be exhorbitant.",Wanderingsoul31,/Profile/Wanderingsoul31,"Mumbai, India",40
lahul_spiti,"Its undoubtedly the best place to stay in Kaza.The owner Mr. Tsering is a wonderful person.The staff is amazing.Punam,Parmar and Dolmaji are wonderful people around and very helpful. Rooms are neat and clean with all basic amenities. Surprisingly the food was amazing too.",Priyanka729,/Profile/Priyanka729,"Mumbai, Maharashtra, India",50
lahul_spiti,you may stay here if cant find anything else ... basic facilities with subpar service ...one poor staff member Sandeep is being pushed to service all and everyone ... give him a raise and hire some additional help...  breakfast/Dinner must be avoided here .... nothing to talk about that ... highlight of the stay was playful puppy sandy roaming around and playing around with everyone.... all the best sandy :-),isoly2,/Profile/isoly2,Sydney,20
lahul_spiti,"Sakya Abode is one of the best places to stay in Kaza. Well lit, and clean rooms with some the most hospitable, accommodating and friendly staff to take care of you. Everyone is super friendly, very high on customer service and providing helpful travel tips and sharing interesting local facts. The lounge/dining area is a great place to meet fellow travelers, laze around, browse through the amazing collection of books or just unwind. The food is hygienic and fresh. Highly recommend staying here.",PallaviBavishi,/Profile/PallaviBavishi,"Mumbai, India",50
lahul_spiti,A nice basic hotel sadly lacking views of the Spiti Valley. Antique bathroom plumbing but you can coax hot -water for a shower (sometimes).  Virtually no Wi-Fi available.  I imagine that there are better hotels available in Kaza,GSB4681,/Profile/GSB4681,"Sydney, Australia",40
lahul_spiti,"only one word for sakya adobe Awesome!!! Sakya adobe is one of the best place to stay in kaza. Everything is awesome here. All thing are beyond your expectation. This is not luxury place but very comfortable. Room are small but very neat and clean. Staff is always ready to help you. Food is really very tasty and delicious. They made food with ""Dil se"". You can't express you feeling in words. Just go there and feel their hospitality and i assure you, you will not disappointed.",vikky77,/Profile/vikky77,,50
lahul_spiti,"Highly recommended for the clean ,peaceful ,spacious stay with beautiful views in Kaza. Right opposite the highest petrol pump , it's a walking distance from the market and is built aside a beautiful monastery.  Tenzing helps people plan their iteneries and help them with all the information that only a local can help with. The dining area is wonderful too wth prayer flags, books and quite a lot of material on Buddhism & Spiti. Sandeep and his team makes sure you eat the best food while you stay there.  If you are looking for luxuries of room service and stuff, might not be the place for you. ",ShrutyS,/Profile/ShrutyS,"Mumbai, India",40
lahul_spiti,"Large rooms, beautiful courtyard and best of all an amazing dining/common area with the best of literature on Tibet, Buddhism, Himachal, Kaza, etc. Its a bit of a walk (5 mins if you know the short cut) from the main Bazar area. You will get internet in the common area but not in your rooms. We did not have any TV in our rooms (neither did we expect). So if that is mandatory for you - please check it up. Food was good and we got warm water readily from the bathroom tap (do not expect instant geysers)",ijwtt,/Profile/ijwtt,"Pune, India",50
lahul_spiti,"Visited Kaza, Spiti, in Jun - July 2015 along with a pet. Sakya Adobe was a blessing in the high Himalayas. Comfortable and cozy, the staff were very polite and helpful without being intrusive. Food was hygienic and good for the location(given constraints of the local market), freshly cooked and served hot. The rooms were adequate although a wee bit constrained in space. A spacious green lawn was soothing to the eyes and a good place to relax. Electricity was erratic but did not constrain anything. The owner was friendly. P.S. This review is for a travel before Sep 2015. I chose Sep2015 in the date for travel option as prior travel was not listed in the drop down menu, Things can only improve, so some of my experiences are possibly outdated. Still I posted as it was for me time",cmsingh,/Profile/cmsingh,"New Delhi, India",50
lahul_spiti,Rooms are minimal. 300 meters walk to Kaza town. Expect electricity outages most parts of the day. Make sure the electricity is back on for at least 30 mins if you need a hot shower. Nice lawn in the middle to chill and relax. Good food at the in house restaurant.,Raymond S,/Profile/Sgraymonds,Singapore,30
lahul_spiti,We had an amazing stay at Sakya Abode. The rooms were very clean and the hospitality of the owner and the staff was amazing. Poonam and Parmar really took very good care and were always around to help. The place has an amazing view and is located right next to the Monastery.,Damini J,/Profile/DaminiJ953,"New Delhi, Delhi, India",50
lahul_spiti,"The staff @ Sakya Abode - Parmar and Poonam showed amazing hospitality. They had their hands full with all rooms occupied but they still found time to not only cater to individual requests but also to chat with the guests and give them tips for travel in the region, share some interesting facts and in general make the guests feel at home. Never saw them without a smile on their faces. In remote places even small gestures count and Parmar and Poonam definitely know that!   The food also was another high point of the stay - everything cooked to perfection, we had a variety of food in the 2 night stay - rice, dal, vegetables, pasta, pizza, sandwiches, custard- all delicious.   The owner, Shiring (plz forgive if the spelling is wrong) came to meet us in the evening and to ensure",Ann,/Profile/anparash,"New Delhi, India",50
lahul_spiti,"Our room was very small, no storage space so really living out of suitcase.  Linens were torn. But it was mostly clean and comfortable.  The bathroom is unusually large but a real wet room so after shower you have to squeegee the floor.  Food was good - lovely momos one night for dinner.",dotc2015,/Profile/dotc2015,Arizona,30
lahul_spiti,"The rooms are clean and hygenic...the place is extremely close to the monastery.. love the kind hospitality of the Owner and his staff (extremely helpful)...the food is amazing too.. ..and we had meals included in our package...we did get to enjoy the local spitian food/breakfast... special thanks to boys Parmar & Poonam (they wouldn't think twice if we requested them to use their phones to make call back home), they always greeted us with smile....Parmar is amazing singer too :) got to hear him when he doing his normal chores of the day.. they love to make you feel special .. wouldnt think twice to go back some other day !",swatiskaran,/Profile/swatiskaran,,50
lahul_spiti,"very good hotel. rooms are small but good. restaurant is very good. Food quality is very awesome. There is one library with very good collection. Atmosphere, neat & cleanliness and staff behavior  is excellent. Proprietor of the hotel is also a  nice gentleman. There is also a well maintained small garden for launch & dinner and also for children entertainment.",Samir R,/Profile/SamirR401,,40
lahul_spiti,We stayed at the monastery sakya abode which is run by tsering. We had a comfortable stay and tsering and his staff were very helpful. In fact our whole trip was arranged by tsering and his partner vishesh shourie.,farida k,/Profile/faridak571,"Pune, India",40
lahul_spiti,"A nice cozy hotel.  Rooms are a bit small, but comfortable. The restaurant menu is great albeit a little limited due to non availability of certain ingredients at Kaza. The owner, Mr. Tsering, is a thorough gentleman and very helpful. He even made the effort to take us to the local hospital at 10 pm after my 6 year old son became ill.  The hotel also has a small library which pretty much runs on an exchange basis. One of the very few hotels in the area having a internet wi-fi facility. The hotel is built in traditional Spiti style with mud walls.",A_WiseOldOwlInTheOak,/Profile/A_WiseOldOwlInTheOak,Antarctica,40
lahul_spiti,The hotel is not ideal for those who do not prefer loud music being played in the lawn till 2.30am and people drinking in open area. They should have rules in place around this and privacy of other guests should not be compromised just to make money from a large group. I wouldn't recommend this hotel for families/couples.,Amit,/Profile/AmitLahoti,"Mumbai, India",10
lahul_spiti,"Located just opposite to the monastery, this property is aesthetically done to give a full feel of the Tibetan culture. The restaurant serves quality delicious food. Service staff is very good,doing their best to please the guests.  Overall a very nice place to stay in Kaza.",Sbhu,/Profile/Sbhu,"Gurugram (Gurgaon), India",40
lahul_spiti,An excellent hotel. The staff and the owner Mr. Chering Bodh make a very competent team to make guests feel at home. The sitting area for families is very cozy. There is a large collection of books from old National Geographic issues to hard cover volumes on Himalayas including one on history of Spiti valley. The food is one of the best we had on the tour although the menu is limited by the availability of vegetables. The rooms are big and can comfortably accommodate an extra person.  The hotel had mud walls and is traditionally built.,amitganpule,/Profile/amitganpule,Bilimora,50
lahul_spiti,"I reached Kaza around 8pm from Rampur after riding through the worlds most treacherous road as per BRO but i felt the word Road has been disrespected as there were none and you were actually driving on rocks. I was greeted by Tsering who was owner of this property. good service, one of the best restaurants in Kaza, and certainly the nicest dining hall, with coffee-table books, travel library, settees and armchairs inviting travelers to chat. nice garden, rooms a bit tiny but clean; definitely recommended.",zia535,/Profile/zia535,"Lucknow, India",50
lahul_spiti,I reached Kaza around 7pm from Kalpa after riding through the worlds most treacherous road as per BRO but i felt the word Road has been disrespected as there were none and you were actually driving on rocks. I was greeted by Tsering who was owner of this property.I got a room on the ground floor and the rooms were made of mud. The rooms were very well maintained and you have 4 layers of blanket to save you from cold in the cold desert.The bathroom had geysers and it was neat and clean.These things you get anywhere else as well but the point I am trying to stress here is the facilities that you get in this remote region. They have a very cozy restaurant where you have wifi facility(only available when you have electricity as Kaza have 12 hrs a day) and you have got wonderful,Suvojit Roy,/Profile/Suvojit28,"New Delhi, India",50
lahul_spiti,"Very nice and comfortable stay. Good hospitality. Nice interactions with the Owner on books and traveling. Enjoyed local Tibetan delicacies at their home as well, which is nearby, Must stay place for anyone. Its very near to bus stand.",shreyas w,/Profile/180shreyasw,"Mumbai, India",50
lahul_spiti,"Fine place, owner-run by Tsering-Bodh, good service, one of the best restaurants in Kaza, and certainly the nicest dining hall, with coffee-table books, travel library, settees and armchairs inviting travelers to chat. nice garden, rooms a bit tiny but clean; definitely recommended",BenMasai,/Profile/BenMasai,"Redhill, United Kingdom",40
lahul_spiti,"Stay in the tough terrains of Spiti valley is made comfortable by Sakya boarding houses. I have had the chance of their hospitality in June 2015 during trekking in that region. What makes it so different and enjoyable is it's ambience, it's design and moreover a very friendly staff along with the joyful owner Mr Tsering. I didn't have the chance to stay in their rooms but they definitely let me put up my tent in their premises. But the restaurant's ambience, the food quality and taste is great. Tsering bhai is very genuine personality and I remember chatting long with him during the dinners. The staff there is very friendly as well. Met many wonderful people staying there during that time. I would say it would be one of the best places to stay at Kaza.",Ravi-d_wanderer,/Profile/Ravi-d_wanderer,"Mumbai, India",50
lahul_spiti,"Very clean rooms, Food quality is excellent. Hot water facility in bathroom. Service is very good. Car parking facility is very good. Best hotel you can find on kaza. you can enjoy the beauty of spity vally from the hotel",iamani10,/Profile/iamani10,"Bardhaman District, India",50
lahul_spiti,"If you are looking for a stay in kaza, look no further. It doesn't get better than sakya abode. Mr tsering and his staff take very very good care of you after your tiring journeys and you get the best guidance from them. The food was beyond expectations. I strongly advise to eat all meals here instead of experimenting anywhere else.  Thank you once again to Mr tsering and his assistant poonam for their wonderful hospitality.",Vaibhav G,/Profile/VaibhavG469,"Abu Dhabi, United Arab Emirates",50
lahul_spiti,"This is definitely one of the best stay in Kaza. Cozy, clean, and comfortable rooms. The food is amazing and the staff are friendly and fun. Owner is a lovely person and really ensured we were well looked after and comfortable.",Akshay910,/Profile/Akshay910,"New Delhi, India",40
lahul_spiti,"We were a group of 10 people who stayed at Sakya Abode for 2 nights. The Hotel is clean and really comfortable. Mr. Tshering who owns the hotel along with a couple others welcomed us warmly upon our arrival. His hospitality is an absolute delight. The staff is courteous. Even though there was no electricity for the most part of our stay, we didn't face any trouble. We were supplied with adequate candles and hot water whenever we wanted. Highly recommended.",Rajat G,/Profile/901rajatg,,50
lahul_spiti,"I stayed at Sakya Abode on my visit to Spiti. It is run by Tsering Bodh of incrediblespiti.com   He is a soft mannered, well informed and ready to customise the trip to individual needs. Helped me with my first shot of the Milkyway.   The rooms are clean comfortable with adequate hot water facilities. The food is awesome and the kitchen ready to help you all night.",Sagar014,/Profile/Sagar014,,50
lahul_spiti,"Me , my husband and our 18 month old kid went on a 10 tour of the spiti valley. We had a reservation at some other hotel which we didnt like - it was little creepy & Dingy and non kid friendly. Sakya came to our rescue. Its right next to the monastery. It was so peaceful. staff was quite accomodating. they understood that we are with a kid and ensured to provide room service ( they dont have room service). food was good. Rooms are enough spacious for 2 people. cozy and clean and comfortable. The only drawback, its right next to the main highway. so little noisy.",Gurpreet_Nikhil,/Profile/Gurpreet_Nikhil,"New Delhi, India",50
lahul_spiti,"We stayed in Sakya Abode for one night in July 2015 (two couples). It's a small but charming hotel with 10 odd rooms. The rooms are small, rather cozy, but the bathrooms were clean and big. It is conveniently located - close enough to market but away from the hustle. The view from the hotel is not that great since it's at the backside of the town and away from the river and mountains but that's a small minus. The restaurant is great and all the food we ordered ( pizza, north Indian food) was delicious. The hospitality of the staff and especially the owner Mr Tsering is great and you are made to fell very welcome. Mr Tsering also was instrumental in organising our trip to Spiti through Incredible Spiti and the team did a great job! All in all - if you are visiting Kaza - don't",Akshay B,/Profile/AkshayB870,"Bengaluru, India",50
lahul_spiti,"One of the very few mud constructed hotels in Kaza, Sakya Abode is run by Mr. Tsering. He is welcoming and catered to both our needs as well as fancies. Tsering is a very well read guy and we got into really engaging and interesting conversations of Spitian life and living with him.   The rooms and clean and comfortable and well stocked to fight the chilly Kaza nights. The local construction is an added advantage. The dining area is a quaint place with an eclectic collection of books and an envious stock of fossils. Surrealistic paintings dot the corridor walls. Sakya Abode is also one of the few internet blessed areas in Kaza.  There are also computers that you can use.   The food is especially good, and the hospitality even better. Try the local seabuckthorn delicacies, local",sriporna_chakraborti,/Profile/sriporna_chakraborti,"Ahmedabad, India",50
lahul_spiti,Kaza is a beautiful place. This hotel is just in front of a monastery. They have around 5-7 rooms. The restaurant and the staff are too accommodating.  These people are not money minded. They just take care of their guests well. Better carry water heater with you. The gyesers here are not at all relatable. Lot of power cuts in kaza. A Just ask for what you want. The staff help you out. No WIFI.  Only BSNL signals work here.,srividhya_umashanker,/Profile/srividhya_umashanker,"Bengaluru, India",40
lahul_spiti,"Excellent place at Kaza. Owner Tsering was warm & friendly and amenable to all our needs. We had booked our tour through Incredible Spiti, and Tsering was responsible for arranging the vehicle and bookings at intermittent places. All arrangement were great",pratik_tapadia,/Profile/pratik_tapadia,"Nagpur, India",50
