location,review,name,user_profile,userloc,rating
pithoragarh,"KMVN is located at the foothills of Himalayas and has a great view. If you want to experience Himalayas from very close, you should choose KMVN.  Rooms/cottages are small. Note that they do not have heaters but they do provide air blowers which would keep the room relatively warm. This is a paid service that would cost you Rs. 236/- per night. Food that you get is just below average. Same menu for breakfast throughout the week.  View from the cottages are not that great but that from second floor rooms is great one. But cottages are relatively in a better condition than the rooms. So choose wisely..better room or View! you can't get both.  But one has to appreciate the efforts of the staff to keep up this property in such a remote place.",Shri&Sid,/Profile/siddheshjm,"Pune, India",40
pithoragarh,"Location: Unbelievably mind blowing. It's almost impossible to move inside the room from the gallery or from upon the watch tower  Service: Quite good, if you are a good communicator. Staff is not bad but, since it's a government venture, we just need to be specific about our needs and also communicate in proper way. Ours was a nice experience with all the staff members there.   Food: Food is good, but we need to keep the location in our mind. At a remote place like this we cannot expect lots of items offered, but quality and taste of food are good enough. And if we inform about our choice of food well in advance they prepare nice food.   Cleanliness: Good and we can make it better on demand.  Sleep Quality: Excellent.   Special Point: Get up as early as possible and enjoy the",Prashant P,/Profile/prashantp493,"Rajkot, India",50
pithoragarh,"Chaukori is excellent. You can have a view of excellent sunrise and sunset from your room. The ambienc of the hotel is the best one. The service also is good and not like typical govt. hotels. We came here from Kaushani and on the way please have a stop to eat typical Kumaoni cuisine in Zyka restaurant. Patal Bhubaneswar is just 39 kms away from Chaukori and don't miss it. Another intresting thing is musk deer farm, just 3 kms from Chaukori. You have to trek 1 and half kilometre to view the deer farm. Entry is prohibited after 3 p.m and camera is a complete no-no there. You must stay in Chaukori for at least two nights.",Debottom C,/Profile/debottomc,"Kolkata, India",50
pithoragarh,"This TRH is located in a mind blowing place. We stayed in the executive room and the room was very good and view was mind blowing from the room. Bathroom was also super clean with sufficient running hot water. Service is also good. Food preparation was also very good. In my opinion, best place to stay in Chaukori.",Sujitc75,/Profile/Sujitc75,"Kolkata, India",50
pithoragarh,Chaukori has nothing other then its natural beauty. Trh chaukori is constructed on the best point of chaukori.Great view of himalayas espesically Trishul parvat.one must try to book its cottages to enjoy the best of trh chaukori. Its a must go place in kumaon. very cheaper rates in off season and average in peak. Stay there.....,rkprimus,/Profile/rkprimus,"Haldwani, India",50
pithoragarh,"Location as with all KMVN is superb but the room condition is average and the services are pathetic. But there is no better bet. If you visit, take the top floor if not suffering from knee or heart issues. View from huts is not good but they are in isolation and you are not disturbed. If going with children's must take football and bat ball , you will remember why i have written this. Must see sun rise from the Machan. Nothing to see more then this in Chaukori. As couples great place to stay for 2-3 days.",Narendra Rai,/Profile/nrai666,"Lucknow, India",40
pithoragarh,"Must visit for DSLR owners, who love to click natures photos... Snow clad peaks , amazing sunrise and sunset. This place has beautiful cottages with amazing view. Nice , neat and clean rooms. had a great and relaxing time",DrRahulvarma,/Profile/DrRahulvarma,"Ghaziabad, India",50
pithoragarh,"If you want to do a stayover in Chaukori enroute Munsyari or Kausani, KMVN TRH is the best option. A nice place, clean rooms with hot water, a balcony with a wonderful view of Panchchuli, Nandadevi, Nandakot and Annapurna range made our stay.   We had booked a double Bed Super deluxe room on the first floor. The view of the mountain range was awesome in the evening, with the ranges suddenly getting completely visible with a sudden splash of rain. Morning sunrise was not that great, given the cloudy weather, but the shutterbugs will surely love the light and shade. View from the Tower is great.  Chaukori itself is a small village, dotted with tea estate. The TRH is well maintianed and staff is helpful and attentive. There were a few cottages that looked colorful and vibrant from",yajnasb,/Profile/yajnasb,"Kolkata, India",40
pithoragarh,Beautiful hotel both in position and value for money.I booked a executive room for two days 31/5/17 and 1/6/17. The service is excellent.great view from hotel.I am very satisfied.You can see all peaks from room. There is also a watch tower to view.,Subrata_g2013,/Profile/Subrata_g2013,"Burdwan, West Bengal, India",50
pithoragarh,"The KMVN TRH is the usual reasonably priced rest house in a very nice location for a view of the snow capped peaks. The food was good as well. The only problem was that it was very touristy and crowded (although this was peak season: May-June). The main  disappointment was Chaukori itself--we went expecting a small town among tea gardens, but apparently most of the gardens have been sold to resort owners. So the place was full of hotels, complete with bhajans issuing from a brand new ashram nearby at 5 AM! Well, we should've stayed back in the city to experience the noise and crowds..!",EcoBirder,/Profile/EcoBirder,"New Delhi, India",30
pithoragarh,Stayed here on 26th and 27th may 2017.The hotel is very good to stay at.Rooms are spacious and well maintained.TRH Chaukori provides good view of Himalaya and sunrise.If have a plan for night stay at Chaukori do stay at TRH.Staffs are very good and cooperative.Food are good.But certain variations are to be made in the breakfast otherwise its ok.,SOUMIK1975,/Profile/SOUMIK1975,"Siliguri, West Bengal, India",50
pithoragarh,This TRH is well maintained and is ideal for a night halt.There is nothing else other than the view of Himalayan ranges.Staff is courteous and food is also good.You can halt here if you want to have a break enroute Munsyari or you can visit Paral Bhuvaneshwar temple from Chaukhori which is approx 30 km from here,HariomSK,/Profile/HariomSK,"Bengaluru, India",40
pithoragarh,"Family Holiday to kumaon himalayas, stayed two nights. what an experience. what view. very well spread out property, well maintained by the government. Good food and satisfactory service. best is the location.",Kaushik B,/Profile/kbas,"New Delhi, India",50
pithoragarh,"Stayed at this property while my road trip to Munsiyari. Opted for cottage which are best option in off season. Food menu was dirt cheap, room service was good.   Overall ok type maintained property bit at Amazon location with ample car parking.  Buffet breakfast was horrible wish they can shed their government attitude.  Rooms are good cosy with hot water supply, they provide oil heater on request. Small market is also nearby.  View from hotel is breathtaking during sunrise and sunset.",Anish01,/Profile/Anish01,"New Delhi, India",40
pithoragarh,"We have stayed during October, 2016 for 4 days.. We stayed in cottages 5 and 6. The view from the cottage is wonderful. One of bathrooms was smelly in the cottage. The food is good otherwise int he hotel: however, chicken is only prepared on order. This ambience of the place is really good. look forward to visit this place again",jayeeta s,/Profile/800jayeetas,,30
pithoragarh,"Chaukori is a small village located some 180 kms away from Nainital close to Berinag and not a very popular tourist place .. It was once known for its tea gardens during the British raj but today Lies much neglected.. But nonetheless the uk government has done a good job with the kmvn guest house.. The 2 bed cottage has not only great views but the rooms too have been aesthetically done up.. The 3 bed COTTage was disappointing in comparison.. They have a beautiful property with huge Garden, a watch tower and facilities like dining and spectacular view of the Himalayan peaks like Nandadevi, nandakot etc.. The service is as expected from a gov set up.. They have built a nice property but seems like they haven't marketed it well enough since there were a dearth of occupants..",Vipul556,/Profile/Vipul556,"Mussoorie, India",40
pithoragarh,"I have visited most of himachal n uttranchal, sikkim and I think among them leaving aside jammu kashmir CHAUKORI TRH has best views.hotel is huge with large parking, huge garden n vow view of Himalayan peaks.there may be many places with views much better than this but they may be in remote, with dirt roads, shabby town, dense population, non road accessable,require trecking, no internet or restricted electricity,water,hot water supply etc. Keeping these things in mind Chaulori is one of best. Old wing has better views as they are on 1st n 2nd floor but rooms are small,old with no lawn.best to take superdelux cottages esp 6 and 5 no.they are newly furnished with good interiors n a separate sitting room.there are 3 family cottages but they don't have separate sitting room and",RajeevDr,/Profile/RajeevDr,,50
pithoragarh,"This KMVN is an  excellent example of architectural wonder amidst serene Himalayan environment.  Chaukori is a small hamlet in Pithoragarh district of Uttarkhand with mind-blowing vistas of magnificient peaks of Himalaya...like Trishul, Mrigathuni, Maiktoli, Nandadevi, Nandadevi east, Nandakot, Panchachulli and Annapurna range of Nepal.  This property is the best place to sit and watch the mighty peaks. The vast, green campus is a charming experience for nature-lovers. There is a watch tower also to enjoy the panoramic view of mountains and valleys. Morning and evening walks upto the tea garden (which offer even more better view of peaks) yet a nice experience. We stayed in the budget room at the ground floor. And it had equally great views through large glass window.  All the",Maps23635602320,/Profile/Maps23635602320,kolkata,50
pithoragarh,"Good property located in a beautiful location.The views is just awesome. Rooms are equipped with basic amenities.We have taken one executive room and one super deluxe rooms, and views from the rooms was amazing.Food option is limited (veg and egg dishes) and service is good.",Maayaanaa,/Profile/Maayaanaa,India,50
pithoragarh,"Chaukori is at a height of 1976 meters or 6482 feet with magnificent snow-capped views of Nanda Devi, Nanda Kot and Panchachauli. Kuman Mandal Vikas Nigam Hotel is an ideal choice for stay because of  the magnificent unhindered Himalayan views. The mountain range is spread wherever your eyes go. There were many children climbing the watch tower for a better view but I chose against it as it was shaking. Tea in Himalayas with Tea Gardens in vicinity is such an experience which  you will never forget. There were many tea gardens around to be explored on feet and there we spotted a giant mushroom.  Walk around the area sent a canine guide to our help fondly called as Dabbu . He took us to a small temple of Local goddess and kept waiting to take us back also.  The panoramic view of",Archana S,/Profile/archanas64,Ghaziabad,50
pithoragarh,The TRH is a very beautiful property. I stayed in one of the Cottages so can't comment about the rooms. The Cottages are beautiful and spacious. The bathrooms are clean and big. The bed is quite comfortable and big. The view from the cottages that I stayed in was very good and the snow laden mountain peaks of NandaDevi and Panchacholi are visible. The televisions has almost all channels that I required. The rooms have ample charging ports. There is no room heater available though.  The dining area is good and spacious. The menu is big and requests can be made to the kitchen. The service is good. All in all the place is good and a good option to stay at.,sidag95,/Profile/sidag95,Chennai,50
pithoragarh,"Fantastic property, well furnished rooms, excellent housekeeping, the Cottages are located at a rear end, fantastic view of Snow cladded Himalayan peaks from lawn, rooms, Cottages. Added attraction of this Hotel is the well decorated and planted lawn. Food served is also very tasty. Overall it will be a nice experience to stay in this Hotel.",Anirban,/Profile/Anirban0302,"Kolkata, India",50
pithoragarh,"The TRH( Tourist Rest House) is just beautiful specially the 2nd Floor Rooms or the  splendid Cottages the resort is decorated beautifully and so is the service and behaviour of the staff is splendid , The snow  capped peaks or the sunrise witnessed from the balcony, view tower or the garden is splendid.",SamikB2016,/Profile/SamikB2016,"Kolkata, India",40
pithoragarh,"We were a group of 10 people on way from Munsiyari to Haldwani and decided to stop at KMVN in Chaukori. It is a fairly big property. There is enough parking space inside the hotel boundary. They have rooms in the main building (where they have the main reception as well as the restaurant) as well as several cottages, the two being connected through a very big lawn. We took 3 cottage rooms all together.   The highlights of the place are:  1. Openness of the property 2. Super Views of Nanda Devi and other mountains from this property. There is also a watchtower appx 20 Meters high and one could take the stairs up during sunset/ sunrise for excellent views and pictures. . 4. Largely Clean Rooms and washrooms (except for a big spider found in the room). They have one as well as 2",VMEHTAGGN,/Profile/VMEHTAGGN,"Gurugram (Gurgaon), India",40
pithoragarh,"I have been to KMVN Chaukori four times and everytime I have found it to be better than before. After Renovation, this has become really excellent. Views fro Chaukori are anyways great. Very light on the pocket. Be prepared to limited food options though, especially in mid and off-seasons.",VJ81,/Profile/VJ81,Gurgaon,40
pithoragarh,"Chaukori is a small village having a great view of the Himalayas.  The lodging options are limited. Amongst these,  KMVN is the best place to stay.   The views are simply awesome and the rooms are clean and equipped with all the basic amenities.   The booking process is fairly straightforward and can be done online. The staff is polite and the meals are simple and tasty.  Expect the basic and you won't be disappointed.  Overall a neat, clean and affordable place to stay in Chaukori.  ",kunal b,/Profile/348kunalb,,40
pithoragarh,My rating is based on morning view. Location is awesome .Form balcony it looks like touching distance. In Chaukori 3-4 other hotels are there but either rates were very high or review was bad. Finally we decided to book this hotel . We stayed in 1st floor super deluxe rooms.Considering rate rooms were good. Toilet was clean and geyser was working properly. You should ask attendant for mosquito oil or coil as same will be very much required. Don`t keep open you window and door. Cable channel had a limited option. Now the worst part staffs were not willing to provide better service. Dinner had a very limited option. At 4.30 or 5 you have to confirm dinner order. Morning complimentary breakfast was jsut ok but instead of puri they should provide chapati . They can increase rate and,Anjan K,/Profile/anjy37,"Kolkata, India",40
pithoragarh,"You get the best benefit of staying in a government guest house in Uttarakhand, viz., huge property. The best is to stay in 6-7 secluded cottages, extending more into the bosom of gigantic mountains ahead. Just stand in the middle of the property, and swirl around 360 degree to get a near mesmeric experience of being in the midst of the mighty himalayas. On a clear day, snow clad himalayan peaks appear at almost a stone's throw away.  Service is decent at best. Food wasn't too great to be honest. Bengali tourists (especially from Bengal) would find the preparations and items more akin to their likings, as this happens to be a pretty popular amongst Bengalis and hence the staff have accordingly mastered the typicalities of their culinary.  I would recommend not to attempt from",Joydeep121,/Profile/Joydeep121,"Noida, India",40
pithoragarh,We stayed in cottage no 6 for a day..the interiors..beds..toilet everything was perfect. But the service is not upto the mark. Staffs are lazy. .rude..and dining area is not very clean..full of house fly. Breakfast was complimentary...there was only puri bhaji...nothing else.Even we had to ask for black tea during breakfst.,SuchiSuvra,/Profile/SuchiSuvra,"Kolkata, India",30
pithoragarh,"Stayed in the Executive Room at KMVN for a night. Chaukori is a remote place and I could find only 2 other hotels in the area. It offers the best view of the snow capped mountains. There is a high watch tower on which one can climb for getting an unobstructed view. There is a main building with a lawn in front and the cottages are on the other side of the lawn. Cottages seem to be recently renovated in a more planned manner, the other rooms suggest that there were some cost cutting during their renovation. The room lacked sufficient lighting and the bathroom had signs of seepage. The same was the case with the common areas like reception and the dining area. The doors of the room were old and looked repainted making them a bit tacky. The room and bed linen was clean but the",Rajat S,/Profile/433rajats,"New Delhi, India",30
pithoragarh,"This is recently updated with beautiful new cottages, which are reasonably priced with modern amenities. The staff is courteous. The Himalayas are behind The cottages but there is a special provision to view them in front of the older building. One can climb to about 25 ft for an unobstructed view when they are not hidden by clouds. If there could be lights in the lawn, it could make it even more beautiful during evening. It appears quote dark, if one has to walk for dinner from their room to eating area. Overall, a positive and a memorable experience.",SujitTandon,/Profile/SujitTandon,"Noida, India",50
pithoragarh,"KMVN Chakouri is a very good property in the remote area of Uttarakhand. It had all Ameneties.  The big let down was the dining facility and kitchen. The cottages are about 100 feet from the main building, hence it is difficult to serve the cottages. I wanted to give it a 4 star, but the food and dining facility makes it deserve a 3 star rating.",Sublime11,/Profile/Sublime11,"Bhubaneswar, India",30
pithoragarh,"We had 1 executive room booked that again had broken floors & we requested for cottage. We have stayed in 2 iterations here in the way to Munsiyari & back. The cottage provided 1st time was better than the 2nd time. In General stay in the cottage was a great experience. If the weather is good, it feels like heaven based on the grand views. KMVN has its usual advantage of great location & disadvantage of maintenance can be made much better. Food was good. ",Kaushik_Basu_1969,/Profile/Kaushik_Basu_1969,"Kolkata, India",40
pithoragarh,"If you visit Chaukori, this is arguably the best-located property. The kind of views of you get from here, especially on a clear day (between Oct-April) is unparalleled from any Hill-station in India (unless you embark upon some really gruesome treks). There is simply no need to look anywhere else.   Breakfast buffet is unlimited & good quality. Lunch & dinner is paid but there is range of choices & everything is absolute value for money. You can even ask for evening snacks of your choice & depending on availability, they would prepare it fresh for you.  The resort itself has sprawling verdant gardens laid down in a semi-circle arc, encircling a large open ground (which is slightly larger than a football field). There are comfortable benches in the open to laze around & watch a",Footloose_Rahul,/Profile/Footloose_Rahul,"Bengaluru, India",50
pithoragarh,It s the only place I believe you should stay during your trip there . Please try to get the third floor front facing room with balcony so that you can get a good view of the peaks in the morning. It was a excellent place. food was so so but it was secondary for us. The property is well maintained and also having great service. The voltage is not much there so the room heater will not give you desired warmness. but overall this the best place to stay in chaukori,Subhadip B,/Profile/4subhadipb,"Kolkata, India",50
pithoragarh,"Excellent place to stay for great view of sun rise and Himalayan peaks ,if weather is clear. On line booking can be done. Room heaters are provided and food is satisfactory. Maintenance of rooms should be improved. Very peaceful place to enjoy the nature and take sun bath.",H L S,/Profile/629hls,,40
pithoragarh,"I suggest not to visit the place in the next month also till it rains and the skies are clear. Chaukori in general was hot around this time which is rather alarming. Did not see any peaks from here due to forest fire. The property location and quality id very good however there are some issues with the management. Rooms are very dusty, I stayed in super deluxe. Water pressure is very low so it takes about 45 minutes to fill a bucket. There are rampant power cuts which leads to no water...forget hot water! They dont serve bread in breakfast...atleast when I was staying. Overall I liked the place but not the hotel.",prithvirajbose,/Profile/prithvirajbose,"Kolkata, India",50
pithoragarh,Small place but KMVN TRH is good - the view is excellent and we were lucky enough to get clear skies for a great view of the Himalayas. Stayed in the cottage which is very nice and cosy. The food is good - homely but if you are looking for non-veg then you will be disappointed. Over-all a good experience.,aloke m,/Profile/_alokemkhrj,"Gurugram (Gurgaon), India",40
pithoragarh,"Like other KMVN TRH,  this one too  is located at a prime spot from where the views are just awesome. I stayed in a cottage from where there was no view, However, second floor rooms (I do not remember the category, but are cheaper than the cottages) offered magnificent views (they were kind enough to show me one such room). It was very cold during January and they charge some money for a radiator. Room service was ok and food was good.  During my stay there was no house-keeping, not even on demand. The furniture were newly painted that smelled very strongly and was difficult to sleep. All 3 evenings there were bon fire, during lunch time there was a barbecue laid for day time visitor. It seemed to me that staff were very enthusiastic about these activities. Front desk staff are",AsitDas,/Profile/AsitDas,"Bareilly, India",30
pithoragarh,"Chaukori is a quiet lil village atop high mountain and KMVN has a wonderful Tourist Rest House there. The TRC consists of a main building consisting of reception, dining room, kitchen on the front side ground floor and different categories of rooms at the back side - on the first and second floors as well as on the ground floor with excellent view of the mountain range from the first and second floor rooms. The TRC has a sprawling spread and there are about eight or nine cottages to accommodate tourists loving seclusion and solitude. Two major problems of these cottages are that  views are obstructed owing to a new huge hotel construction and the fact that for any food one has to walk to the dining room, which is very inconvenient in night(there is no light on the way).  The",anirban1954,/Profile/anirban1954,"Kolkata, India",40
pithoragarh,"I always opt for KMVN for their locations, but in many places their property can be better maintained for the tariff we pay. The cottages at KMVN Chaukori are an exception - they are well maintained with attentive staff. Food wasn't great, but we did not mind as the surroundings are worth the stay. Like someone mentioned earlier on, a big eyesore is a tacky ship like modern building in the vicinity which constantly reminds us of our insensitivity towards nature's beauty and our responsibility to protect and preserve it.",LavanyaKurup,/Profile/LavanyaKurup,"Bengaluru, India",50
pithoragarh,"Likes : Location with great view.  Food is tasty.  Quality of bathroom in our cottage.  Dislike : As this is a government property, so most of personnel are doing only office duty. And they forget a basic nature of their service - they are in hospitality business. ",friendlyman7x,/Profile/friendlyman7x,"Kolkata, India",40
pithoragarh,"This TRH needs to be improved on cleanliness, food, quality of service.  I didn't find my experience good when I visited this place in last April. Rooms are not cleaned well, property is not maintained well, food defineately needs improvement.",jatinrajpal,/Profile/jatinrajpal,"New Delhi, India",20
pithoragarh,Book Cottage 5 or 6 which are with rich wooden interiors and moving the Panchachuli welcomes you. Beautiful sunrise. Good food and a very warm Manager Mr. Joshi. One of the best KMVNs. Great halting place en-route Munsiayari.,HotatSangha,/Profile/HotatSangha,"Noida, India",40
pithoragarh,We stayed in this resort on December 2015 and it was a treat to remember forever. The magnificent view of Himalayan range along with the surrounding made this a must stay at Chaukori. Witnessing sun rise from the watch tower is another interesting thing at this place. The rooms are quite big and they also offer cottage facility. Lastly the food was also great (specially the aloo parantha in the breakfast). On a whole the scenic beauty of this place made this an ideal place to take rest from the hustle bustle of day to day life.,Amrita2983,/Profile/Amrita2983,"Kolkata, India",50
