location,review,name,user_profile,userloc,rating
pithoragarh,"Since it was Holi, the festival of drunkeness, I'd like you to take that into account when I say that the services were subpar and the food, pathetic. The rooms are tidy and parking facilities ample. There arent too many budget options to stay at Chaukori though.",Sumantra R,/Profile/sumantraray,"New Delhi, India",20
pithoragarh,"Traveled with my Family to Chaukori in Nov 2012, After a amazing drive up to the rest house, I was a little disappointed with the entrance of the guest house, but as soon as we entered, we were at an amazing place... You can send the whole day sitting at your balcony, watching the different shades of the beautiful range of Himalayas, starting from Nandadevis, to Rajrambha to Panchachuli, which are visible without any problem.... Overall a property very well maintained, with great helpful staff,..  The quality of the rooms could have been a little better... but that is superseded by the view. Always choose the Deluxe or Superdeluxe rooms on the top floor in the new building,.. if you want to have a clear view the sunrise from the balcony..... The Food was great....",Aindril,/Profile/Aindril,"New Delhi, India",40
pithoragarh,"This is an awesome place to stay if love to spend time watching Himalayas. Just take a sit in the the neat and clean lawn of the hotel and the day will pass. From Chaukori you can see Trishul, Nandadevi, Nandadevi East, Nandakot, Nandaghunti and some other peaks also.  If you stay at cottage or Super Deluxe rooms, you will get the best view. Sun rise is awesome here.",jajabor1982,/Profile/jajabor1982,kolkata,40
pithoragarh,I stayed in KMVN Tourist Rest House. The location was extremely good and the view of Himalaya was breathtaking. Food was also good. Especially I like there Huts. Very Reasonable tariff and staff was also very co-operative.,BKS70,/Profile/BKS70,Noida,40
pithoragarh,"We have traveled far and traveled wide to see the sun rise in the Himalayas. Woke up at three in the morning. Scrambled to the Tiger Hills and elbow others to find a place for ourselves at the observatory. Trekked three kilometer uphill to reach the Chandrashilla top from Tunganath to see the first rays of the sun fall on Chaukhamba. It was so easy this time. Wake up and pull the curtains back to see the silvery shimmering peaks of the Nanda Kot in the light of the dawn right from your bed. Allow the Nature Gods to do the rest of the painting on the clear October sky.  When the scene has enthralled you and you can take no more just come out to your balcony.  You see the entire range from Trishul at the extreme left to Nanda Devi, Nanda Kot to Panch Chulhi at the right glittering",Dipanwita G,/Profile/DipanwitaG,Kolkata,30
pithoragarh,The highlight of this property is its brilliant location. You get amazing view of Nandadevi and Panchahulli from here. We spent a night here while coming back from Munsyari. The cottages are not a great pick if you are looking for comfort and luxury but the morning view of the Himalayas makes up for it. Only other ootion you have is a private hotel nearby which looked neat from outside but did not have as good a location as this one.  A cottage cost us 1500 rs/night with complementory breakfast.(peak season rate its lower if we would have been here a week before!). They gave a limited option for food but its tasty.,Kaushlendra,/Profile/Kaushlendra,"New Delhi, Delhi, India",40
pithoragarh,"They main attraction for the kids would be the lawn in the middle. The cottages surrounding the lawn are quite decent. Wood paneling in the inside, LCD television.  The bed-sheets were not very clean, but were changed promptly on request. Though we couldnt see the Himalayas because of fores fires, it is told that the views are better from the rooms in the higher floors, than the cottages.  The place has many private hotels and lodges on one side. Food was ok. Could be better with the price they charge.  http://blazingkumaon2012.blogspot.in/2012/05/onward-to-uttarakhand-and-sitlakhet.html",Jyotirgamayah,/Profile/Jyotirgamayah,Kolkata,40
pithoragarh,"I stayed at this hotel in June 2012. The entire experience of staying there was hugely disappointing. We stayed in their super deluxe rooms. At first, the rooms were on the first floor, which means you don't get a great view because the way the hotel is constructed, there is an obstruction in front of these rooms. The entire approach; stairs, corridors had a dusty and unkempt look. The rooms were dirty with dirty bed sheets. The bathrooms were okay but pretty low on cleanliness. To add to that, the other disappointment was the food. We were served an extremely poor preparation of dal, vegetables and chapattis for lunch and dinner. No extra effort had gone into the cooking. The breakfast too was just about okay. There is a limited variety and its best to eat early as we noticed",Seeker S,/Profile/world_80explorer,India,20
pithoragarh,"KMVN TRH chaukori offers a delectable view of the himalayas.An unobstructed 360 degree view is what you will get if you time your visit well.June mid should be a favourable time provided it is not rainy.the view is awesome and priceless in comparison to the tariffs for the hotel rooms!The hotel is quite ideally situated and offers a large number of tourist attractions nearby.The hotel features a tower to better view the majestic himalayas.Be sure to take your cameras and tripods along. The food is quite homely and while the selection is limited,the food is fresh and healthy. The last I visited,the hotel had a uber cute mountain dog;a children's favourite!",photogenictraveller,/Profile/photogenictraveller,"Lucknow, India",40
