location,review,name,user_profile,userloc,rating
pithoragarh,"The first time I visited this property was in January 2010. During those days, this was the only notable property over there. And mind you the stay was something I cherish even today. The staff, quality of food and the great Himalayan views just blew me over. And then I stayed here again in November 2017 and that was my moment of Sach Ka Samna. it's a perfect example of what a disinterested staff can do to ruin a hotel. Infact our miseries started even before we set foot in the hotel. During that trip the staff KMVN Munsiyari staff went to great lengths to make out stay comfortable, the staff here started throwing tantrums even before we started moving to Chaukori to Munsiyari. Since we wanted to have chicken for lunch we asked the manager at KMVN Chaukori (even before starting",Pankaj Toppo,/Profile/Toppopankaj,"Gurugram (Gurgaon), India",30
pithoragarh,"1. This is an excellent view point and the rooms are sold with complimentary breakfast. 2. All rooms have views of the Himalayas either through the window or if you open the door. 3. Best time to view the snow capped peaks is from Nov till the end of December when they are visible throughout the day. 4. Sunrise and sunset are good with changes in colouration of the peaks. They are indeed a visual delight. 5. There is no taxi stand in Chaukori and hence if you do not have your cab, it has to be arranged from Berinag and you must inform the manager beforehand. 6. Rooms are good with basis facilities and western toilets with 24 hours hot and cold water. Room heaters are supplied with additional charges and they are essrntial during the winters. 7. There is a deer park about 2 km",Sanjib G,/Profile/644sanjibg,,50
pithoragarh,KMVN rest houses r good specious and well maintained.breakfast is complimentary. For food we have to order in advance so according they prepare fresh. Quantity and quality of food is good.overall stay was good. Sunrise view is excellent and can view from premises.,Nita J,/Profile/432nitaj,"Ahmedabad, India",50
pithoragarh,The best maintained KMVN property along with Mukteshwar I must say. We stayed at Royal cottage for 2 days. Superb ambiance superb area superb view. Visited Nanda Devi and Panchachulli from here. Foods as usual superb. A five star property,sarnab250,/Profile/arnsengupt,,50
pithoragarh,"I visited Chaukori on 08.10.2019. It is a really a good place to stay and enjoy the beauty of the Himalayan Range by sitting at the Balcony or from the mountain view rooms. If possible, make your itinerary to stay here for two days and during the full moon days. Try to book your room at the top floor of the main building because from the room itself the Himalayan Range is visible. The food quality served in this TRH is also very good. Enjoy your stay and the mesmerizing Himalayan Range.",Chandan P,/Profile/ChandanP204,"West Bengal, India",50
pithoragarh,"If one wants to stay at Chaukori, KMVN TRH is the best place! The rooms are quite good, especially the cottages are wonderful. There is a watch tower inside the premise and the views during both sunrise as well as sunset are mesmerizing! They have the CP plan and the quality of the food is up to the mark.",Debabrata Datta,/Profile/ddtechin,,50
pithoragarh,Its the best place to stay comfortably in this location. Rooms are Wodden & spacious too. Quite big complex including little playground. You can have an un-obstructed panorama view of few prominent Himalayan peaks. there's a view tower to see the view also. Food is good also.,imvipink,/Profile/imvipink,"Hyderabad, India",40
pithoragarh,"The deluxe rooms are good in size, well decorated. Amazing view from the balcony. Washroom modern with all amenities. Service good, food also good. Nice place to stay in Chaukori. Well maintained property at excellent location.",Nilanjana Ray,/Profile/NilanjanaR18,,50
pithoragarh,"We reached the KMVN Rest House, Chaukori on 28th of May,2019. We stayed here for two days. The location was excellent but we didn't get any view of the mountains due to the clouds and smog all around. Rooms are nice but the service and food quality is average. I have to mention the road trip from Nainital to Chaukori here. There were forest fires in the hills all around. The air was smoky. It seemed that the fires were not natural forest fires but done intentionally. The scenic views of the hills were hazy all around. This was not something we expected and will surely discourage tourists. However, the stay at the rest house was comfortable.",jmajumdar,/Profile/jmajumdar,"Kolkata, India",40
pithoragarh,"It is said that morning shows the day. Today it is 7th of May,2018. Yesterday we enjoyed the shower with hailstorm here. But the morning today greeted us with clear sky, sunny weather. Our next destination is Chaukori in Pithoragarh District,UK,India. & would stay in KMVN TRH Holiday Home in Chaukori for the night as we had our booking there. The journey is 98 km  via Birthi Fall, Tejam & Thal.  We finished out complimentary breakfast in the Restaurant of  KMVN  TRH , Munsyari in the morning & started for Chaukori . On the way we had a halt at KMVN TRH  near Birthi Fall as our driver was sick. He took some rest & we again continued our journey .It was noon when reached there. As our reservation was already booked, we first ordered lunch, simple rice, dal & a veg with some salad",kcdebnath,/Profile/kcdebnath,"Kolkata, India",30
pithoragarh,"We checked in on a not so cold evening in mid March, but it rained right after we came in. Thus, the temperature dropped significantly and the room was quite cold. The room was not heated . The Nigam does not provide the room heater as part of the package. The room was just about basic, the water heater did function ! The dinner is prepared to your order, must be informed well in advance. We asked for simple dal-sabzi with rotis. The food was good. Given the number of guests dining together, the service was reasonably well paced and courteous. Without the room heater, we had to pile up a couple of blankets additional on us. The breakfast menu was simple , the poori-bhaji was delicious, but the service management was quite  disappointing.  The best part of this resort is the",YatriForever,/Profile/YatriForever,"Chennai, India",40
pithoragarh,You can drive to this place for a lazy weekend watching the mountain peaks..the location of trh is such that we saw so many mountain peaks from there including nanda devi.. nanda kot..panchachuli peak.. the kmvn guest house is the best location to stay in chaukori..,savinegi,/Profile/savinegi,"Dehradun, India",50
pithoragarh,It was the first week of March. Winter was not over fully. When we reached Chaukori in the evening it was very cold. We saw a himalayan jackal on the compound of the KMVN Tourist Rest House.The virgin beauty of Chaukori is unaffected by pollution and crowd. It is a peaceful place showering us with enchanting views of the mighty Himalayan peaks. There is a watch tower present inside the campus.,call_me_rajib,/Profile/call_me_rajib,"Kolkata, India",50
pithoragarh,"The location of this property is just amazing.  The garden is beautiful, full marks to them for maintaining is so well.  You could just spend hours sitting in their beautifully manicured garden enjoying the Himalayan views.    The biggest let down was their rooms and service.  The room where I was staying was unclean (comparatively my friends had a better room), the bathroom had cobwebs and despite requesting to clean it, no one turned up.   Please carry your towels and a bed sheet.  Food was also very average, nothing great.  Thankfully we were there for just a night so it didnt matter much.   I do hope they improve their cleanliness and service standards.",Binaifer B,/Profile/TravellerBinaifer,"Mumbai, India",30
pithoragarh,This is a very nice a accomodation with seperate cottages.These are quite spacy and well equipped.Views from kmvn are really nice especially sunrise from their watch tower should not be missed.Food is also good but prior order should be given for lunch and dinner....,Rajiv Sadhanala,/Profile/sadhanala,"Karimnagar, India",40
pithoragarh,"Visited this brilliant place in Kumaon for the second time in 4 years. Earlier it was April when I visited this place, this time it was in the middle of a chilling winter (temperatures almost sub zero). This time I stayed on the super deluxe cottages. Was allocated Super deluxe cottage number 5. The cottages are warm, as it has wooden interiors. You can also take room heater for a charge of 250 + GST. The food was homely and staffs were really courteous. From my earlier experience I can say the services and infrastructure in general has improved. For a warmer night book the cottage, and for a better view of the snowpeaks book the executive rooms on the second floor. Choice is yours. For the entire trip report search google with ramblersnaps+chaukori",kakaanirban,/Profile/kakaanirban,Kolkata,50
pithoragarh,"KMVN Tourist Rest House is an ideal place to stay & enjoy the majestic beauty of Himalayan range in different hues. AQI was 20. The rest is comfortable, staff is courteous & cook offers very good dishes. Mutton curry served by him was amazing. One can view the following peaks Panwalidawr 21860, Nanda Devi 25643, Nanda East 24389, Nanda Kot 22510, Lapsa Dhura 19400, Raj Rambha 21446, Nanglaphu 21029, Panchachuli 22651",vijaysrivastava,/Profile/vijaysrivastava,"New Delhi, India",50
pithoragarh,"The entire experience of Chaukori lies in staying at KMVN cottages. KMVN is an experience all by itself. Try to book the cottages. They are independent cottages with floor to ceiling in wood that will keep you warm. Each cottage has a front private sit out area. The floor to ceiling glass window in the room helps you enjoy the sunrise from the comfort of your bed. Bathrooms are well equipped with geyser, health faucet and toiletries. Heaters are provided on request and at an extra cost of Rs. 280. The property is very well maintained and very clean. One can spend the entire day in the campus. Breakfast is sumptuous and very tasty. Staffs are very well behaved and helpful.They even give you extra blankets if required. Would repeat Chaukori only for KMVN!!!",Travel Enthusiast,/Profile/abhipush,,50
pithoragarh,"The name of Chaukori was not much  familiar to me . Back in 1987, we visited a part of Kumaon hills like Nainitaal, Ranikhet and Kaushani as a newlywed couple.  Kumaon called us again in November '18. This time, we planned for different destinations. Chaukori was one of them.  We pre booked a KMVN cottage for two of us. We started from Binsar at about 10.30 am and reached here at afternoon. The cottages are so beautifully located. We could see the Himalayan peaks sitting on our bed through the huge glass window ....and sipping tea.           On reaching we had tea first(nicely served in our cottage room )and saw the clear view of sunset from the watch tower of KMVN. Also chatted with some fellow tourists. Had tasty dinner served in our cottage .Woke up early for an awesome ",Mousumee M,/Profile/mousumeem,"Kolkata, India",50
pithoragarh,"I recently stayed at this property with family and parents and it was an extremely pleasant experience. We stayed in 'Execuitve rooms' on 2nd floor (you have to climb stairs). Priced at 1400/- plus GST (12%), these rooms are a steal deal. They are quite spacious and have attached verandah with mesmerizing views of the entire Himalayan (Kumaon) range. There is a watch tower on the premises as well. The cottages are also good, but I think executive rooms offer best views. The bathroom is quite clean and tidy, clean towels are provided and the geyser supplies piping hot water - you can take a very refreshing shower even at late evening (I took at 8 pm, since we reached there a bit late). Breakfast is included in the rate and spread is quite good - bread butter toast / poori sabji /",Shankhajit Srimani,/Profile/shankhajits,"Kolkata, India",50
pithoragarh,We stayed here on dt 18/11/2018. only one place in this tour disappointing us that is chaukori. if u visit kaushani or mukteshwar  then no need to visit here. it  is a place of over hyped.kmvn lodge roof shed obstructing to see the view of peaks. Saffs are not as well as other places of kmvn lodges. looking shaky & tired. Food is below average. ,Abhijit Banerjee,/Profile/645abhijitb,"Durgapur, India",30
pithoragarh,From Kasauni it takes 4 hrs. by road as being hilly. Roads are in between good with all around pine forest passing through hills with smooth ride at speed 40 as beyond 40 driving is very risky as roads width are small and so.  Chaukori KMVN is good as have stayed at Cottage C3 and good for stay for 1 Night.  Remote area Chaukori is with nothing to do.  So people only stay here while passing through heading towards Munisyari from Kasauni.  Cottages are good and food is very simple with only limited option as basic food is only available where preparation time is more. So in advance lunch or dinner order has to be given.  Will suggest to Stay and spend time at Kasauni which is worth for staying.  Kasauni is worth visiting for atleast 2 Nights as beyond Kasauni neither Chaukori nor,21Abhishek,/Profile/21Abhishek,"Thane, India",40
pithoragarh,"After having a delicious Kumaoni Lunch at ""Purana Dhaba Zaika"" at Mankot which is 15 Km uphill from Bageshwar reached KMVN Tourist Rest House, Chaukori which is another 32 Km from Mankot.  The KMVN Tourist Rest House is ""Hands Down"" the most aptly located property in Chaukori, The Ojaswi Resort is adjacent to the TRH. A couple of other properties are also nearby.  The TRH provides breath-taking views of the Himalayas and in our trip, this was the closest I reach to the Himalayas. I skipped Munsiyari owing to long distance and quick meandering roads being deterrent to vomit-prone wife and son. When we look back now, I feel I have done a cardinal sin. Well that's another story.  After reaching the KMVN TRH Complex, I was pleasantly surprised by the amount of space in the complex.",MadMaxIndia,/Profile/MadMaxIndia,"Kolkata, India",40
pithoragarh,On the way to Birthi from Bageswar..KMVN CHAUKORI is here..with amazing views of Panchachuli and valley it's a real treat for your eyes and mind. I enjoyed it's serene and virgin beauty with my family and really all the staff are very courteous and helpful. Restaurants prepare real good and healthy foods. Sunrise is a bonus here ..in total kumaon region you can enjoy the best sunrise from Kaushani and Chakouri only.. Don't miss it,Debasish B,/Profile/122debasishb,"Kolkata, India",50
pithoragarh,"Booked in advance over phone and got a warm reception at the guest house by the staffs. Offered a room on the top floor facing the mountain valleys and snow peaks were also visible, amidst cloudy weather. The one night break after a long and tiresome solo drive in Kumaon Himalayas is must and this KMVN accommodation was the best in Chaukori town.  Huge parking space, tasty kumaon cuisine, a special elevation site for viewing the peaks at their own premises etc  makes this place a ultimate choice for all travelers. .",Senthil Raja Ayyannan,/Profile/senraayan,"Varanasi, India",40
pithoragarh,I have been here twice. Excellent location and outstanding cottages. Reasonable prices and great vegetarian food. Very inviting hosts and beautiful walks downhill from the resort. Ideal for a 2 nights stop-over before heading to Munsiyari or Milam.,Jaideep R,/Profile/jaideepr2018,"Guildford, United Kingdom",50
pithoragarh,"As for all KMVN Tourist Bunglows, this one is also situated in the perfect location, with the full view of the mighty Himalayas in the offering! Place is neat and tidy, and food is ok. There are individual cottages encircling a beautiful lawn, and some nice viewpoints within the rest house. All in all, wonderful experience.",Debarati Ganguly,/Profile/DebaratiGanguly,,40
pithoragarh,"A well maintained rest house which offers beautiful view of Himalayas.Location is superb , well maintained garden. Rooms are spacious and offers enchanting view of himalayas. Very nice place to stay in reasonable rate with all the basic amenities.",utdbtourism,/Profile/utdbtourism,"Dehradun, India",40
pithoragarh,"I m very comfort stay in the kmvn, here we are for two nights, and we have booked executive 4 super deluxe room. These rooms are very good. Nice clean, breakfast also included in 2100₹+ gst. Please don't book cottage. Book only these rooms, do you have want any suggestions than make message me on fb aoarakesh@yahoo.co.in Rakesh Sharma from Jaipur Rajasthan.",rakesh s,/Profile/rakeshs2448,,50
pithoragarh,Situation is Excellent with a vast open view of the mountains. Very nice open space with a pretty garden. The trampolin was a great attraction for my grandson. Rooms are spacious but a little of lack of proper maintenance is easily noticed. Food was good in general and service was Ok. Still the best place to stay at Chaukori.,uks2711,/Profile/uks2711,"Barddhaman, India",40
pithoragarh,"This is a very well-maintained and cost-effective option to stay in Chaukori. As such, there is nothing much to do in Chaukori, except to sit and relax. The view from the rooms is astounding. Overall, a very good place to stay.",Tamalika M,/Profile/TamalikaM2,,40
pithoragarh,Cost efficient resort.. with beautiful view. Its a govt resort but well maintained.   Beware of leeches if you travel in rainy season.. Another attraction close by is Musk deer.. its a little walk up to hill but worth it.,gunjita j,/Profile/gunjitaj2,,50
pithoragarh,"Possibly the best place to stay in Chaukori, except tea estates,  good weather and Himalayan  view (Panchachuli peaks) nothing else to do in Chaukori, mostly it is used as a transit house.....because it is the best TRH amongst  TRH in the vicinity like berinag, patal bhuvaneshwar, gangolihat.....major tourist attraction is Patal Bhuvaneshwar and also Hat Kalika temple which is at about 38 kilometers from the TRH. TRH has various categories of rooms, the best is Cottage, complete woodwork with devdar wood, it's an experience staying in the cottage and it's also not very costly, also it's on the quieter side of the hotel , Service here is good, staff is courteous and cooperative.......weather here was really cold requiring you to wear light woolen, it's on the roadside, the road",Satykam A,/Profile/satykama,,50
pithoragarh,We were on our way back from Panchachuli Peaks Base Camp in Dugtu to Delhi when we made a pitstop for one night in Chaukori. Someone suggested the KMVN's Tourist Rest House which is a government run TRH. When we reached there to my surprise the Rest House had Cottages as well as Rooms. The cottages are neatly done and the property Provides you with a complete aerial view of the Valley. The staff is courteous and despite being Government run they are managing a good show.   PS - IF you are planning to visit then do get a booking of the cottages only. The individual rooms wont do the justice.,mayank_trikha,/Profile/mayank_trikha,"New Delhi, India",40
pithoragarh,"Chaukori was known for spectacular views of the Nandadevi and other mountains, but if you travel during summer months you can't get to see anything. We came back to KMVN Chaukori after 10 years and we were disappointed.   The cottages have been refurbished and are comfortable to stay. But the food service is below expectations - they are slow and offer only about 10% of what is mentioned in their elaborate menu card. They keep claiming nothing is available - even they would not offer you bread toast in the morning! Morning buffet service gets crowded because they have only five tables to seat their guests. The only thing they do well is, serve bed tea at each room by 6AM!  Though they have a gen-set, they don't normally run it during the days and be prepared to go without power",ArindamDas,/Profile/ArindamDas,"Chennai, India",20
pithoragarh,I had booked two SDBD rooms at Chowkuri from Kolkata office. The cottages were unavailable. What a nauseating experience. The place is exquisite but the rooms extremely substandard. You will enjoy the place as long as you are out of the rooms.The floors are cracked.Toilets unclean. Unimaginative furniture placings. Shuddering experience for the tourists who are prepared to pay against minimum decent stay. The rooms with GST seem to be expensive and I recommend the nature lovers to only book in the cottages if you are with the family. The only saving grace is one Mr.Deepak who was extremely courteous and understands the tourists requirements. The nature is bountiful for the Himalaya lovers at Chowkuri. When will the Government Tourist Department induce some modern day thinking,Nirmalyo B,/Profile/NirmalyoB,,10
pithoragarh,"Hi, I am Sujan Azad Parikh and I visited Chaukori on October 2017 and I was thoroughly satisfied with my stay at this beautiful location. The cottages are lined side by side and made of wood which makes its distinctly unique. The large windows offer stunning views of the mountains outside and you can just lie down in your bed and enjoy the scenery. Since, it was October, we got a great view of the Himalayas. The cottages have all the basic amenities and absolutely neat and clean. Room service is great and we loved the food as well. Overall a very good experience.",SujanAzadParikh,/Profile/SujanAzadParikh,"Hyderabad, India",40
pithoragarh,"We arrived yesterday from Kausani, a 3.5 hr journey, passing Baijnath temple & Bageshwar. The cottages are quanlint, tastefully done up in wood and cozy. They have a large French window which offers nice views. Unfortunately, with the cloudy skies, we didn't get a clear shot at the famed peaks. However, points to note - we hardly had electricity through the day, and gen set is only run after 7pm. The intercom gets switched off if the weather turns stormy, and hence ensure you take the mobile number if the attendant/receptionist..else it's quite a walk from the cottage. Food is very good, and surprisingly, u had full connectivity on my mobile with 3g data. Like kmvn Kausani, where we arrived from, this place also doesn't accept card payments, only cash. With ATM's far & between",Saurav2075,/Profile/Saurav2075,"Pune, India",40
pithoragarh,The location is ideal with a full view of the Himalayas.. But a huge unfinished hotel at the front is stopping a full view from the cottages. The watchtower offers a splendid view of the Himalayas. Overall will be surely rcommended,Sourav B,/Profile/souravb396,"Kolkata, India",40
pithoragarh,"For a govt property, this place scores high on many points. Location-superb. Quiet and relaxing. Fabulous views of mountains from the balcony itself. Rooms are reasonably large with basic facilities Cleanliness and maintenance-good Geyser provided-so, no problem for hot water. Electricity and wi-fi connections ok. Heaters are priced separately - but they provide fairly large Havels ones which are efficient Breakfast-limited in choice but they serve hot pooris and parothas-tasty and more than enough Service attitude-excellent. Mr.Deepak, the manager needs special mention. He manages efficiently and attends to our comfort. The executive super-deluxe rooms in higher floor are the better ones and are preferable to the lower floor deluxe rooms/ cottages for a better view. There is an",Ramani-Coimbatore,/Profile/Ramani-Coimbatore,"Coimbatore, India",50
pithoragarh,"Chaukori is a small hamlet situated in the Pithoragarh district of Uttrakhand state. Tibet lies to the north of Chaukori and to the south is Terai. Chaukori is perched at an astounding elevation of 2,010mts above sea level affording splendid and invigorating views of nature's beauteousness.Chaukori is famous for its tea gardens established by the British. Chaukori is considered as heaven in Kumaon by the travelers. The virgin beauty of Chaukori is unaffected by pollution and crowd. Chaukori is a peaceful hamlet showering us with enchanting views of the heavenly Himalayas. The benign peaks of Nanda Devi, Chaukhanba, Trishul, Nanda Kot and the Panchachuli are distinctly visible from Chaukori.Chaukori is one of the hidden jewels and unexplored destination of Kumaon and you are free",Aayansh Anupam,/Profile/aayanshanupam,"Kolkata, India",50
pithoragarh,"This is the best location in Chakauri, 180 degree view of Kumaun himalayan range, accessible through out year. You can expect everything at this rest house except service and hospitality, typical KMVN guest house. Food quality and taste is average. Already the food menu has limited options, then the restaurant staff deny to cook half of the dishes, be it as simple as rajma or fried rice etc. Sounds funny but it's a reality. Despite of all this disappointment, you can relax in lap of nature. A quite place with magnificent view.",vchikara,/Profile/vchikara,"New Delhi, India",40
pithoragarh,"Location Magnificient, Maintenance Very Good, Hospitality Terrible, Food Average,  Service Very Very Poor, Manager  Always busy with mobiles, cannot hear Lodger's   demands/problems. But Himalayas is so majestic from TRH that problems can easily be ignored.",sganguly360,/Profile/sganguly360,"Kolkata, India",30
