location,review,name,user_profile,userloc,rating
kangra,"Stayed here 5 nights and room was clean, and bed was very comfy (King size) with great views of the mountain from my bed & room balcony. Staff were very friendly and helpful. Food was nice and cheap, the staff always happy to help and Jagdish in particular  (worked in restaurant) was also most welcoming and always cheerful. The hotel manager was also very kind, and always willing to accommodate any requests. Hotel is situated quite close to Bhagsunag waterfall (approx 1.5-2km away) and was an easy walk there (probably 30-35 mins walk from hotel).  On the downside, my room had no heating (got down pretty chilly at night) and although I had a nice warm duvet blanket, I had to request another blanket, and they quickly provided me with a huge warm blanket. Power cuts were",Booka71,/Profile/Booka71,"Marrakech, Morocco",30
kangra,Holiday hill is a very nice property. The hotel is at a very nice location.  The view from hotel rooms is very nice. Rooms are very spacious and clean.  They serve tasty food. Hotel also offers private balcony. Hotel is close to mall road. Very peaceful area. Hotel also has private parking space. Only one drawback is the road to the hotel is little bit steep. Rest everything is fine. Below points gives it plus points. 1) Food 2) Clean Rooms 3) Clean Washrooms 4) Nice Location,Hitesh Kumar,/Profile/Hkumar92,"Chandigarh, India",40
kangra,"   After booking thru goibibo post my extensive search on TripAdvisor , I reached my hotel in main jogiwara road @walkinf distance to the city main square n in close proximity to the lovely *cafe budan*.. They graciously allowed me to check in an hour prior n also *Mr hemraj"" at the counter was courteous enough with my room selections n provided me a great room ..  My room didn't have a water kettle n on my single request , they provided me with the same ..   Room is good enough for 2 persons .  Well lighted , with 2 huge windows opening in the adjoining alley and the valley respectively .. With an attached balcony (mine was supposedly **side-view** room) , but still view was amazing n soothing ..  I could sit for hours in d chairs provided in d balcony n relax without any",Manik Agarwal,/Profile/manikagarwal2,"New Delhi, India",50
kangra,"Overall a nice stay and satisfactory experience. Almost 800m from main square. Food was good. Views were nice. Lift could have been better. However, approach road to hotel is very steep. It requires skilled driver to be there.",deepak2506,/Profile/deepak2506,"Gurugram (Gurgaon), India",40
kangra,"I brought a group of 18 people to stay here. The hotel was beautiful, updated, and very comfortable. The hosts Showkat and staff were helpful, kind, and generous. The food in the restaurant was decent, though I mostly ate while we were out on excursions. The hotel was walkable to all the main attractions in Mcleodganj, and I felt safe (well, maybe a little nervous about getting hit by cars but less so than in other parts of India). No one in my group had any issues. I would definitely return here with my next group.",phoenixacudoc,/Profile/phoenixacudoc,phoenix,50
kangra,We stayed as long as for a week.. And believe me it's an awesome one.  Mr Showkat(The Pro-active Man) Made all arrangements before we say anything.. Hotel staff was so polite and humble.  They all doubled our happiness  during stay n trip.. If you want JANNAT in mcleodganj check in to Hotel Holiday Hill.. It's rocking especially for family n couples... I personally provide 5 star rating or  99/100 Thnku all,Ashwani Ji,/Profile/ashwaniji,,50
kangra,We are family of 4 people truly impressed by amazing people of Dharmsala. We stayed at the hotel Holiday Hills on May 2019 and needless to say it was an authentic experience! They treated us as a family members. We recommend you to stay there! Staff was very friendly and helpful! Thanks a lot!,Erzhena C,/Profile/erzhenac2019,,40
kangra,"The proximity of the hotel is the big advantage it carries. The approach is very steep and narrow with one-ways in between but you once reach the room, you feel at ease. The view from the balcony is spectacular. With snow clad mountains and serenity all around, the service is too good too. They have pretty good food options and kitchen staff are very friendly. We had a driver with us and they took care of the driver by providing food and blanket. The hotel is very close to Dalai Lama temple and market place. Its a steep yet a good walk from hotel.",Ravinder,/Profile/esravinder,"Bengaluru, India",50
kangra,"I stayed at the hotel for 2 days with my family and really my experience was unforgettable. I have not thought about so comfortable stay. Mr sowkat is a very nice person. He, hemraj and all other staff were so good and cooperative that they made my holiday good. The location of hotel is also very nice. Not far from market and also away from market crowd. NICE LOCATION, HUMBLE STAFF, GOOD FOOD.",pawan,/Profile/pkbaid,,50
kangra,"Clean rooms and cleanest washrooms I have ever seen in a hotel, very helpful staff, hotel is very near to Illiterati (the best cafe in mclo), local market (including mclo restuarant again an amazing one to visit). Overall this hotel is a value for money and is suitable for families, couples or group of friends. Restuarant balcony has an himalyan view as well.",Divye Handa,/Profile/divye_1992,,50
kangra,"A hotel of comfort, excellent service, gorgeous views and great location.  Everything from the cleanliness, smiles from the staff, taxi arrangements and breakfast was exceptional. We appreciated an upgrade to a room with the mountain view.   We especially like the location, away from the busy markets but still within walking distance. Nothing can be heard from the room, only birds.  The nearby Lung Ta Japanese restaurant served delicious food at a reasonable price.  We also recommend a visit to the Kangra Fort, Masroor Rock-cut temple and Norbulingka Institute.   This is the place to stay if you are in McLeod Ganj. You will be well looked after.",lnphan,/Profile/lnphan,"Montreal, Canada",50
kangra,Stayed here for two nights in deluxe room with a balcony nice room with great views. The rooms could do with some TLC especially the bathroom.  Had a good deal as it was out of season but would not pay the price they ask for in season better deals available. Bit down hill from main bazaar good 10 minute walk. Did not eat here but had tea which was nice. The staff were friendly as was the owner,moziz52,/Profile/moziz52,U.K,40
kangra,"We stayed here for three nights with family and had a comfortable stay. The hotel is situated on the downhill of Jogiwara road, that has all major cafes and restaurants. We booked superior room that had a beautiful view of the mountains. They have a good cafe, provide heaters and a welcome kaava drink. Washrooms are very clean.  However, there was no hot water in the bathroom. Rating: 3.5/5",flashymeadows,/Profile/flashymeadows,"Mumbai, India",30
kangra,"Thanks to Showkat Bhat and his staff for a lovely stay at Hotel Holiday Hill. They made our stay comfortable and easy, helping with transport when needed and providing heaters for the cold. The views from the rooms are outstanding. A pleasant 5 minute ish walk to hit the centre of Mcleodganj, uphill but worth it to enjoy all of the Tibetan food. Would stay again and recommend. ",feedmewithviews,/Profile/feedmewithviews,,50
kangra,"I walked in to this hotel because of its beautiful location facing the Himalayas! My other hotel was not good.  The owner gave me a great price and the room is one of the best I’ve seen in India in this budget! It is clean, well located and has a friendly staff.  This is where you want to stay in beautiful Mcleodganj! Highly recommend 👍",Duncan H,/Profile/duncanh483,,50
kangra,"Best hotel to stay if you want to be closer to the hub (around 7 mins walk from main square) but have the luxury of the great mountain views. Me and my husband stayed in the super deluxe room which had an amazing view of the mountains from its balcony. The room was pretty clean and neat. Room service was excellent, also the food. There is parking space if you are getting your car along with you. Loved our stay.",trishna,/Profile/trishna87,"Gurugram (Gurgaon), India",50
kangra,"Everything was excellent at the Hotel Holiday Hill. The views were astounding, the food was excellent, the staff was attentive and kind. The management was also very responsive via email, arranged a taxi for me from the airport at a very reasonable rate. I was impressive overall with everything about this place. It was a luxury hotel but in a midrange pricepoint. I know others have said it was a little too far down the hill but it's only a 10 minute walk, and to be frank, I liked getting away from the center of it all at night. It was silent and peaceful. I will definitely stay there again.",sujathajourneys,/Profile/sujathajourneys,,50
kangra,"Dear tourists, I’ve spent 4 wonderful days at Holiday Hill. The hotel creates special atmosphere for those who comes to Tibet to understand himself,to synchronize with nature and to restart his own life from now and forever. My room had extremely sincere view of the mountains and the forests. I might meet first rays of the sun,enjoy the view at noon and say goodbye to every last sunset. The hotel has great local cousine,warm colors of interior and clean bed. It was all I dreamed of, after walking a long time among small and charming streets of the village with thousands years history. To be honest I would close my feedback by nedt few words “Holiday Hill. Tibet. Dalai Lama. Infinity”",Nurlan,/Profile/nurlan2019,,50
kangra,"This is the best place for like family and for couple. Best stuff and kitchen. I been there 5 times five years continuum, and every time all was the best. Just go to Holiday Hill and looking your self.",Ali,/Profile/ali_bukin,,50
kangra,I've stayed at this hotel twice and it is the best value for money hotel in Mcleod Ganj. The rooms are very clean and tidy. The beds are very comfortable and use good quality linen  The bathrooms are also very clean and have good size geysers so you can enjoy a nice long hot shower. Staff are friendly and approachable and will help you out with anything you need. The hotel is about a five minute walk from the main hussle and bussle of Mcleod so it's perfectly located to provide peace and quiet with great mountain views and close enough to all the cafes and restaurants and shopping. I'll definitely be using this hotel every time I visit Mcleod Ganj.,Matthew M,/Profile/C3017ERmatthewm,,50
kangra,The hotel has good rooms with very good view. The staff are courteous and helpful. They do everything possible to make your stay a very pleasant one. The food served for in room dining is very hot even in winters.  They will be very soon most sought after if they continue the current service.,weyeskay w,/Profile/weyeskay,,40
kangra,"We arrived here 8 days ago thinking we would stay in the region for a couple of days. Now, we are not quite sure when we will leave. This hotel is fantastic: the rooms, the view, the staff and the food. Look no further, you will love it too!",Colleen,/Profile/SherpaColleen,"Montreal, Canada",50
kangra,"Location: At first I thought the road was too narrow to reach, but then I realised the complete McLoadganj has the same type of narrow roads. McLoadganj is on a higher altitude as compared to Dharamshala and hence worth staying.  Ambience/Room: Super awesome ambience of the room stole our hearts. We booked super deluxe room, and it was worth the price. Perfectly crafted washrooms as well.  View from room: Hotel claims to have a valley view for super deluxe rooms, and believe me, it is definitely worth the extra penny. The view is of an actual valley and is just mesmerising.  Hospitality: The owner is down to earth, and ensures help in every possible manner. This hotel has a wonderful staff to take care of guests. Service is very prompt, and I mean it.  Restaurant: Food was",amitbhaik,/Profile/amitbhaik,"Amritsar, India",50
kangra,"Your visit to a place depends a lot on the hotel/place you put up at. And by far, this is one of the best hotels I've been to. The prices are reasonable, and the staff is courteous. But the USP of this hotel is the breathtaking view that it offers. The location, a tad bit difficult to access, is superb. Situated right at the mouth of the valley, the view is absolutely stunning. And the rooms are hygienic, clean and well-maintained. They even upgraded our rooms without no extra charge. Overall, an amazing experience coupled with a comfortable stay.",Abhishek Mishra,/Profile/abmi9119,"New Delhi, India",50
kangra,"I am glad most people seem to have enjoyed their stay here, but I had a very different experience. This was both the most expensive and worst place I have stayed in India so far. I emailed in advance to make sure that they would accept my credit card and they said they did, but when I tried to pay, they would not take it--I had used the card the day before and know it worked, so they essentially lied about it and were quite rude. The cafe is a nice space, but the food is really, really bad. The room was clean, but had this gross public restroom smell that never went away. The WiFi was also pretty spotty, which was frustrating since I was planning to get some work done during my stay. There are tons of hotels in McLeod Ganj....so why on earth would you stay at this one?",Sightseer49521164101,/Profile/Sightseer49521164101,,20
kangra,Stayed twice in Oct 2018. Rooms are good with wonderful view. Staff is very helpful and ensures your stay is well taken care of. Rooftop restaurant offers fresh yummy food and has open terrace. Definitely recommended!,Vivek,/Profile/Vivek_kumar05,"Pune, India",50
kangra,"We stayed for 7 days in the hotel and we really enjoyed it. It is quite and clean, and we had a lovely room with a beautiful view. We loved the food in the restaurant. The staff was friendly. We had nice warm water in the bathroom. ",fg108,/Profile/fg108,"Roermond, The Netherlands",50
kangra,Great thx to the amazing kind and most good vibe staff in holiday hill . Most clean and well equipped rooms . Stunning Mountain View from balcony . Thx to the great Showkat the owner and dear Manzoor😘,Eliyahu-Moshe,/Profile/Eliyahu-Moshe,"Pulga, India",50
kangra,"It was unplanned visit to dharmshala and we landed in this hotel, from check in to room service to food at their restaurant and hospitality was quite good. View from their restaurant and room both are good. Many cricketers stay here when there 8s any match held at world's highest cricket stadium which is near by. Pre booking during peak season is recommended. ",gattawar,/Profile/gattawar,"Mumbai, India",40
kangra,"We had group of 10 people and they take care of us very well I will recommend them if you planning to visit mecloadganj they have great restaurant on terrace with nice mountain view,food is great and tasty,!!!! Thanks again for everything!!!",Raman S,/Profile/ramanraja16,"Rishikesh, India",50
kangra,"I had a short one day visit at this place. The first room we got had some smell in bathroom due to some malfunction, which was promptly changed by the staff (Nasir) and they gave us an upgraded room. Nice and clean rooms with good view, pretty value for money. Best part is the courteous staff and hospitality extended. the food in restaurant was very good, and when we were eating, the staff, Ramesh, engaged and entertained my 4 year and 2 year old kids very well with games. Very family friendly staff, owner, nice location, pretty close to market (5-10 mins walk, though bit steep).",Nimit C,/Profile/nimitc2014,,50
kangra,"Great place...amazing views from room overlooking valley-hills, awesome rooms with all facilities, good service, restaurant is also too good with scenic rooftop-kind, staff is very kind & helpful & gives good advice",Trek816787,/Profile/Trek816787,,50
kangra,"My stay was amazing at hotel. Let's start with room, please pay a little premium and take the mountain view rooms with a view. The view is absolutely stunning. The facilities in the room are good. Bathrooms are clean and hot water facility is available throughout the day.  Food- Very good. Great breakfast lunch and dinner options.  View - the view from their rooftop cafe is simply outstanding.  Connectivity - it's walkable from the main market and bus station but I took car both ways from the bus station and walked when without luggage. Do take a car if someone has issues walking.  Staff - what makes this place the best is the staff,extremely sweet and welcoming.  Owner Shaukat is very helpful, Ramesh and  nashir took care of all our needs and were very efficient at their work.",kamalwadhwaniya,/Profile/kamalwadhwaniya,"Mumbai, India",50
kangra,"Saw the trip advisor reviews and went to this hotel. By looking I thought why would this be top rated. But after having stayed there for 3 days, I can say that this actually deserves to be top rated  Location- 10/10 Food - 9/10 View from rooms- 12/10 Service and staff- 10/10  ",Ankit G,/Profile/ankitg215,,50
kangra,"What a great hotel! Clean room, which I’m very picky about, delicious food with a fun and helpful staff. They had all the little extras, like an iron, and an umbrella and room service that is quick and efficient. Loved it and will be back!",ImaWandering1,/Profile/ImaWandering1,"Ventura County Coast, California",50
kangra,"Love good food, nice rooms and great staff? Stay at Holiday Hill! We get transport all the time for work and they are reliable and reasonable.  We even got caught in the heavy rain at a restaurant, called them, and in 5 minutes they had a Taxi in front of the restaurant for us! Very nice people run it and are always helpful.  Stay here you will be glad you did. ",WVGaller,/Profile/WVGaller,"Ventura, California",50
kangra,"We spent a week here and loved each day of our stay here. Its a beautiful place,cozy place with a perfect view of charming cedar trees, overlooking a hill and a faraway lil mountain village. The location of the place is perfect. Just the right amount of walk from the main (bit noisy) market and the dalai lama mandir. The location is 10 mim walking distance from center of mcleodganj. The staff is super supportive, helpful and well trained. They go out to help you and to make your stay as comfortable as possible.",Meha S,/Profile/MehaS21,,50
kangra,"This place was a delightful surprise. We were not happy with our home stay so needed to change accommodation immediately. When we came across Holiday Hill the positive vibes given out by this place hooked us for good. Needless to say we were not disappointed. They gave us a good deal keeping our budget in mind. The staff went out of its way to help us in any way possible. Room given to us was spacious, clean and offered fantastic view. We loved the food as well (Aloo Jeera was just yum) except for the banana custard (But in their defense i must add that it was way past the ordering time). They also hooked us up with reasonably priced trek guide n taxis when needed which made us extremely satisfied. We had a fantastic stay in Mcleodganj and our stay at this place was one of the",payaldeogam,/Profile/payaldeogam,"New Delhi, India",50
kangra,Hotel location was very good. View from the rooms were top class. Staff was very decent and helpful. They were friendly and supportive. Hotel was clean and provided facilities were great ! Thanks for the wonderful stay. Will surely book this on our next visit..,shirin k,/Profile/50shirink,,40
kangra,"I spent 5 days in this very good hotel. Amazing views from the rooms and from the restaurant in the roof top. The location is good, the room and bed were big. The hotel is very clean. The staff is very friendly and helpful. They will do their best to let you have a wonderful stay in McLeod Ganj. I will definitely recommend Holiday Hill Hotel to all travellers !",Bruno B,/Profile/BrunoB59,"Paris, France",50
kangra,"Big, clean and comfortable room with a balcony and awesome Mountain View. WiFi was working properly all the time. Hot shower available. Laundry service available. Room service available. Tasty food. Staff was well trained and very friendly and helpful. Bed is very comfortable. I can highly recommend this hotel. Nothing bad.",480petrap,/Profile/480petrap,Austria,50
kangra,Stay at hotel holiday hill. Family environment lovely view excellent staff. I really say it is the best hotel of mcloadganj.if anybody planning to holiday in mcloadganj please go to holidays hill.holiday hill staff is not only good in nature but they are very well behaved.mr.showket is the best part of this staff. Who maintain all the staff and always keep smile on the face.,Jitender M,/Profile/459jitenderm,,50
kangra,"Headed to Mcleodganj at about 4am. Check into Holiday Hill with my 3.5year old boy. So as a semi solo traveler. I must say the room was fantastic, the view was great and my little boy was happy! Lot of places to get a good massage, awesome food and lots to shop within the vicinity of this hotel. ",Farah A,/Profile/714faraha,,50
kangra,"The hotel is very clean, quiet et rooms are big. Yet its location is not really convenient as you have to climb a big and long slope to reach the main street and market. But most of all, I was very unhappy with the manager as I had forgotten a small blutooth loudspeaker mid-December. Despite several phone calls from my Indian friend and emails from me, to have the item sent to Delhi ((where I was from 10 to 16 January - a month later) by bus at my own expenses, the manager has not been helpful. He never replied to our requests, and at the end gave me the excuse that they were closed for some reason which would have not stopped him from taking 10 minutes of his time to actually help me. I find this behaviour disrespectful and it triggers a lack of trust, and I would not recommend",Nathlagirafe,/Profile/nathaliehN1131LG,"Wavre, Belgium",20
kangra,I really appreciate staffs of Hotel Holiday Hill for their prompt service and clean room. There is a great view from the balcony of room. Food quality is good. It was a nice experience for us to stay in this hotel.,soumen128,/Profile/soumen128,"New Delhi, India",50
kangra,"We'd stayed in the Superior rooms on the top floor (1st floor from ground level. Other floors are below the reception) and the rooms were pretty good. They were well furnished and spacious. Kettle, tea bags and sugar were provided on request. The restaurant on the terrace is decently priced and has a good view. The hotel is 15 minutes walk from the central market of McLeod Ganj and around 15-20 minutes walk from the Dalai Lama complex too. There are lot of cafés and small restaurants close by. The staff at the hotel is very courteous and helpful. There are geysers in the bathroom and heater is available at extra charge. The hotel also has little parking area : a rarity in that area. Would definitely recommend staying here. You get more than what you pay for ! :-)",Harmik,/Profile/harmik_travelogue,"Bangalore District, India",50
kangra,"We stayed at Holiday Hill with five persons for 4 nights. The hotelrooms were very comfortable, clean and have a beautiful view. Besides that the hotel is located at a quiet spot and it is only a 10 minutes' walk to the 'main square' in Mcleodganj and approximately a 20 minutes' walk to the Dalai Lama Temple. Also the staff is very kind and helpful. Thank you for a pleasant stay!",Maxine G,/Profile/567maxineg,"Rotterdam, The Netherlands",50
kangra,"Four family members stayed for three weeks and would recommend to others. Our rooms were very clean, comfortable and quiet. Nothing was too much trouble for the staff: always a friendly hello in the morning and a greeting in the afternoon or evening. All our rooms had wonderful views of the Dauladhar Range through windows or from the balcony. Hotel is very close to shops, cafes and main square is easy to find on foot. Will stay there again on next visit.",Maxine J,/Profile/165maxinej,,50
kangra,"Close to everything around Mcleodgajn, Café, Restaurants, Attractions, Hiking etc. The staff at Holiday Hill assist you with everything form buying sim card to organize hiking for you. I was on a business trip, stayed for a month and felt like staying at home.",stellankarlss0n,/Profile/stellankarlss0n,"Falkenberg, Sweden",50
kangra,After staying in a different hotel for 2 nights we landed here. So one thing I can say about this hotel is that it is very neat and clean. You have quieter rooms with an amazing view of the Dauladhar ranges. Nice and helpful staff. They told us they have free RO water instead of just charging us for bottles - I really liked that gesture.  Decent location - near to the market and the monasteries.  Best part was the morning tea in the balcony,prasnavelcheru,/Profile/prasnavelcheru,"Bengaluru, India",50
kangra,Location is good near the bazaar. We had a family of 6 with 2 infants. Rooms were nice and clean. Service was also prompt. The hotel also arranges for trips on request. Negative point... Not recommended for senior citizens with leg problems as there is no lift.,anujay a,/Profile/anujaya,,50
