location,review,name,user_profile,userloc,rating
kangra,"I have visited with my family just 3 days ago. It was really an unforgettable experience.This hotel is having very nice location, neat and clean rooms eqipped with all comfort and mountains view, very good owener,helping staff (specially Manager Mr. Hemraj he is so good),nice food,free wifi,walking distance from main Mecleodganj market, Around 3 km away from Bhagsu Naag waterfall.It was really very nice experience during stay here.In future we would like to come again here.Also I recommend every one who love nature and peaceful place they must visit here with family and enjoy their best economical tour.👍👍😊😊 ",Vishal C,/Profile/65vishalc,,50
kangra,"Everything was nice. Rooms clean, view was amazing. They checked us in early, at around 9 even though the check in time was late. Everything was neat, room was better than what it looks in the photos. Also, really nice, friendly staff. You'll enjoy staying here. The hotel is pretty close from the main square, but only thing is taxis charge extra to reach just outside the hotel because it's on a one way. But with it being so close to the square, it wasn't an issue.",Vangmay J,/Profile/VangmayJ,,50
kangra,I went on a family trip to Himachal in June 17 and booked this hotel after reading reviews on makemytrip. I felt that this could be a good choice as per the reviews and cost. But when i reached and stayed in this hotel the experience was totally bad. Key Points: 1. Location wise the the hotel is fine though not a great location but somehow its near the main road. 2. Hygiene: Room and hotel was not at all clean and mosquitos came in night.  3. Amenities: there is no power back up in hotel so if u need warm water for bath and power is not there then you are stranded. 4. Food: Though not pricey but quality of Breakfast. and dinner was not good at all. No variety in breakfast buffet. 5. Look and Feel: This hotel looks dingy for families to go there. Hardly any positive that i can,prashant s,/Profile/prashants2182,"Pune, India",10
kangra,"We booked 3 Super Deluxe Rooms (Mountain View) in this hotel for our stay from 7th to 9th September. The view from the room is beautiful – you can view Dhauladhar range. You can also experience both sunrise and moonrise from your balcony. The main market is just 10 mins away though the climb is steep. Still, you have various shops and massage centres nearby. The staff and service was excellent, everything we asked for like water or shampoo was there in our room within 5 minutes. The food was also very tasty. We tried aloo, gobhi, onion and mix parathas and all were good. We also tried yellow dal, kadhai paneer and dal makhni in dinner and these were also very good. The main thing was that they prepared these fresh after our order (maybe because of off season and there were only",gshaks,/Profile/gshaks,"National Capital Territory of Delhi, India",50
kangra,We stayed in this hotel for 5 nights from 15th july to 20 th july.... it was really a memorable time we spent at this hotel.... it offers great views from private balcony and two really big windows.... thanks to Hemraj for arranging all that what we need and Nazir for all his services.... they are also constructing roof top restaurant which will be ready by this year end..... must stay hotel!!!!,sunilpatel999,/Profile/sunilpatel999,"Dubai, United Arab Emirates",50
kangra,"Good hotel with good service, cozy and spacious rooms with great views from almost all rooms, you can also have food over there, they do serve good food as well. Might be little difficult to locate, but anyone can guide you over there",Csmdebasis,/Profile/Csmdebasis,"Hyderabad, India",40
kangra,"Before you choose this hotel, I suggest you go through my below experience 1) Hotel Staff was very rude......how can someone knock at 10:00 P.M. at someone room to warn them to checkout if you cant stay calm. People come to Hill stations to enjoy and relax.. they should be treated as they have come to college hostel. We pay in thousands to come and relax.......value our money 2) Rs. 300 bucks for one towel??? really??..towels are meant to be dirty.... WHICH CAN BE WASHED later...there is not point charging from customer...if it gets dirty.",rosyabhi1987,/Profile/rosyabhi1987,"Gurugram (Gurgaon), India",10
kangra,Great hotel with wonderful view. Helpful staff. Sometimes a bit noisy because of guests. The rooms have huge windows which let the sun come in with a view on the mountains and small villages. Food is good and cheap with room service. Recommended,mireille b,/Profile/382mireilleb,"Haifa, Israel",50
kangra,"Rooms are neat and clean. Staff is also good. Hotel has parking, which is a luxury in Mcloedganj. Shaukat Bhai (owner) is very friendly and with amazing driving skills. Food is also good, though chinese not advisable. There are very good cafes and tibetan restaurants near the main square. Its advisable to use taxi (alto) for local sightseeing and not drive your own vehicle. The hotel is good at arranging taxi. It costs only Rs. 100 for 4 ppl in an alto taxi from hotel to main square mkt, if you are not used to steep hill climb by foot.",Tripper69LJ,/Profile/Tripper69LJ,"Noida, India",50
kangra,This is one of the worst hotel.. Your staff is pathetic please change.. Not at all cooperative..  dirty and smelly towels..  And Icing on the cake was the chilly chicken..(not very sure if even it was chicken or not) got ill after having that food. And if you check out 1-2 hrs late they will charge you full day charges.. DO NOT STAY HERE.. Else you will spoil you mood.. ,Shivangi S,/Profile/561shivangis,,10
kangra,"I have stayed there for 2 nights it was our first time staying with them, hotels is located on nice location good view, many restaurants & shops are near by you can also walk to the Tibetan temple and main market, in room dining food was really amazing as well which gives us homely taste, I would like to mentioned specially Hemraj & Shaukat always smiling welcoming they take care of your every need I will definitely visit this hotel again!",Explorer,/Profile/hotelier7526,"Dubai, United Arab Emirates",50
kangra,"we stayed in the hotel for 4 days and it was a nice experience. and most importantly their room service, food quality and costumer service  are really good and pocket friendly comparison to other hotels. it has the nice view of the Dhauladhar range as it is at very good location. Every thing near from the hotel. I really enjoyed the stay there..",utkarshbhatia090999,/Profile/utkarshbhatia090999,"New Delhi, India",50
kangra,"Small hotel with a fantastic view over the valley. The rooms are comfortable, the bathrooms are very basic (limited hot water supply) and there are some things that are simply done 'differently' because that is the local way and people just need to accept you're not going to get western service in a relatively remote location in northern India. The hotel is also marketed under the name OYO Rooms Jogiwara Road.",J002468,/Profile/J002468,Australia,40
kangra,"Start the day by opening your curtains to a stunning view of snow-capped mountains that are so close you feel you can touch them.  Add in monkeys scampering along the railing of your balcony and swinging from tree to tree.  And then add in a serve of honey pancakes and hot masala chai.  All this before you even get out of bed!  Shops, cafes and the Dalai Lama Temple are all within walking distance. This a good 3 star hotel, very reasonably priced with staff who are friendly and very accommodating to any needs.",Barbara W,/Profile/797barbaraw,"Melbourne, Australia",40
kangra,We stayed here for 2 days in super delux rooms. The rooms were nice and clean. Amazing view of the Dhauladhar ranges. And most importantly at a very good location. Very near from the market. Recommended.,Kriti131,/Profile/Kriti131,"New Delhi, India",50
kangra,This is nice place to stay in mclodeganj. Very nice view of snow mountain from rooms. Clean rooms with good staff service. You need to walk a bit around 10 15 mins on a up hill to reach the main mall road. All in all a very good experience.,Sandeep C,/Profile/211sandeepc,,40
kangra,"Though we stayed in this hotel for only one night, I loved staying here. I stayed in room 205 (super delux room) which had an excellent view. The room have a L-shaped balcony and the windows are big and wide all along the balcony. So you get a beautiful view sitting in the room.   Moreover, the hotel has car parking facility so go ahead and book here if you plan to drive.  Apart from double bed, the room had a big sofa which was very comfortable. The bathroom was also very clean with geyser.",avikdebnath,/Profile/avikdebnath,"New Delhi, India",50
kangra,"i stayed here for 2 nights, had very good cooperation from staff. nice food. the location is just near the dalai lama temple and mc-leod ganj bus stop, so one can find easily.  the view from view is just awesome.the amenities like wifi, hot water, taxi arrangements are good.",Naveenkumar C,/Profile/831naveenkumarc,"Bengaluru, India",40
kangra,Had a great stay with Holiday hill. Mr. Shaukat ji and team were extremely helpful. I stayed here primarily because my brother needed WiFi and that worked well. The decor of the rooms has shiny laminate finish-which may be appealing to some and loud to others. However the rooms are Spic and span clean- with hot water and ample blankets. I would recommend this hotel for families and couples and even solo travellers as I found it safe.  The view from the mountain facing rooms are amazing!,Mansi838,/Profile/Mansi838,"Mumbai, India",50
kangra,"In November I stayed 5 nights at Hotel Holiday Ill and I had a wonderful stay!! I was very lucky to find this hotel! Rooms are very nice, very clean and the wifi is excellent! They clean my rooms 3 times and they clean very well, like european standard The staff is outstanding and the owner is a wonderful person! The food is very good. I'm a woman traveling alone and I felt very safe in this hotel! I'll definitely be back when I'll back at Macleodganj!",Taniam76,/Profile/Taniam76,"Tuscany, Italy",50
kangra,"I stayed at this hotel in November 2016. The room was decent with proper amenities like hot water, wifi etc. We only stayed for a night so didnt expected much for the price offered. However, given how highly it rated here, i wanted to write a review that this hotel is not that great. It is ideal if you going for a trek and only spending the night. Otherwise there are other hotels which are pretty close the market area with better views.There are many issues with this hotel. First thing is that it is not a speciality lodging but just a normal hotel. I guess they listed this property as speciality lodging so that it appears high on the trip advisor ratings. Secondly the food is really bad. and the food matters because this place is really the furthest away from the mcleodgunj",himalayas22,/Profile/himalayas22,"Singapore, Singapore",20
kangra,"I booked hotel Holiday hill for my stay in September 2016. and everything from the ease of booking to my check out was seamless. The rooms are clean, washroom well functional, linen fresh, and view from the top floor rooms is amazing. But what tops the experience of staying here is Shaukat and his team. I was travelling with my parents and its tough to impress my oldies with service. but my the end of my stay even my dad was so touched by the personal gestures of the staff. Location wise the hotel is just 5 minutes walk from the main chowk.",Siddharth T,/Profile/961siddhartht,,50
kangra,Great stay at holiday hill. Mr Bhat owner of the hotel is great person. He given us best service. Food was all right. Location is great 5 min walk from main market and Dalai Lama temple. view from balcony was very good. Overall our stay was nice. ,Rahul K,/Profile/rahulk41800418,"Pune, India",40
kangra,"I think we got lucky finding this hotel. Rooms were neat and clean with amazing views to wake up to. Overall really liked the hotel, decent price, friendly/helpful staff. It's right outside the busy part of town, which was a good location for us. I'm happy to recommend.",Adam K,/Profile/AdamK299,"New York City, New York",50
kangra,Hotel is fine and rooms are also neat and clean though you don't have very good view. People who are working there are very helpful and gentle.  because of them my tour organisation went successfully in Mcleod. Thank you for the team for a comfortable stay at your place. I felt at home!!!!,bonfire_leh,/Profile/bonfire_leh,"Leh, India",40
kangra,"On 19th June, 2016 we took a flight from Delhi to  Dharamshala. Despite of a bad weather at Hilly areas of Himachal Pradesh, the flight was on time. From Kangra Airport, we hired a prepaid taxi for  Mcleodganj and by 3.30 PM we were there. My wife was quite excited seeing steep gardient and narrow hill roads. I suggest that well experienced driver on such hilly turns should only drive  the vehicle.   We had booked HHH ( Hotel Holiday Hill)  through Trip Adviser from Delhi some 3 weeks before our departure. After arriving the hotel we were pleased to note that the room assigned/allotted to us by  Trip Adviser at the time of booking ( a photo of outside the room was also provided to us) the same was exactly provided for our check in.  It was a neat and clean room at first floor (",686pcg,/Profile/686pcg,"New Delhi, India",40
kangra,"We stayed for 2 nights recently at this hotel. For people looking for a really good 3  star hotel, this is highly recommended. What's good about this place? 1. The room we stayed in was neat and clean. 2. The staff are extremely accomodating 3. Bathroom is clean 3. The Buddhist temple is walking distance. ",Ramesh K,/Profile/rameshk331,,40
kangra,"The rooms are excellent. Especially the view from rooms and balcony are overwhelming. The stuff are very cooperative. Although the check-in time is 1pm, we reached there at 6am and they provide us a room without any cost. Fully complementary. The food quality is great and price is reasonable. On request they prepared dishes for my child which is not there in there menu list. The staff are really cooperative in all sense. The only problem I faced is with my mother. She is old and she can't use the stairs. The hotel don't have lift facility. But the owner tried his best to accommodate us in the rooms nearer to the ground level. As a whole, the stay was worth and value for money. I'll recommend everyone to opt the property.",Samik B,/Profile/331samikb,,50
kangra,"We had a wonderful time at Hotel Holiday Hill! The staff were incredibly friendly and helpful in every way and the food was delicious! Unlike hotels in Australia, the room service at Hotel Holiday Hill was absolutely delicious, especially the Kashmir Green Tea!! Pay the extra for a room with a view, you won't be disappointed!",Melinda Roscas,/Profile/GiffyMeliffy,,50
kangra,"after a horrible experience in gandhi paradise...we checked in this hotel and we didnot keep any expectations..but the hotel was good...neat rooms, good food and very good staff... hotel was location was also good...silent and calm place... all over stay was great..",siddharth j,/Profile/siddharthjain1809,"Kolkata, India",40
kangra,"Take rooms 202 and 203, they are great. Staff helped me to plan a trek to Triund, they arranged for me a guide and transportation. Brakefast good. Simple and nice hotel, good value for money, A little off center but its not an issue.",yoavraanan131,/Profile/yoavraanan131,"Haifa, Israel",40
kangra,"My daughter and I spent a week and a half in this hotel and ended up being a little ""high maintenance""; e.g. need for a  pharmacy and then a doctor, special food prep, many direction queries, etc.  Showkat and his staff went beyond the call of duty in each and every instance.  They were great.  And this was in addition to a balcony view I still dream about.  An excellent choice!",Joan556,/Profile/Joan556,"Providence, Rhode Island",50
kangra,"Wandering through the streets just like that, we found this place. In between heating those wet shoes and providing with a map and a no charge stay of an hour or so, so as to freshen up and head out resides the essence of this place. Beautiful viewpoint. Kind people. Good food.  A place to stay. ",Princy P,/Profile/396princyp,,40
kangra,"We stayed here one night because that was all that was available. The room was very clean and we had beautiful views of the mountains. The staff were friendly, the showers had hot water and we even had a flat screen TV. All in all a great find.",bikingmom,/Profile/bikingmom,"Cleveland, Ohio",50
kangra,"Mcleodganj does not seem to have any luxury hotel. This hotel is more like a B&B. If you are going for first time, finding it may be difficult. However on a single call they sent the staff to pick up.   The problem with Holiday Hill is similar to what you have with many B&B. You don't know what type of room you will get. We paid for the super deluxe room assuming will get best views room. First room we were given had a small balcony, but three fourth view was of a wall. Upon request, room was changed to a no balcony room - That did has view from glass window, but no balcony to sit outdoors. In Hills vacation we pay premium to sit outside in balcony in evening watching views.     North Indian Food at restaurant was awesome. Chinese was average.  Service is excellent. Staff goes",Nitin Tripathi,/Profile/travelwithnitin,"Lucknow, India",30
kangra,"What hits you first at McLeod are the steep roads winding their way up. The climb is always on first gear. And what frustrates you are the drivers from the plains who have no clue how to negotiate the 'oh-my-god' gradient.   Hotel Holiday Hill is right on the steep gradient of Jogiwara Road. One saving grace is you don't have to climb down 100 stairs to reach the hotel. The hotel looks like a residential property with a patch of parking in front. The staff is excellent, especially Ashfaq who manages the reception with one more guy, Nazir. They are migrants from Kashmir who have made McLeod their home. Simple, Kashmiri boys - always helpful and smiling.   The best way to book the hotel is to call up Showkat directly. He is the manager who runs the place. You'll get his number on",Shayon D,/Profile/Shayon,,40
kangra,we stayed here for 2 nights. we had booked the place online. The problem is you are not sure about the rooms. I had booked hotel for 3 people and paid for it. The room given was only for two people. The other room had a view to garbage of the city directly. Be carefule about the floor numbers. they work in reverse way. Service is very good.,Ashwin39,/Profile/Ashwin39,"Ahmedabad, India",30
kangra,very nice location..easy to lacate..staff friendly ambience good..clean room..walkinh distance from parking n bus stand market is close..happy to be there..recomend all who want to relax..enjoy mcleodganj,KAILASHI_GAURAV,/Profile/KAILASHI_GAURAV,NEW DELHI,40
kangra,"I just checked out 30min before from holiday hill hotel. Can not stop by my self to write review on this.  Amazing location , amazing rooms.. Amazing food( cooked fresh on order) great staff.  Manager - Showket is great Cook- is so friendly.   Highly recommended.  Have a great stay at holiday hill  Sudhir",Sudhir M,/Profile/327sudhirm,,50
kangra,"Our stay here was for 3 nights, the hotel is walking distance from Mcdganj Bus stand (15 min max) right after crossing the market area. The stay was quite comfortable the rooms were cozy & clean, staff was nice & ready to serve our requests. Food is good, breakfast is served in room as per order. I would recommend this place for price, location & service.",rohitm188,/Profile/rohitm188,"North Sumatra, Indonesia",50
kangra,"Just wanted to share the worst experience of the overnight stay at Holiday Hills Hotel. Worst is very small word for this property...Have booked online room no 204,304 & 305.  rooms were not clean, not maintained and bathroom..no words, nothing was in order in the bathroom.  There was no power back in hotel. Last but not the least service was very poor. After 10 PM they cut the rooms phone line just to ensure that no one can disturb them at night and they sleep like anything.  We were troubling at night for drinking water. I am sure these lines are enough to guide someone....",Gautam K,/Profile/GautamK419,,10
kangra,"The hotel and amenities were below average and not at all worth the money charged, but the worst part was the service. We really were not expecting much from a small hotel in a hill station but the service could have been much better. The entire staff (except the guy who came for room service) had a disappointing attitude and the Front office staff were positively rude. If we called up housekeeping/reception for any kind of service we often got to hear 'we are sleeping' or 'we are having lunch' 'call later'!!! Seriously? Where do  you get to hear that? Not even in the smallest of establishments in the service/hospitality industry! So that was something quite 'unique' we experienced in this so called hotel. Working in the reception on one's own laptop silently meant that we were",Mashbbsr,/Profile/Mashbbsr,"Bhubaneswar, India",10
kangra,"One of the few hotels in Mcleod Gunj which has a good location offering open view from the balcony (specially if you choose Premium Rooms that are on higher floors) and also space infront for car parking. Clean rooms with good bathroom fittings and comfortable beds. Staff is courteous, helpful and willing to take feedback for improvements.  As the rooms face the morning sun, in warm months of May-July the rooms can get warm and ACs are needed - but there aren't any. We felt the need for an AC for morning hours instance when we stayed in May, and then most guests anyway stop out.   Food was good, but service can be quicker. Seemed kitchen isn't well staffed for too many orders together.  Overall good clean hotel to stay at a good location.",Rama S,/Profile/ramas659,"Bengaluru, India",40
kangra,"The hotel location is very good near to bus stand. Food is tasty and quantity is also good. Included Breakfast had 3-4 variety. service was quick , hotel was clean & hygienic. staff is very polite. they are very helping and know how to give wonderful experience to d customers. The room service'staff ishfaaq is very helping All service are good.Keep continuing like this.",GauravRathor,/Profile/GauravRathor,"New Delhi, India",50
kangra,We all friends just found this hotel randomlly. And it was worth it...all facilities available. Clean n beautiful view from the rooms. Food good as well. The  staff very hospitable n warm. The prices thru goibibo more awesome. The rooms were more than what we expected n prices too.,Shefali Lall,/Profile/shefalil2015,"New Delhi, India",40
kangra,I am from Australia and i was totally amazed.From the time we parked our car in the carpark at the top of the town is where we met this very business minded young gentleman Nabir Ahamed.He convinced us to stay at a Hotel he highly recommended. He is a very polite and helpful young man wiith great customer service skills.We followed him to the Hotel and was totally blown away.To the location where we can see the mountains with snow form our balcony to the hills.What breathtaking views. And the staff were so polite and helpful.The rooms were so clean and spotless it was just a pleasure. We did not find anything to fault. The food was fresh and amazing.We only wished we had styaed few more days.The  whole town is buzzing at night and the many restaurants to choose from is just,mmoopnar,/Profile/mmoopnar,"Sydney, Australia",50
kangra,We're 3 friends visiting McLeod Ganj for the Triund Hill trekking. We stayed in this hotel for a night in 1 room. The stay was so friendly that it made our stay even more comfortable! They helped us in getting picked up from Pathankot Cantt train station by car. Arranged the package for the trek. Helped us to book train and flight tickets online!  The rooms were clean. Breakfast was good! I highly recommend this place if you're traveling with friends or family or even as a couple!!!,ebbiethomas,/Profile/ebbiethomas,"Vadodara, India",40
kangra,I was with one of my western friend and the hotel is really amazing in its service and cleanness. The hotel totally meets your demands as per western and indian style .The rooms are very neat and clean .The manager is very helpful and the owner himself is very helpful and dedicated to all the guest staying in the hotel . The best part of the hotel is it is good for a couple and the scenery from the rooms is beautiful .  I would totally recommend this hotel for any sort of travel .Would like to visit soon .I  feel so glad to be a part of this hotel and didnt hesitate to rate this hotel as excellent .Once again a big thanks to all hotel staff and owner for their hospitality and service .We both Sameer and Mariya will remember our trip to dharamshal....,sam142,/Profile/sam1422019,California,50
kangra,"Stayed here in luxury room in April 2016. The room were good & the the view from the rooms was great. Hotel staff is helping & they really made our stay comfortable. Our trip to Bir- Billing ,paragliding arrangements, triund galu devi drop & airport drops all were also done by then. We just enjoyed the stay there. Only scope of improvement i can see is in the food department.",RajeshMegha,/Profile/RajeshMegha,"Gurugram (Gurgaon), India",50
kangra,Affordable hotel with excellent interiors.  WiFi was at low speed 100 KBPS but was good enough for chat / browsing.  Also has parking space.  Interiors are new and stylish.  Room service was good too.  Recommended.,Ankit_Nagpal,/Profile/Ankit_Nagpal,"New Delhi, India",50
