location,review,name,user_profile,userloc,rating
kangra,"They are from Kashmir in a good way. Kashmir sometimes means clean and orderly. Staff and people who keeps this hotel have something really good inside, i had very pleasant impression of communication. Very decent price for the rooms. Rooms are spacious and clean, smart furniture, clean (perfect) bathroom. We were group of 9 people from Russia an d this place made us happy. Thank you so much!",Lellet,/Profile/Lellet,Russia,50
kangra,"Hotel Holiday Hill is a very good hotel. Clean Rooms, Hospitable Staff and morever it is located at the epicenter of Mcleodganj. If planning a visit in Mcleod hotel holiday hill is a good place to stay.",Vivek28292,/Profile/Vivek28292,"Navi Mumbai, India",50
kangra,"Large and clean rooms, hospitable staff and a wonderful central location to discover Dharamshala and surrounding areas from.  - what more could one ask for!   Yummy breakfast, do not miss!   Although they could do with a electric kettle in their rooms.",ashish m,/Profile/627ashishm,"London, United Kingdom",50
kangra,Hotel holiday hill is a great place to stay in Mccleod Ganj. It's central and has breathtaking views of the Truind Mountains.  The food is great and the trips they can organise are also good.  The staff are very helpful at all times. It is a place where regular visiters come- so you know it is good!  I am so happy with the place and the service I have planned my next trip back! A fantastic place to stay indeed!,sun_dUk,/Profile/sun_dUk,UK,50
kangra,"Situated just 10 min. walk from the center of McLeod Gunj, it is an excellent hotel to stay in. It is located in a quite area. Rooms are clean, spacious and comfortable, well furnished with LCD TV, kettle... Front rooms have balconies with stunning view over the mountains. Room service works perfectly. The stuff is very kind, hospitable and helpful. Hotel manager Shaukat, Nazeer and other guys are doing a great job.",mimimetalac,/Profile/mimimetalac,"New Delhi, India",50
kangra,"I stayed here only for a few hours after checking out of Pema Thang as we had 8 hours to kill before starting for Delhi. This is a quiet place a short walk from the main market. The rooms are nice and the owners are friendly and helpful. Only thing to look out for is the fact that you have to make steep uphill trek to reach McLeodganj. If you are game for this, go ahead and stay here. ",Deb,/Profile/debadideb,"Indore, India",40
kangra,We stayed at Hotel Holiday Hill for a couple of days and we really enjoyed our time there. Our room had a stunning view of the mountains and valley and was also really nicely furnished.   The roomservice and the food was also great! If we ever needed help our guidance the staff was more then helpful so would definitely recommend this hotel to other travelers.,Flisanw,/Profile/Flisanw,"Stockholm, Sweden",50
kangra,"I stayed at holiday hill with my friends for 3 nights. Shaukat the hotel manager is very helpfull and at your service all the time. Rooms ..we stayed in executive rooms and were well equipped. The rooms lacked a hot water kettle which is must in winter. Breakfast was good and decent in quality.  I am rating this hotel 5 stars as shaukat had helped us with almost everything from arranging a tent at triund when we didnt have any , accomodating 4 in a room as there wer no rooms available coz some of us could not climb triund and had to return back and releasing room for us on goibibo.  Had a great expreience overall ! :) ",sushant t,/Profile/592sushantt,,50
kangra,The rooms are very comfortable and the staff is excellent.  I stayed here twice during my travels because of the quality.  The location is good because you have a view of the Himalayas and your a little off from the main road.  I would stay here again for a third time.,Brent B,/Profile/brentb629,"Santa Barbara, California",50
kangra,"The hotel is conveniently located near the market area and the Dalai Lama Temple. The staff was courteous and helpful. My room was right above the reception area but there was none of the noise and chaos that usually goes with running a commercial establishment. The room was well furnished, bathroom clean. I would have liked a room with a better view of the mountains since that is what I had originally asked for, but that apart, everything was well managed. The restaurant service is very slow and can surely be improved upon.",Ebbs_and_tides,/Profile/Ebbs_and_tides,India,40
kangra,"This hotel is great, the staff are great, the wifi connection is good & there is a good selection of food on their room service menu.  The views of the mountains from the hotel are also amazing.  I really enjoyed my time here :) My full review of this hotel is on my blog ausgypsy.com",the_gypsy_life,/Profile/the_gypsy_life,"Perth, Australia",50
kangra,"Good Hotel,   &  Very Courteous Management, Rooms very well furnished and excellent view of Mountains, Bathrooms neat and clean. Linen is of good quality.Reqiures improvement on Restaurant food quality. Good parking space. and drivers are well looked after by the hotel Management with free food and sleep;",henryc800,/Profile/henryc800,,40
kangra,"This property has an awesome view of the Dhauladars.  It has nice clean rooms with all the needed amenities.  The best feature was the customer service provided by the staff, they were very helpful, understanding and knowledgeable of the area.  In particular Nazir was most efficient in helping us plan our stay with various activities in the area.",SohailGill,/Profile/SohailGill,"Patiala, India",50
kangra,"Mcleodganj is not a city. A little far away from Dharamsala. But it has its own beauty & calmness. Hotel Holiday Hill is a mid range budget hotel with basic stuffs. We got a room at fifth floor & the view from both window & balcony were amazing. The food was kind of ok, room service was good, staffs were helpful. Which we did not like much the cleanliness of the room & washroom. All the time we had to keep on the exhaust fan of the washroom. Management should look more into the cleanli",ragni b,/Profile/27ragnib,"Kolkata, India",30
kangra,"Holiday Hill is on a hill and you should know that! The climb to the hotel is steep and if you have the luxury or super luxury rooms then you have to climb down the fifty odd steps. Make sure you ask for a room on the main level if you are not fit or elderly. That said, the view is to die for.....you can actually hear the night when you sit in the balcony. The food is good, boys are quick and very helpful. spacious and clean room and bathroom. All that at a great price! the main market and Dalai Lama Temple are very close so even the location does it!",ivebeenthereguide,/Profile/ivebeenthereguide,"Gurugram (Gurgaon), India",50
kangra,Wonderful place with car parking food was wonderful. We stayed there for 1 night peaceful place room service was also good nice view too .. In short best place to stay .. Market is almost 10 min away..,Anirudhshine,/Profile/Anirudhshine,,50
kangra,Stayed in Luxury room for 3 days. Superd Hill view from room. Room is very neat. 24 hours hot water facility and room heater. Good room service and staffs are polite. Located near to Mcleodganj main market. I would recommend this hotel. ,srikanthkonda,/Profile/srikanthkonda,"Hyderabad, India",50
kangra,"Reached Mcleodganj in the late evening. Found this place.   Pros: 1. From the looks, it looks like a pretty decent hotel as per the local standards. 2. Very hospitable staff. 3. For the tariffs, the rooms are quit decent. The washrooms are also pretty good. Everything neat and clean. The balconies offer a view to the mountains above. 4. The food is tasty as well. 5. There is a terrace (with no lights) where you can sit back, enjoy the scenery and chill in the daytime. 6. Everything important (cafes, market, places to see etc.) is nearby but, anyway, Mcleodganj ain't that big.  7. Free wifi  Cons: The walk to the market is a bit of a struggle because of the steep slope, but believe me , it's worth climbing the slope given that you'd be eating loads of calories in the market ;).",Vatasal,/Profile/Vatasal,"New Delhi, India",50
kangra,Great place to crash at in mcleodgunj. Morning view from the balcony is wonderful. Makes for a perfect morning coffee and good music. All near by trekking places easily accessible. Staff is helpful. Did not really try the food here. The near by Tibet cafe offers the best heavy breakfast to begin a long day on the trails. ,Abhishek G,/Profile/880abhishekg,,40
kangra,"Booked a deluxe room for two nights with breakfast, got room number 301, wall attached with kitchen, you can smell what is cooking when. Breakfast don’t mention it, only two vegetarian options available Parathas and Bread Toast with tea. Dirty bedsheets (not white so that you can’t see if it is washed or not), blanket was smelling bad. We requested to change with white furnishing next day. White ceramic tiles on the floor were so cold there was not even a piece of carpet on the floor. If you want room heater, they said it is available at and additional cost of Rs 250 per night and I was like “come on”. Standard washroom supplies include Re. 1 shampoo sachets and a soap; so be prepared if you don’t like Sunsilk.   This property is situated on Jogiwara Road, 700 meters away from",Rajan S,/Profile/rajs23,"Gurugram (Gurgaon), India",10
kangra,"On my 8 day trip to Himachal Pradesh, this hotel was the best part. The Owner, Mr. Shaukat is amazing. We reached the hotel very late in the night. We were provided with a really good room. The service was excellent. We went trekking to Triund, as we did not arrange for any stay before hand, we called up our hotel owner from the top. He told us to go look for a person named Babu, and thanks to him we could sleep comfortably in tents with sleeping bags or else maybe we would have froze in the cold. The hotel had an amazing view, excellent food and service. ",BurlesqueFaM,/Profile/BurlesqueFaM,"Mumbai, India",50
kangra,"Sweet home away from home with breathtaking nature. I have stayed 3 nights with warm of my brother shaukat & his family. Quality of room, foods are excellent and room services also awesome.Thank you shaukat bhai and family  of holiday hill........",raj m,/Profile/230rajm,,50
kangra,We stayed in this hotel on our Honeymoon and it had the most spendid view from the balcony. The food quality and room service was quite good too. Please go for a room at the reception level as this hotel also has rooms at basement level which do not offer such a great view.,Ritika D,/Profile/572ritikad,,40
kangra,"Went in for a 2 night stay with my friend and the rooms were brilliant with a breath taking view of the himalayas. Mr. Showkat is a very nice gentleman and the whole staff is so polite and helpful.  Hotel has their own parking, did not use the restaurant much so can not comment, wifi is very slow though. I have tried many hotels here but this is the best.",rajats149,/Profile/rajats149,"New Delhi, India",50
kangra,Stayed here for 2 days and it was a brilliant experience. The staff specifically was great and special credit to Mr.Shaukat. He is a very nice gentleman and will help you with whatever you need.   The room i booked had 2 sided valley view. View was amazing and the room had good level of cleanliness and was spacious. Food is amazing. Hotel has self parking facility and is secured.   Only slight downer for me was a little trekking/walking you have to do till main square. That's it but its totally worth it.,Skoda_12345,/Profile/Skoda_12345,,50
kangra,Most beautiful experience staying here Amazing view and good hospitality  Very co operative staff Good food I would like to visit there again if i get a chance Very near to the market.. Cleanliness is up to the mark... Relaxing ambience..... ,Khushboo T,/Profile/KhushbooT37,,50
kangra,Been to mcleodganj with my friends in november this year .Awesome hotel and a great staff...excellent service...Best view from the hotel...if you visit mcleodganj an excellent place to stay. this hotel is in close proximity with most of the tourist spots in mcleodganj...dalai lama complex and the main market are at walkable distance,Tushar J,/Profile/828tusharj,,50
kangra,"This is an excellent hotel,in a beautiful location. We stayed there two nights. Reached there in the evening, Next day morning, when we looked through the window, really we were speechless...so beautiful, so nice view, we could see.  Hotel staffs are very efficient...service is very good . This is a brand new hotel...so rooms are very neat & clean. We got 24 hours hot water service in the bathroom.  Food is very tasty and reasonable.    The main advantage of this hotel is Mcleodgange SQUARE...the main market place, DALAI LAMA TEMPLE both are in walk able distance from the hotel. ",MrsChatterjee,/Profile/MrsChatterjee,"Mumbai, India",50
kangra,"Stayed here with my wife for 4 days in November, had  great stay, the best room we stayed in India actually. Our room had a fantastic view of the snow peak mountains, a balcony, fridge, TV, hot water and was clean and modern. There is also a nice rooftop to relax in the sun. Staff were very friendly also and the price was good value. Would recommend for sure, seemed like great value for this area and only 5min walk from the town centre. Cheers",Big Kahuna C,/Profile/bigkahunac2014,"Mooloolaba, Australia",40
kangra,"We stayed in Super Deluxe Rooms. Rooms were good, and clean. You have to instruct the hotel in advance if you want parking for your private car. Rooms offering Hill view are great. Hotel staff is helpful. Food was good, but food service was slow. Hotel is very near to Dalai Lama Complex, and McLeodgunj Market.",Tushar,/Profile/Tushar4u,"Navsari, India",30
kangra,"The Good: This is the place to get a lovely room. Walking in I was very impressed with the decor and set up. The room was clean as were the sheets. Staying anywhere in Mcleod ganj you are letting yourself down if you don't get a room with a view. I'm not a big one for it but here it is worth it. The view from our room was spectacular. In addition the staff were very friendly every time we saw them. The cable tv works a treat, not that you are in Mcleod to spend much time watching it. There is also a water filter in the common area that you can use  The Average: There is a common area but it all feels a bit sterile and it' is where they serve food. The roof terrace is not that nice a place and there are plenty of better cafe's to hang out in with a good view.   The bad: The",Keith B,/Profile/KeithB157,"London, United Kingdom",30
kangra,We were 8 family members on a tour of North India.It is a nice hotel with very friendly staff.The rooms are clean and have very good view of the valley.Food quality was very good.The service was excellent.The location of the hotel is very good as the market is hardly 5 minutes walk.Overall it was a nice stay.,Kotwal,/Profile/Kotwal,"Pune, India",30
kangra,"It’s a nice, comfortable, clean and family atmosphere type good hotel to stay. Awesome experience as hotel is close to main attractions of Mcleodganj. Very helpful staff and meals served were also very tasty.  Our stay at Holiday Hill was pleasant, all thanks to the wonderful hospitality that these guys provide. Special mention to Showkat and Nasir who made sure that we all were comfortable and arranged for everything that we needed . It’s a nice, comfortable, clean and family atmosphere type good hotel to stay. Awesome experience as hotel is close to main attractions of Mcleodganj. Very helpful staff and meals served were also very tasty.  Clean big rooms with balconies. The view that this hotel has to offer is one of the best things about this hotel apart from it's delicious",adi2501,/Profile/adi2501,Kolkata,40
kangra,"i am a regular visitor to macleaudganj and believe me friends the following are the pros and cons of this hotel pros: 1. hotel has parking within its premises 2. the only hotel in macleaudganj with the best balcony views of himalyas 3. the best room service 4. they are also no.1 in cleanliness 5. THE most important is the staff, the staff is so helpful , i have not seen any staff of any hotel or resort so helpful like the hotel holiday hill staff  cons: no cons as this hotel is the best",SHREYASSINGH,/Profile/SHREYASSINGH,"New Delhi, India",50
kangra,"its a nice, comfortable, clean and family atmosphere type good hotel to stay. Awesome experience as hotel is close to main attractions of Mcleodganj. Very helpful staff and meals served were also very tasty. We with our friends visited on October 17-18 and we really enjoyed our trip",SatishModgill,/Profile/SatishModgill,"Ludhiana, India",50
kangra,It was awesome to stay in hotel holidayhill as services provided by them was special and their staff was very cooperative and friendly.I wish I always visit this place again and again....:)  special thanks to Showket(Manger) for his special services provided to us.,Jitender M,/Profile/459jitenderm,,50
kangra,"After my visit to Kashmir & then Katra for 11 days, I stayed in this hotel for 3N with my Mom i.e. 1st to 3rd Oct 2015. I will say this hotel is one of the best hotels in India when it comes to HOSPITALITY - service, rooms & accommodation.   1. Positive vibrations - The hotel is clean & energetically very good. Everyone in the hotel including the owner Mr. Showkat Bhat, the hotel manager, the pantry boys, the housing keeping boys are always SMILING, are helpful and are very POSITIVE PEOPLE !! They are literally more than happy to listen to you and act promptly on what needs to be done.  2. Service - Superb and fast service beyond any doubt. I seldom appreciate people on their speed but these folks deserve the praise for their professional services offered. They offer free wifi. ",AdvocateMansi,/Profile/AdvocateMansi,"Mumbai, India",50
kangra,"The location of the hotel was perfect, just 5-10 mins walking from the main junction. Fantastic view of the beautiful valley from my room. The incharge of the hotel was a super awesome person(Shawkat). I liked the hotel and helpful staff that much that I pre-booked the room for 1 day but ended up staying there for 3 days. And I am pretty sure to stay there when I visit next time.",Rajatrohatgi,/Profile/Rajatrohatgi,"New Delhi, India",50
kangra,"Just back from an amazing trip to McLeodganj! And, I already miss the quaint li'l place.  Our stay at Holiday Hill was pleasant, all thanks to the wonderful hospitality that these guys provide. The hotel staff and owner go out of their way to help, and it's pretty obvious that their only aim is to keep their guests happy. Special mention to Shaukat and Nasir who made sure that we all were comfortable and arranged for everything that we needed including our travel to Manali.  Coming to the rooms here at Holiday Hill, well, after going through a dozen of hotels in McLeodganj we zeroed on this one only and only because of the clean big rooms and the view it had to offer. We took three rooms here, all of them big enough with balconies. The view that this hotel has to offer is one of",Priyanka T,/Profile/08wanderlust,,50
kangra,"Just back from extended weekend at Mcleodjang. Stayed at Holiday Hill and the experience turned out to be superb. Booked this hotel via goibibo and got a great deal.  This property is quite close to the main square and almost all the famous points can be done by walking. Rooms are clean, nicely done along with good views from balcony. Staff is polite and quick in service. Restaurant serves some really yummy food and they do tawa roti . Owner of this place is a nice man and ready to help whenever required. He sent one of his staff to fetch us when we called him for exact location and also let us check in the before 12 noon as we reached before time. My little daughter broke the ceramic ash tray and this fellow did not even ask us for the damage. ",ansima s,/Profile/ansimas,"Gurugram (Gurgaon), India",40
kangra,"It was an awesome experience to stay there. Staff was well-mannered, service was amazing and everyone is friendly. I stayed there for 5 nights - and I would go again.  Owner of the hotel is also very friendly and helped us on multiple occasions when it was not even his concern.",abhimanyu503,/Profile/abhimanyu503,India,50
kangra,Loved the place.. room 304 will b in memories forever. Room service was good.  View from the room was awesome.  I would give 4* coz of some very basic issues like cleaning and stuff but otherwise it was nice.,royalmaharana,/Profile/royalmaharana,"Bengaluru, India",40
kangra,Our stay at holiday hill was great. The view from our room was amazing. The room charges are nominal. We were surprised that at such rates every facilities were provided. The location is perfect as it is near to the main market. The food was nicely prepared. The owner was gentle and kind to provide us with anything we needed. Overall the trip to mcleodganj was an awesome experience.,Shailbala T,/Profile/shailbalat,,40
kangra,"Great hotel great rooms awesome view  Awesome Place to stay there, Yummy food parking for cars good service, very helpful staff, 24 hours wifi and hot water support during our visit. The hotel is located 10 min downhill from the main market.",Rahulrk2550,/Profile/Rahulrk2550,"Amritsar, India",50
kangra,"We went in a group of 10 people, they provided rooms to all of us on same floor. This hotel pleasantly surprised us for the price they charge. Rooms are well maintained and comfy. The restaurant food good too. The hotel is located 10 min downhill from the main market.The best part of the hotel is their hospitality, the staff guided us very well during our stay and they even courier my dress which i forgot in hotel, on their own expense. I would definitely recommend this hotel.",Richa G,/Profile/RichaG933,,40
kangra,"I have been twice to this hotel in Mc Leodganj and found it better than the last time. Very helpful staff and they are really pleased to work for you. Rooms, View, Service etc everything is really good. I personally wants to thanks Mr. Showket Bhatt for all his help and support during our visit. Way to Go Dude!!",travelmagictour,/Profile/travelmagictour,"New Delhi, India",50
kangra,"Pros :  1. Nice , clean rooms. 2. Good food & Service 3. Different leisure Packages available.  4. Helpful Staff(run by Kashmiri brothers) 5. Value for money (anything paid less than 2500). 6. All basic facilities like hot water, iron in rooms , limited wi fi access are available. Cons: 1. Location - 10-15 minutes from main McLeod market. Can be problematic for old people.  2. Drive is not easy from main market towards hotel especially the last turn towards hotel is very steep and sharp . you need to be an expert car driver.  3. All non A/C rooms .  Definitely recommended and would love to stay again and again.   ",rht12345,/Profile/rht12345,"Mohali, India",50
kangra,"My stay with the HolidayHill was for a weekend. All rooms are good, clean and quiet. They make the food fresh and offer clean dishes/cutlery. They offer wi-fi internet and the connection speed is good. TV is also available with international channels. They have parking space for at least 5 to 6 cars. I would request to contact Showket and check for the parking place before you arrive.",Raghav_Pandit_Delhi,/Profile/Raghav_Pandit_Delhi,"New Delhi, India",50
kangra,"Holiday hill is a nice, decent property located at the jogiwara road of mcleodganj. The place provides a terrific view of the snow covered Dhauladhar hills straight from the rooms, not sure if the view is available from a room at the lower levels too. But from the top ground and the level just below the ground surely does. The temple of the great his Holliness The Dalai Lama is just at a walk away distance from the hotel. The market area starts at a mere 3-4 mins walking distance. The rooms are clean and adequately spacious with all the amenities, attached balcony. Room service is quick and satisfying, just leave your room keys with Shauqat(the guy running the place) before leaving for sightseeing. The place provides for amazing food as well which is also extremely soft on your",Swati T,/Profile/753swatit,"National Capital Territory of Delhi, India",50
kangra,It was pleasant and nice stay at Holiday Hill resort It made my trip very relaxing as the staff is very much caring and quick in their service Most importantly it has a sufficent car parking space with full safety of night guard It is situated near to the  mall road only.... Easy to commute In all pleasant stay with family.....!,AdvRahul,/Profile/AdvRahul,,40
kangra,Very nice hotel... perfect hotel for stay in McLeodganj... have been there for two times.. first in dec 14 with friends n second one in May 15... Like the service n hospitality.. Spacious rooms...nice view from balcony... ,Nitin R,/Profile/NitinR38,,40
kangra,i went to mcleodganj in last year summers. it was really a pleasnt trip. service was excellent. but every rose has thorns on it. same here.... i was disappointed due to some insects which came in my room through balcony. so i gave it 4 stars. food was tasty. thnks to hotel holiday hill..........................,ravi C,/Profile/ravi516,"Batala, India",40
kangra,The view from the hotel room was good.. Perhaps better than the other hotels I stayed in McLeod.. But it wasnt really exceptional at it's price.. Took the best room available but on a few aspects it was found wanting.. The owners were nice and friendly and that could perhaps be the best part about it,Vipul556,/Profile/Vipul556,"Mussoorie, India",30
kangra,We stayed for two nights at holiday hill hotel. Hotel rooms are very good and clean. All staff members were extremely courteous. Food at hotel restaurant is nice and very competitively priced.  Will surely recommend to anyone going to McLeod ganj.,dharamvir167,/Profile/dharamvir167,,40
