location,review,name,user_profile,userloc,rating
haridwar,"Was there for one day on the 23rd good service' excellent staff,fantastic private ghat total peaceful.i would like to thank mr bhatnagar,for our great stay .mr raut also .great food .thanks .will visit again.",bobby s,/Profile/456bobbys,,50
haridwar,The hotel is very conjusted. Lift cannot accommodate more than 4 people. The rooms are also small sized and the rates are high. Room service is very poor and slow. Though they have a private ghat but it is also very clumsy and dirty.,ayushagarwals022,/Profile/ayushagarwals022,"Bareilly, India",30
haridwar,The hotel was comfortable and served our purpose. Enjoyed the private ghat. Could bathe and pray without any crowding and hassles. It was quite easy to get to har ki pauri by auto for a small price and within a few minutes.,Jothi M,/Profile/jothim2014,,40
haridwar,"This is a very good property to stay at Haridwar which has steps leading right down to the water of the Ganga, which is private protected bathing ghat. The restaurant on the top floor with an open terrace offers excellent views of the river and surrounding areas. The rooms are small and there is an issue with cleanliness.It seems a bit overpriced compared to overall comfort. But staff are very helpful, and particularly the Manager Mr. Bhatnagar was very co-operative and courteous which helped us in several ways.",soumitraju,/Profile/soumitraju,"Calcutta, West Bengal, India",30
haridwar,This hotel has space constraint and is very clumsy. Very small lift and very narrow staircase. Price is relatively higher compared to other hotels in the vicinity. Though food quality is good but room service is very slow. The only plus point with this hotel is that it offers private ghat and there is paid parking lot near it.,vanigupta031992,/Profile/vanigupta031992,"Solapur, India",30
haridwar,Rooms and bathroom are not so spacious but well planned. Service is prompt and courteous. Complimentary breakfast is ample and tasty. Rooftop restaurant is nice with view of Ganga but elevator goes only till one floor below terrace. Elderly might find it uncomfortable to climb stairs. Same issue with private ghat which is two levels below reception and no elevator service. Funny thing about bathroom is its totally glass walls hence no privacy. They have shower curtains but not quite adequate. Had to turn off bathroom light while using. Also no bidet (hand shower) for WC in bathroom.,GypsyatHeart2013,/Profile/GypsyatHeart2013,"New Delhi, India",40
haridwar,- sitting at private hotel ghat is enriching experience. - food at roof top in the evening  -rooms are well equipped  - worth the price and location - staff is very courteous All in all good hotel to visit.,Ravi1232,/Profile/Ravi1232,"Mumbai, India",50
haridwar,"We had stayed in this Hotel from June 17th to June 23rd and got a good deal from Oyo. Rooms were spic and span...bed linen were spotless...washroom was small and compact...Food was homely and it can be made to your taste..House keeping staff's response was good...Front office staff were very cooperative and they can go an extra mile to take care off your needs....They can book cabs for Badrinath, Kedarnath and Rishikesh tours...Very near to Haridwar railway station...Master piece was sitting on the Private Ganga Ghat and enjoying ethereal Majestic Ganga...You are at peace...you can bathe...you can do meditation..Trust me it was a sight to be felt! Some review said..it was not clean...some said it was place of drunkards...but never saw anything of these episodes in my week long",sundarji007,/Profile/sundarji007,"Hyderabad, India",50
haridwar,Excellent hotel and cooperative staff. Hotels private ghat is very clean . Family suite room is best with ganga view. Pleasant stay.  But glass wall of bathroom is little inconvenience. Overall it is a very good hotel to stay with family.,Shashi B,/Profile/ShashiB182,,50
haridwar,"We were excited about the private ghat and rooftop restaurant and view of the ganges. However, were very disappointed when we went down to the ghat. There were drunkards set up with tables and chairs drinking. When we complained, hotel staff asked us to give them some time to clear it.  Cannot believe that this would be allowed. The stairs to the restaurant was filthy. Could see into the kitchen on way up.  Also dirty. Restaurant was deserted, dirty and not like a real restaurant.  Service was very slow and one person seem to be doing everything.  Machinery was stored on the rooftop.  Hotel rooms were small.  Bathroom extremely small, One could barely turn around.  Would not recommend this hotel.",Dru R,/Profile/drur2014,"Orlando, Florida",10
haridwar,A  small  hotel  with  modest  size  rooms  but  neat and comfortable.  Friendly enough  staff. The  biggest  plus -  the  private  bathing  ghat  attached  to the  hotel.  Made  the  dip in the Ganges  a  memorable  experience.  On the negative  side -  prices  I thought  was  a little  steep.  Hotel is located  on a narrow  street  and parking  is  about  50 meters away.  The food is  good  but  service  in the restaurant  could improve -  room service  was more  friendly (Rahul  in particular  with his warm smile ).  Overall  a nice  experience.,padmanabhan p,/Profile/pradeep49,"New Delhi, India",40
haridwar,"Go to holidays (Anil and Nutan) was our choice to book our travel to badrinath with our parents. A suite at this hotel was kept ready for us when we reached there after a terribly hectic drive from badrinath at about 9pm.. We were promptly shown to our suite on the 3rd floor and undoubtedly it left awestruck...it had 2 bedroom with attached bath and a sitting area with a view of the holy river ganga just outside the window.. comfortable is a understatement. Steaming hot food, prompt service by the staff, private bathing ghat to take a dip in the ganga river were some of the biggest plus points of the hotel. I know i will choose this for ny of my future travels to haridwar and will definetly recommend it to everyone.",RMathur,/Profile/RMathur,hyderabad,50
haridwar,"Fantastic location covering vast horizon of entire ganga,ganga bath experience was fun Rooms are good & clean importantly well maintained. Importantly thanks to Nutan (Go to Tours) helping to find arrange a beautiful location within city limits .",harsh2688,/Profile/harsh2688,"Mumbai, India",50
haridwar,Nice and quite hotel on the banks of river ganga. Have private ghat (for holy dip in ganges). The rooms are nice and value for money. The quality of food are good and are prepared on order which takes a little more time but worth the waiting. Got a very good hospitality from the marketing and sales team specially Nutan on arranging the entire trip.,Ratnajit B,/Profile/RatnajitB1,,40
haridwar,"We stayed in the Hotel Ganga Exotica in April 2017 with family.  It was a good experience. The rooms are decent, however the glass walls of the bathrooms are not completely opaque. This is slightly inconvenient. But the view from the Ganga facing rooms are excellent, there is a private ghat as well. The hotel is very close to the parking, which is another advantage. But on the other hand, this hotel is a bit far off from Har Ki Pauri... however, rickshaws are always available, so I guess that is only a minor inconvenience. They also provide additional facilities like arranging panditji for puja etc.  Most importantly, the staff is extremely helpful. I express my heartfelt gratitude to Mr. Rawat, who personally took us to the doctor, when my daughter required some medical",DebasishChoudhury,/Profile/DebasishChoudhury,"New Delhi, India",40
haridwar,"Fantastic location, with a rooftop restaurant giving you great views of the mighty river. A little slow though, I had to wait for 30mins in the morning as the person who knew how to use the billing software wasn’t around.",Riaan R,/Profile/rrml,"Mumbai, India",30
haridwar,"Hotel Ganga Exotica, formerly known as Ganga Kinare, was exemplary with regards to the hospitality offered by the entire staff. Mr Bhatnagar was a gracious host, attentive to the needs of his guests. Same goes for the rest of the employees, from room service to kitchen and restaurant staff.  The stunning view of the Ganga river from our family room was beyond anything words can describe. Right from our suite and its two bathrooms to the private ganga ghat maintained by the hotel, everything was spic and span. Since my father had dietary restrictions, the staff followed our instructions, regarding his meals, very carefully. Really nice and accommodating of them. Special thanks to Rajkumar Bisht, restaurant in-charge, for his personal attention during all our meals and his",Intlbackpacker,/Profile/Intlbackpacker,"Bengaluru, India",40
haridwar,We stayed in this hotel in the month of July 2015. When we reached at the Haridwar station one of the rickshaw driver took us to this hotel. We stayed in the Premium Double bedroom.The room was very good and clean and the toilet was well maintained. But the price is quite high. Food was good. The service guys were more helpful than the reception guys.,inder2018,/Profile/inder2018,"London, United Kingdom",40
haridwar,"Very nice hotel with great front desk staff. Once we had checked out we had a few hours to wait for our train to Delhi, we just stayed at the hotel it was hot and we both were not feeling the best. They gave us a room for a few hours to relax in.   Our room was nice - air-condition, tv, hot water, clean and comfy!",Rhi C,/Profile/574rhic,"Adelaide, Australia",50
haridwar,This hotel is on the banks of River Ganga. It has a private Ghat. Location of this hotel is very convenient; it is a minute walking distance from Safe Parking. Rooms are small (I suppose all hotels over there have small rooms) but neat and clean. Staff is courteous; service is prompt.  Hotel has good Wi-Fi. Breakfast was good. GM of the hotel is very friendly and gave us lot of information about nearby places. There is a deluxe suite facing the river that can accommodate 4 persons. This would be a good option for a small group to go for this rather than asking for 2 separate rooms.,Sudha K,/Profile/Sudha0503,"Mumbai, India",50
haridwar,It was an amazing experience staying at Hotel Ganga Exotica. Very spacious and clean rooms. The view from the room was beautiful-surrounded by water and mountains. The staff was very courteous and helpful. The roof top restaurant has an alluring view of Ganga and the food was extremely delightful. Hot and sour soup is highly recommended. Private bathing ghat is a plus. Overall it was a super relaxing trip and because of this hotel i didn't want to come back. Thanks Ganga Exotica for making our stay a memorable one..!! Will definitely come back..!!,Shilpa C,/Profile/ShilpaC122,,50
haridwar,Amazing hotel with a amazing view to the Ganga..  Me and my wife were visiting the hotel for a relaxing trip from chandigarh & I must say we had the best time over there. The hotel is located just on the bank of Ganga and has a amazing view to it and the surrounding mountains. The hotel staff was very helpful and they did the best to make our trip memorable. The food is amazing and the roof top restaurant has a amazing view. I would recommend soya chaap and paneer tikka. ,mtyagi1611,/Profile/mtyagi1611,"Chandigarh, India",50
haridwar,Stayed at this place for 2 nights on 3rd & 4th July 2016.   Positives Conveniently Located away from the din on the Right Bank of River Ganga. Receptionist Mr. Kamal Rawat pro-active and very helpful. Private Bathing Ghat - very clean Owner carefully listened to my suggestions and instructed the GM to resolve the problems. Rooms are well lit and noise free - window are sound proof. TV has Regional Channels also  Negatives Bed Level not at right level Food is of poor quality Bad odor from the toilet drain,B R S,/Profile/888brs,"Mumbai, India",30
haridwar,"Hotel Ganga Exotica is wonderful hotel. Well situated - out of over crowded streets and public. Well connected with Transportation and not far from Har Ki Pauri. We stayed at Hotel Ganga Exotica for 2 nights 3 days and had wonderful experience. -----------------------------------  Hotel Ground: Osome, it is on Ganga River Bank. Maintaining Spritiuality by providing Private Ghaat.  Rooms: Neat and clean room. Hospitality: Good. Hotel staff is very nice and warm welcome. Food: Very Good Recommendation: Strongly recommended for those people who really want to spend good time at Haridwar and want to spend time with Ganga Kinaare out of over crowded place with their family members.",Rahul Jyoti Pandey,/Profile/Ghumakkars,"New Delhi, India",40
haridwar,"As name stated this hotel on bank of exotic Ganges river, and having private ""Ganga Ghaat"". you will find a neat and clean road in front of hotel, Normally you will see lot of dirty places in Haridwar, Not a well maintained city. Hotel does not have own parking you need to park your car in ""Saf parking"" on Niranjani Akhada road just in-front of hotel.  Rooms are clean and well maintained like star rated hotels,as our stay was in suit so can not write about other deluxe rooms.Only suits are having private balcony to sit and enjoy the Ganges view.Other rooms have window towards Ganges.  Restaurant is good with average food taste and high pricing.  if you are planning to go Mansa devi and Chandi devi by ""Udan Khatola"" take a combo ticket and try to go early in the morning.(For",Amit p,/Profile/X7175TVamitp,"Ghaziabad, India",40
haridwar,"The location of the hotel is excellent. We stayed at the top floor with a shared roof. There was one more room at the roof top. The view of Ganges from Roof is mind blowing. It is situated just on banks of Ganga. Now, except location, there is nothing exciting to talk about. Food is expensive here. The tariif was high as I stayed here last year at Rs. 7000/- only for stay without any complimentary breakfast.",reachpm,/Profile/reachpm,"Noida, India",30
haridwar,Best hotel to stay with awesome ganga view and hotel rooftof restaurant is also very good food qualtiy is great  i book my room through oyo and i get a very best deal and i am very satisfied  with my stay in ganga exotica,177hxh279zj,/Profile/177hxh279zj,,50
haridwar,Stay at top floor delux room with a balcony with the Ganga river view the room was very nice and staff was very helpful but they do not have a proper restaurant food was below average otherwise this is a nice property with private bathing ghat though with 6500 rupee per night was a bit excessive compared to service provided.No mini bar or proper restaurant service food served at room.But staff is extrmely courteous and helpful.,Joyjit B,/Profile/Joyjitbose,"Kolkata, India",30
haridwar,"Referred by a friend as the only good hotel available here, the hotel turned out to be far above expectations. The place has an excellent rooftop where one can relax and can feel the peace in air. The rooms are great value for money particularly the ones with the river view. Highly recommended.",Ankur G,/Profile/905ankurg,"Chandigarh, India",50
haridwar,"Visited Haridwar in Feb 2016., was disappointed with the rooms as we booked three rooms, we found no ventilation in the room . With fans air moving around there was no space for fresh air. The glass sealed window in the room is required to  be open for fresh air. The lobby was small ,lift was not upto the mark . The root terrace restaurant was good and had good view of Ganga river.There was no arrangements of tea n coffee jug in the room. The staircase is narrow . The front view from the room opens to bye lanes .Not  worth for heavy price.  I prefer to  pay same price  n stay in better atmosphere. ",manuchainani,/Profile/manuchainani,"Mumbai, India",30
haridwar,"Near ganga ghat , in the center of city ...two days stay made a great spiritual impact ..out of many hotels I found this a better one as its on Ganga ghat ...u can have view of ganga river from ur room ..just go down stairs and you can have a holy ganga snan ....totally worth visiting ....harki paudi is near by rikshow ....go and have experience of ganga aarti .....",mehulkhakharia123,/Profile/mehulkhakharia123,jamnagar,50
haridwar,"I recently had trip to Rishikesh & Haridwar with my family and it was awesome trip due to this hotel. Well located, awesome food, amazing ambiance and best is quality standard they are maintaining. I was really happy to see such a amazing hotel which is ganag facing and has own personal bathing ganga ghat. I stayed in Suit room and find it far above than my expectation. It's located at central location just 5 min away from har ki paudi and 40 min away from rishikesh.  I visited many countries and stayed in almost all top brands but for this hotel i will say cheers to hotel management team who are maintaining world standard in haridwar. Must recommened every traveller to stay there.  Best highlight was terrace rastro... must go in evening and enjoy the nature to the closet.",talk4deepak,/Profile/talk4deepak,"New Delhi, India",50
haridwar,"We recently stayed here and made a fantastic choice. The hotel is in a great location; right next to the holy river Ganga, one of the biggest and most important rivers of India. It was located very nicely, and the sights along the river were beautiful. The staff in the hotel were great – excellent service and very friendly. Our family was very pleased and satisfied by this stay.  We will for sure make this our hotel of choice in the area when we return.",dg7895,/Profile/dg7895,,40
haridwar,"I was there in April and my next visit was in May....I loved the location and their private ghar...Rooms are excellent.. Especially the Ganga view...Staff are very helpful.. Managers are very cordial..Food is good and the kit Chen staff are also good,......",VinodSingh2015,/Profile/VinodSingh2015,"Southampton, United Kingdom",40
haridwar,"Few months back while visiting Haridwar, India I stayed at hotel Ganga Exotica top floor room. It had the balcony in the back overlooking river Ganga flowing under my feet. It was exhilarating experience. I think the best hotel experience for the buck I spent. I recommend give it a try next time you are in Haridwar.",kumar3312,/Profile/kumar3312,"South San Francisco, California",50
haridwar,"Well this hotel is situated in the busiest street in the heart of haridwar. We arrived at the hotel after a 6 hour journey from chandigarh and on a friend's recommendation we arrived at ganga exotica. The staff their was very courteous and showed us many options and we finally booked terrace deluxe room. The room was beautifully designed and was very spacious, The view from the terrace was breath taking and was peaceful. i would recommend this hotel to everyone. our stay at The Ganga Exotica was memorable and we would definitely go back there.",mtyagi1611,/Profile/mtyagi1611,"Chandigarh, India",50
haridwar,"Stayed 1 day from 23rd May to 24th May, bad experience. Its simple not worth. Took suite for one day and at checkout time, staff's behavior was rude. Please ignore this hotel as this is not value for money.",Rahul K,/Profile/rahulkmc,"Gurugram (Gurgaon), India",10
haridwar,"We booked this hotel for our weekend stay in Haridwar. Deluxe Terrace Room i stayed in was spacious and the interior was simple and elegant. It had great view of the temple. Rooftop Restaurant is a delight, it provides great view of the River Ganga and a very soothing atmosphere. The meals served were hot and delicious and the room service was first class.  All in all it was a pleasant & enjoyable stay!!!!",shreyjain22,/Profile/shreyjain22,"New Delhi, India",50
haridwar,"we arrived at the hotel after 7 h journey from Delhi  ! the staff is very helpfully and kind ! the room with AC and great view to hill / temple.  brunch and dinner at roof top, viewing Ganga River and sun set is very pleasing ! we stay 4 days , and it's not enough to see and feel Haridwar ! Highly recommended !",Claudio L,/Profile/396claudiol,"Porto, Portugal",40
haridwar,I feel like keep going back to the hotel.. The view from the terrace is breath taking.. Just standing there takea u in a diff world... The food quality and rooms are also very good.. All in all a complete experience.....,Charujain,/Profile/Charujain,,50
haridwar,"Have been to Haridwar a few times but never got this experience during our stay at this Hotel last month anywhere else we have stayed.  The Rooms were value for money, clean, beautifully ambiance, excellent view of Gangaji from the Room. The staff were very attentive and courteous.  The Food was amazing we we had on their terrace Restaurant.  The Ghat on the Ganges river in the Hotel gave us a wonderful feeling  so neat & clean with complete privacy.  We would surely stay at this Hotel again during our visit to Haridwar. We thank the Hotel staff for giving us such a memorable stay !",CSB15,/Profile/CSB15,"Manali, India",50
haridwar,"Although i didnt stayed but i checked them over net and gave a visit.  Pros - the Executive Suite had a Balcony river facing with a set of chair to sit and enjoy a river side tea (but was disappointed as it was a 2 bedroom suite). Toilet were clean and good for both smaller rooms and bigger suite  Cons - the smaller room very actually very small, there was a peculiar smell in the entire hotel. Also while i didnt notice - my wife said that the walls of the room were  tampeed. The lift was very small, if four people have to take the lift they would just fit in the lift  Overall if you are planning to book a suite , then you can stay here given that smell is not there and they dont offer you basement room  And the last thing, the prices mentioned on any travel website for them, you",Amit K,/Profile/asda2233,dfsas,30
haridwar,"I will call this a complete property. The view from the terrace over the ganges is spectacular ! The rooms are very comfortable and beautiful. They recently renovated the entire property. The food is very delicious and the staff is the best, very courteous, helpful and always smiling. Cherry on the cake was private ghat. Got to meet the owner too, Mr. Naman Agarwal. He was very friendly and a lot helpful, he actually helped me plan my whole trip around Haridwar.",shobhit_choudhary,/Profile/shobhit_choudhary,"Udaipur, India",50
haridwar,"I have been there for three days, it's one of the best choice inside Haridwar, so you can easily image the levels and standards of the other hotels. The price is to high, there are not real facilities, nor a breakfast room. Interesting is the terrace with a view on the Ganges. The personnel and staff are not really well trained but smiling and warmly welcoming",Pietro L,/Profile/547pietrol,"New Delhi, India",20
haridwar,"I visited Haridwar after several years, and had the most delightful stay in this family owned  boutique hotel. The best part of the hotel was the view. I could see the Holy Rives Ganges flowing, right from my room, the entire wall overlooking the river was made of glass windows. I would spend the evening with a cup of tea, just relaxing, and absorb the tranquillity of the place. The hotel had a private ghat below, which was very convenient, and gave me privacy while bathing. The main shrine for Hindus, Har-ki-Pauri, was very near, and the hotel staff were adept and prompt and helpful in organising all kinds of trips, from religious trips for visiting temples  to adventure sports like river rafting and safaris. Prices were reasonable, and food was excellent, and you can order",LeelaDelhi,/Profile/LeelaDelhi,delhi,40
haridwar,"Looking out of your room, you can see the Holy Ganges flowing right below... Friendly Staff... Interiors are best in the town... Has private bathing ghat...Rates can be negotiated at the time of check-in !",R0hit_24,/Profile/R0hit_24,"New Delhi, India",50
haridwar,Nice rooms with excellent view of ganga. Take ganga side room. Good interior work. Owner was very Friendly. Delicious food. Rates can be negotiated. Travel site rates are costlier than direct booking. Ample parking space. Private ghat to take bath.  ,Mukesh K,/Profile/824mukeshk,,50
haridwar,"I have been to this place many times - before and after it's recent change. The latest hotel look is awesome, with all the facilities, amazing classy beds, washrooms and other amenities. You have your own private Ghat and can spend some amazing time at the rooftop Restuarant that they have! It's amazing to feel the chill, sip coffee and feel the serene Ganga.   Hotel staff was really well behaved and was courteous. I highly recommend this hotel for any type of stay! ",Anshul J,/Profile/193anshulj,,50
