location,review,name,user_profile,userloc,rating
bageshwar,"Well those who have read my review on KMVN Mohaan may proceed further on my travelogue here on. It was a fine 8th October morning, we proceeded towards Kausani.As we have pointed already, our driver Harish Tamta(Mobile: (0)9411090351/9917717101) advised us to visit The Binsar Mahadev temple on our way towards Kausani via Bhatrojkhan.It indeed a very lovely temple of Mahadev ji ..the scenic beauty can only be felt and cant be described.We were very happy as the trip started with a visit to Mahadev temple.we enrooted Ranikhet and reached Kausani around 2pm.The check in was smooth and very fast..it was a spacious picturesque cottage with all modern amenities….Bang top of the premises….the peaks of Mrigathuni and Trishul will greet you all day.It was heavenly.We just sat on the",splendid_01,/Profile/splendid_01,"Kolkata, India",50
bageshwar,"Cottages are nice, spacious and clean.  Staff is courteous and helpful. View of the mountains is awesome. We were 7 friends and we had taken two cottages. 4 adults can easily stay in one cottage as it is quite spacious. Enjoy the natural beauty of kausani and don't forget to have a look at the Himalayas in a moonlit night! ",monaloud,/Profile/monaloud,"Patna, India",40
bageshwar,we stayed for a night in the family room.The carpet was torn in many places and the overall decor (!) of the room was depressing .KMVN  does not use the services of an interior decorator.So lets forget about the colour scheme in the room.Perhaps the lack of competition in this segment makes them lethargic.Budget travelers come here without any expectations   and compromise with whatever is offered.                                                                                          The staff is cooperative  and helpful.Food is not at all bad for that price range.But if one is not on a tight budget there are decent options available  around by stretching a little.Any traveler used to resorts and standard hotels should better avoid this place.Those who are used to sarkari,Ashok N,/Profile/ashokn531,,30
bageshwar,"You get to get a great view of the Himalayan ranges- trishul, nanda devi , mrigathuni etc from your room!!!! It's such a place where you can sit on the balcony and keep looking at the peaks for hours. Visibility is very less during rainy season(July to September) .  Please don't expect the rooms to have luxury amenities.  Book cottages or the rooms in the first floor to have better view. ",venkisangi2010,/Profile/venkisangi2010,"Bengaluru, India",40
bageshwar,"Stayed with family in a cottage. they have mainly 4 types of accommodation, of which cottages recommended for family since it gives a summer home feeling. Its away from busy ares of kausani town, at the end of the upper road. Spread in a large area with many independent  bungalow style cottages (some old and some new ones), restaurant, and common complex of rooms. ample greenery and flowers around. Deodar trees. KMVN is also building some premium treehouse type cottages, which they said would be ready within next couple of years.  Typical govt style maintenance with little nick-nacks here and there, however property was neat & clean. Room service for beverages ( non alcoholic) and snacks, for meals you need to go to vast common restaurant. Service is quick and people very agile",kcpdelhi,/Profile/kcpdelhi,"New Delhi, India",40
bageshwar,I have stayed in six KMVN tourist rest houses and among others the Kausani Rest house is very ill maintained.   I believe there are number of hotels with better view and definitely better managed.  The location is good but the houses in the front obstructs the view - I would suggest staying in hotel near gandhi Ashram as that place provides better view of the himalayan range.,SANDITAM,/Profile/SANDITAM,"Kolkata, India",30
bageshwar,"We lived in Cottage 7&8. We had an independent access to adjoining rooms which gave us absolute privacy with a gate. Even our car had exclusive parking around 10 steps down. The pictures of sunrise are attached which is visible from the cottage. The staff was very hospitable. The food was like homemade and was very comfortable. The staff also advises very well on things to do and helps promote their state as a tourist destination. We appreciate their integrated approach and loyalty towards their employer and state of Uttarakhand. There are many new cottages coming up soon with modern amenities. Overall, a super experience, even these cottages were old. ",SujitTandon,/Profile/SujitTandon,"Noida, India",50
bageshwar,Kmvn kausani is an ultimate place to stay in kausani with great views from the resort and nice and clean rooms with all basic amenities... The breakfast and dinner was awesome and quantity and quality of food was great in respect to the charges ...location of the resort is bit far from main kausani town but view of Trishul Peak is worth watching... The staff was friendly and knew how to respect guests,soultraveler,/Profile/soultraveler678,"Gwalior, India",50
bageshwar,"The KMVN Kausani is an age old property run by Uttarakhand Tourism Board. It's at the far end of the hamlet, called zero point. Difficult to reach without a vehicle, would be approx. 2 KM walk on the uphill from Kausani Bazaar. The property is large and spread across 3 tiers. The reception and approx. 20 rooms are at base level with parking facility and a small courtyard. When we visited in May, the whole courtyard was blooming with variety of flowers.  All rooms are valley facing and provide a splendid view of the famous Kumaun and Garwal peaks. For 2 nights/ 3 days that we were there, only on one morning we got a clear view, it was marvelous. Generally in peak summer weather is often cloudy, you need to be here in autumn/ winter for the perfect view. The rest house has large",Arunangshu_Roy,/Profile/Arunangshu_Roy,Mumbai,40
bageshwar,"I had booked for a cottage thru KMVN online but when the room was given, it had all sorts is issues - dusty carpetted gloor of store room, bathroom toilet flush not working , shower part missing, geyser taking huge time to hear up water. I asked for fixing these or upgrade my room to a better one only to be refused stating lack of availability. After sometime I want to the reception and found tripadvisor certificate & introduced myself as a tripadvisor contributor & again requested for either an upgrade or to have all these defect photos shared in tripadvisor. It was then I was provided a far better cottage with better facilities though with an additional cost. The dining room staff also weren't flexible, when requested for a maggi for my sick son instead of the regular options,",Kaushik_Basu_1969,/Profile/Kaushik_Basu_1969,"Kolkata, India",30
bageshwar,"it is anice place and you can also view the mountain ranges from your room. but there is 1 problem,they give no room service which is difficult for elderly people since you have to go down to have your food. sometimes the food is raw(i stayed there for 2 days. on the 2nd day the the chicken curry was raw and blood was coming out)",Niharika Ray,/Profile/niharika394,"Kolkata, India",30
bageshwar,"We visited this place in February last year and lucky to see excellent sun rise and Himalayan mountain peaks from Hotel. Very peaceful place to stay and enjoy sun bath with excellent mount view.Booking can be done online , cottages are comfortable having heaters and hot water arrangement . Food is also good.",H L S,/Profile/629hls,,40
bageshwar,"visited 18th April 2016.  We booked two cottages .they gave us twin type cottages which are in front of Himalaya range ,can see from cottage.  Very clean & nicely maintained properties.they were having separate sapce & can get privacy.  Rooms are clean.Reastutant is not very near ,but when you want to have nature with you,you have to do that much atleast.it is hardly 500 mt from my cottage.  Food was basic but very testy.They asked about our choice & they served us.  Breakfast was included in rent & sufficient & tasty.  Staff is very polite.this we experienced across all three properties we stayed in KMVN.  Place to stay for two days.no need to go out from this property.just relax & chill out.",umesh d,/Profile/umeshdamle,"Thane, India",50
bageshwar,"This was my second visit and I stayed in the same room, the infrastructure has improved very mush. Bathroom fittings has been upgraded and the quality of the food has improved a lot. Breakfast items are very good. The property garden is very well maintained. I stayed in super deluxe, however due to the forest fire none of the peaks are visible now. I suggest not to visit the place in the next month also till it rains and the skies are clear. Kausani in general was hot around this time which is rather alarming.",prithvirajbose,/Profile/prithvirajbose,"Kolkata, India",50
bageshwar,"Secluded & serene place surrounded by woods. Reasonable rates, good rooms, homely food. Best place to rewind & rejuvenate.  Better to book room in advance through KMVN website. If weather permits you will get one of the best view of Himalayas.",Aseem A,/Profile/121aseem,"Kolkata, India",40
bageshwar,"Our purpose of visit to Kausani was quite clear..we wished for a place which was calm, beautiful, secluded and in the lap of nature. This Rest House provided all that. We spent 4 amazing days at this rest house during the month of April. We stayed in cottage no. 7 and 8 which I am pretty sure were the best in terms of location and view. The rooms were clean  and tidied up. We had our own front yard where one could spend the afternoons enjoying the warm sunshine. The food is simple and delicious, the kind you wish when away from home. They provide good amenities although the property could use some regular maintenance.  The staff is polite and courteous. They have their taxies which you could hire for sightseeing. The place is close many attractions. Baijnath Temple, Tea garden,",Apoorva S,/Profile/apoorvas530,"Lucknow, India",50
bageshwar,"Amazing place, the cottages on top of the property are the best. Specially the one on the top. Gives a great view of the valley below. The rose garden near common restaurant is beautiful. The only drawback is the limited menu. Though the food is tasty. Nature walk around the guest house are perfect. Great to sit outside the cottages early morning and night, although beware of the monkeys so avoid any eatables outside....if you want to feel among the nature with no disturbance, these cottages are the place to be. ",Eternal Vagabond,/Profile/sachintrivedi333,"National Capital Territory of Delhi, India",40
bageshwar,"I visited Kausani on 19 Mar 2016 and stayed for one night , Found the place amazing, Its very peaceful and away from the crowd and at the end of the road. Place is not toned up with the latest gadgets since I presume its a govt. run property, Rooms are OK & basic, we stayed in room no 104 & 105. lots of monkeys so please be careful not to leave doors open, think they should do something about this since tourists would prefer to sit out and enjoy nature but with monkeys it is dangerous. food is reasonable and not very awesome , very limited menu so please don't expect too much, Property can be toned up to a great extent if KMVN wants to do it and be the best property of the town coz of location. They are still expanding & hopefully the new wings are tasteful done. they still have",RSP2014,/Profile/RSP2014,"New Delhi, India",30
bageshwar,"It was our end of the travelling plan when we arrived at Kausani. This was the second time I was coming and wished to stay in a hotel rether than the Ashram.  The booking was done online and with emails. The rest house is a the end of the motor able road.  We had booked a super deluxe room on first floor with option to stay for 3 adults. Thought the room was adequate but once you place every thing the space becomes a little congested for 3. The balcony is the best thing in these rooms with full view of the Hymalyan peaks.  Bathroom was ok, though the towl supplied was  semi torn.  Presently they do not serve the meals at rooms and so you have to go to the dining hall to have them. The hall is quite spacious and cozy. Breakfast was complementary, different is different days and",suparna_k_pal,/Profile/suparna_k_pal,"Kolkata, India",50
bageshwar,"What can I say about a trip to the Himalayas in winter that hasn't already been said? The glorious sunshine on the sparkling peaks, that lovely chill in the air, and some amazing views from our cottage - all added up to a divine year-end experience. What surprised me was the quality of food - I didn't expect much from this place, but boy did the food taste good! The staff is very helpful, and our five days and four nights at this property were the best way we could celebrate the holiday season.",wordsncolors,/Profile/wordsncolors,"Kolkata, India",50
bageshwar,Stay in cottage 7 or 8 to have Uttaranchal Himalaya view from the wonder of the Cottage will you have tea stamp duty the Himalayan range quality of food service also delicious try Kumaoni mutton. Visit tea garden of Kausani ,HotatSangha,/Profile/HotatSangha,"Noida, India",40
bageshwar,"Located overlooking the great Himalayan range - from where one can site Mt. Nandaghunti, Mt. Trishul, Mt. Mrigasthuni, Mt. Nandadevi, Mt. Nandakot etc. The rooms are specious and comfortable with hot running water in the bathroom. The food arrangement is basic and staff relatively helpful. However when you watch breathtaking reflection of the rising or setting sun on Mt. Trishul - everything else becomes secondary.",Anirban M,/Profile/283anirbanm,"Kolkata, India",40
bageshwar,The location of this Tourist Rest House is as usual good. Any one can view so many peaks at a time and nearer in compared to Ranikhet. The tariff of all the KMVN Tourist Rest House is inclusive of free breakfast. Kausani is a hill town for perfect idle vacation.,abhijitghosh12003,/Profile/abhijitghosh12003,"Dehradun, India",50
bageshwar,"Stayed in a cottage for one night in Nov. The location is very nice and room service is also good. Staff are courteous. However, property is not well maintained but the view from cottage is breathtaking. Very peaceful place to stay. Lots of monkeys there, so you should be a bit careful. Complementary breakfast is included in the tariff. If you want to enjoy some good moments with your family in the lap of nature, this is a good place to stay.",saumitra s,/Profile/saumitras,New Delhi,30
bageshwar,"Some like service, some like facilities near the hotel, some like food, but if your most important requirement is a nice cozy bed deep inside a nature resort....well this place is for you. Wake up with thousands of birds chirping around your room and a well deserved wide open sky where sun sets or wake up with you when the wind is whispering away through the pine, spruce trees surrounding your small little nest at the hill side, multi coloured flowers dancing around your doorstep.....then rest all are immaterial.......just sip the hot tea and live .....breathe ......and thank yourself for choosing this place........rest for you to say......food is good enough to make you calm and good for your inner peace...",Paribrajok,/Profile/Paribrajok,"Kolkata, India",50
bageshwar,Location of the Hotel is ultimate. No doubt you can see the spectacular views of great Himalayan peak only if the weather is clear. I had visited this place and hotel in the month June. The temperature is high as expected and required fan to sleep and sit. The cottages are build at best locations. The only big issue with the hotel is lack of maintenance and ok type cleanliness. The cottages are built in pair. The only way to enjoy the Kausani and hotel is to stay for more than 2 days.     You can enjoy morning walk at Tea garden very adjacent to the hotel. Food is ok and reasonable.  Staff was friendly. It is advisable that the hotel should be booked in advance through their website.,802manpreets,/Profile/802manpreets,,40
bageshwar,"Stayed in KMVN TRH at Kausani this October'15, in a Four bedded Super delux room. Room tariff included buffet breakfast. These Four bedded ( 4 rooms) & double bedded (8 rooms) super delux rooms are situated in ground floor & 1st floor of a building, near Dining Hall & reception area, accessible by a short walk with 6 steps of stairs. Rest are delux & super delux cottages, spreaded around slope of hills and accessible by stairs and ascending roads. Maintenance of property is average but doesnot cause any inconvenience. Food was basic, homely kind and tested very good. Service was good. Room,Toilet, linens were neat & clean. Garden was beautiful with seasonal flowers and panoramic view of Himalayas. All in all - a nice stay among nature.",skyvalley2014,/Profile/skyvalley2014,"Kolkata, India",40
bageshwar,KMVN TRH location is not unique - many other hotels share the view of Himalayas as TRH and the hotel is very glaringly old and badly needs repairs. So old that it just puts you off. The location is I would say a disadvantage - it is at the end of Kausani without actually giving you any added advantage of views etc. Why would I travel 3 km up the hill to stay in a old decrepit hotel?  Good part is the food and the staff. Staff are all sarkari employees but not as bad as one would expect. They followup with guests to take orders and keep tabs on who is having food at the restaurant and how is not - and duly followup. Food is good by Kausani standards but very oily.  One will go back there for low prices and accessible restaurant and staff. Rest of the features are not unique,BuzDriver,/Profile/BuzDriver,"Gurugram (Gurgaon), India",30
bageshwar,"I had visited the hotel a couple of years back (the website does not allow me the option of an older date).  The hotel has a breathtaking view. If you are lucky to have clear weather, you could spend an eternity on the balcony looking straight ahead at the majestic Himalayas. However, in the event that your not in the balcony but back in the room, reality stuck. The rooms though spacious were not very clean and needed some maintenance efforts. The dining area needed some attention as did the food which was nothing to write home about. The staff was friendly and eager to help.",Travel Junkie,/Profile/writtikam,"Hyderabad, India",30
bageshwar,"This is very good and well maintained KMVN property and probably one of the best KMVN property. It's very well located and you get very good view of Himalayan range, even from some of the rooms also. Very peaceful and surrounded by nature. Excellent experience.",VAS27,/Profile/VAS27,Mumbai,50
bageshwar,"Overall nice place to stay. If you don't want to do much R&D for your stay, please go for KMVN Kausani. We stayed in May-Jun for 2 nights. Key points to note: 1. Nice place. You could see the Himalayas sitting from your room. 2. Nice Food. Non Veg is available. But check for the quantity before placing order. We found the quantity on the higher side. 3. Rooms are decent. The property is a bit old. It does not offer resort like ambience. 4. Offers online booking and check-in / check-out was cool.  5. Overall we were pleased for our stay. It was value for money.   A few points on Room Tips: 1. We stayed in 4 Bed Deluxe room. There are four rooms in this category. Two of them are in ground floor and two of them are in first floor. We found the rooms on first floor much better as",GautamChakraborty,/Profile/GautamChakraborty,,40
bageshwar,"We stayed at KMVN guest house for two days during our visit to Kausani. The location is awesome. We stayed in one of their cottage which has a bed room with attached toilte, small sitting cum living room and a storage cum dressing room. Two adjacent cottage share the same portico where you can take tea, or drinks and get the full view of mountain peaks. Although the room required a face lift, it was  clean and toilet was fitted with modern and basic amenities. We saw some of the cottage were being renovated during our visit. The restaurant was cheap and very good. Check in and checkout processes were very smooth. Staffs were very nice  and extremely helpful. Initially we were sceptical about the guest house as it was run by Govt enterprises, but frankly speaking we received the",jayanta9,/Profile/jayanta9,"Kolkata, India",40
bageshwar,Views are good but Stinking and dirty rooms with lots of spiders broken and damaged furniture. Wash rooms stink poor fittings. Uncomfortable mattresses dirty bed sheets & blankets.  Will never ever stay at KMVN again.   ,Yash A,/Profile/360yasha,,10
bageshwar,"Nicely located but worst possible maintenance. Building dilapidated, staircases look like collapsing any moment. Carpets dirty and torn at the floor. Rats roaming freely in the rooms. Rats kept on disturbing us for the entire night and we could not sleep for most of the time. Government should seriously consider renovating the rooms.  The flower garden and the surrounding is nice. ",ArindamC_Kolkata,/Profile/ArindamC_Kolkata,"Kolkata, India",10
bageshwar,Kmvn trh anywhere has great locational advantage. Makes up for everything. The room was very small. But just step out and you are practically in the mountains. Sunrise is visible from there only. Sunset point is a short distance away. Staff is courteous and helpful. Enjoyed our stay.,rashmib53,/Profile/rashmib53,"Kolkata, India",40
bageshwar,"KMVN Trishul probably occupies the most vantage spot in entire Kausani. Yet, the view of the majestic mountains get interrupted by trees, wires and telephone poles. Don't expect facilities like a hotel at KMVN guesthouses. And anyway, for similar size rooms and location, the prices in private properties would be at least twice of what KMVN charges. We stayed in cottages which offer better view but are further away from dining area. On the whole, felt a little underwhelmed by Kausani as natural beauty and climate is better at Ranikhet, Sitlakhet but overall, a nice place for a short holiday.",VineetBh,/Profile/VineetBh,"New Delhi, India",40
bageshwar,"A place of meditative calmness and complete tranquillity, where the Himalayas unravels all its beauty. In the lap of nature enriched with diverse flora and fauna, the palette of Kausani is vibrant with a tint of every hue - the stretched green, the far away blue ranges, the red-soiled grounds with green lawns and grey streets, & the crowning silvery picks that dazzles like a silver string and beyond all of this is the vast sky which itself is a blend of many colours.  It is almost in the summit region, which is less populated and will allow you your time to spend amidst nature. And in contemplation too, you will get awestruck with the view - specially of the mountain picks - the Panchachulli - the glorious silvery string hung in clouds that reflects the tinged sky, against which",bhaveshnigam,/Profile/bhaveshnigam,"New Delhi, India",50
bageshwar,"We stayed in KMVN TRH, Trishul in Kausani and had a wonderful time there. We stayed there in two cottages for two nights in the fourth week of September, 2014 and even though the sky was not clear enough to offer a good view of the Himalayan ranges, it was indeed a very nice stay given the hospitality we received and the peaceful and wonderful atmosphere we found ourselves in. We got there just after evening had descended upon Kausani and we were cordially received by the manager in the reception. Thence we proceeded towards the per-booked cottages which were higher up. The cottages are beautifully located at different levels. Rest of the cottages are located at higher levels. The cottages are spacious. It was such a beautiful experience watching the beautiful birds around us,",BIBEK B,/Profile/Bibek12,"Kolkata, India",50
bageshwar,The rest house location is excellent. The rooms/cottages need renovation. The picturesque view of Himalayan ranges offered from the TRH rooms/cotttages compensate the room conditions. Food is good and served hot n fresh. Staff is courteous.,Suyog Gore,/Profile/SuyogGore,"Pune, India",30
bageshwar,"Went there on 14th april with family ......check in was smooth , select a family cottage ...spacious room ,spacious bathroom with modern feature  , lots of variety in dinner but limited option in breakfast but it was tasty , view from cottage was beautiful ..see the pics  Staff is ready to help anytime  tip ..... if you love to drink then bring it from haldwani or ranikhet because no wine shop in kausani and this trh is 3 kms up on the hills from town so it will be better to come here with your vehicle or hire a vehicle here itself  enjoy the beauty of kausani  MANISH",Manish Agarwal,/Profile/manish1803,"Moradabad, India",50
bageshwar,"This was the last KMVN TRH we visited on our trip. Kausani being a famous hill station, we saw many tourists and groups in and near the city. On our way to Kausani, we were hit by heavy rain which started from Bageshwar till we reached the hotel. The heavy rain was accompanied by thunderstorms as well.  Hotel: Hotel is located on a hillock just off the main road. It is an old property. Must be some bungalow colony in old times which KMVN now converted in a TRH. It has cottages as well as normal rooms. The property is spread in wide area and looks nice. Especially, after the rain, it was nice.  Room: Since, cottages are nothing but old bungalows converted to cottages, it appears from the set-up. The rooms are spacious. There is a sit-out for cottage and they have placed a single",KeKu,/Profile/Kedar-KeKu,Pune,40
bageshwar,It is nice KMVN property on a cliff at the end of the road with excellent Himalayan views. One of the best KMVN tourist rest house. Food quality is descent and service is prompt though the USP of KMVN Trishul is Himalayan views.,Chaitanya_b,/Profile/Chaitanya_b,Mumbai,40
